Enrichment analysis report,,,,,,,,,,,,,
850,Muscle contraction_S1P2 receptor-mediated smooth muscle contraction,30,1.092E-01,1.940E-01,1.196E-01,1.940E-01,4,"CPI-17, PKC-alpha, MLCK, MRLC",1.092E-01,2.213E-01,4,"CPI-17, PKC-alpha, MLCK, MRLC",
851,Development_TGF-beta receptor signaling,52,1.101E-01,1.809E-01,1.101E-01,1.809E-01,6,"p15, SMAD3, Caveolin-1, ER81, TGF-beta receptor type II, ERK1/2",3.975E-01,5.626E-01,4,"p15, Caveolin-1, ER81, TGF-beta receptor type II",
852,Development_FGF-family signaling,52,1.101E-01,1.809E-01,1.101E-01,1.809E-01,6,"PI3K cat class IA, FGF2, ERK2 (MAPK1), AKT(PKB), PKC-alpha, FGF9",2.133E-01,3.599E-01,5,"PI3K cat class IA, FGF2, AKT(PKB), PKC-alpha, FGF9",
853,G-protein signaling_Proinsulin C-peptide signaling,52,1.101E-01,1.809E-01,1.101E-01,1.809E-01,6,"COX-2 (PTGS2), PI3K cat class IA, AKT(PKB), PKC-alpha, G-protein alpha-i family, ERK1/2",2.133E-01,3.599E-01,5,"COX-2 (PTGS2), PI3K cat class IA, AKT(PKB), PKC-alpha, G-protein alpha-i family",
854,Stem cells_mGluR3 signaling in glioblastoma stem cells,52,1.101E-01,1.809E-01,1.101E-01,1.809E-01,6,"AKT(PKB), G-protein alpha-i family, Adenylate cyclase, GLAST1/EAAT1, SLC7A11, ERK1/2",2.133E-01,3.599E-01,5,"AKT(PKB), G-protein alpha-i family, Adenylate cyclase, GLAST1/EAAT1, SLC7A11",
855,Signal transduction_Adenosine A2A receptor signaling pathway,52,1.101E-01,1.809E-01,1.101E-01,1.809E-01,6,"AKT(PKB), SFK, Adenylate cyclase, G-protein alpha-olf, ERK1/2, Collagen III",2.133E-01,3.599E-01,5,"AKT(PKB), SFK, Adenylate cyclase, G-protein alpha-olf, Collagen III",
856,Blood coagulation_GPVI-dependent platelet activation,54,1.121E-01,2.022E-01,1.259E-01,2.022E-01,6,"Syk, Fyn, PKC-alpha, GRAP2, ITGB3, Lyn",1.121E-01,2.259E-01,6,"Syk, Fyn, PKC-alpha, GRAP2, ITGB3, Lyn",
857,Regulation of AKT(PKB)/ GSK3 beta cascade in bipolar disorder,54,1.121E-01,2.022E-01,1.259E-01,2.022E-01,6,"NGF, G-protein alpha-i1, PI3K cat class IA, FGF2, AKT(PKB), G-protein alpha-i family",1.121E-01,2.259E-01,6,"NGF, G-protein alpha-i1, PI3K cat class IA, FGF2, AKT(PKB), G-protein alpha-i family",
858,Serotonin modulation of dopamine release in nicotine addiction,42,1.129E-01,2.021E-01,1.253E-01,2.021E-01,5,"HTR3, PKC, GABA-A receptor, G-protein alpha-i family, Adenylate cyclase",1.129E-01,2.269E-01,5,"HTR3, PKC, GABA-A receptor, G-protein alpha-i family, Adenylate cyclase",
859,Inhibition of WNT5A-dependent non-canonical pathway in colorectal cancer,19,1.159E-01,1.896E-01,1.159E-01,1.896E-01,3,"Beta-catenin, PKC-alpha, TCF7 (TCF1)",3.273E-01,4.904E-01,2,"PKC-alpha, TCF7 (TCF1)",
860,Immune response_Neurotensin-induced activation of IL-8 in colonocytes,41,1.161E-01,1.896E-01,1.161E-01,1.896E-01,5,"ERK2 (MAPK1), PKC-alpha, IL-8, NT, G-protein alpha-i family",2.427E-01,3.945E-01,4,"PKC-alpha, IL-8, NT, G-protein alpha-i family",
861,Apoptosis and survival_Role of PKR in stress-induced apoptosis,53,1.179E-01,1.919E-01,1.179E-01,1.919E-01,6,"Caspase-8, p53, TLR3, IFN-beta, TLR4, ERK1/2",6.402E-01,7.912E-01,3,"TLR3, IFN-beta, TLR4",
862,"Development_Insulin, IGF-1 and TNF-alpha in brown adipocyte differentiation",53,1.179E-01,1.919E-01,1.179E-01,1.919E-01,6,"FOXC2, PPARGC1 (PGC1-alpha), Beta-2 adrenergic receptor, AKT(PKB), IRS-2, ERK1/2",2.246E-01,3.748E-01,5,"FOXC2, PPARGC1 (PGC1-alpha), Beta-2 adrenergic receptor, AKT(PKB), IRS-2",
863,Development_Osteopontin signaling in osteoclasts,30,1.196E-01,1.940E-01,1.196E-01,1.940E-01,4,"Syk, Actin cytoskeletal, CD44, MSN (moesin)",2.793E-01,4.382E-01,3,"Syk, CD44, MSN (moesin)",
864,T regulatory cells in asthma,30,1.196E-01,1.940E-01,1.196E-01,1.940E-01,4,"STAT3, MHC class II, SMAD3, TGF-beta receptor type II",5.578E-01,7.195E-01,2,"MHC class II, TGF-beta receptor type II",
865,Neurophysiological process_Kappa-type opioid receptor in transmission of nerve impulses,31,1.196E-01,2.078E-01,1.308E-01,2.078E-01,4,"Kir3.4, DREAM, G-protein alpha-i family, Kappa-type opioid receptor",1.196E-01,2.373E-01,4,"Kir3.4, DREAM, G-protein alpha-i family, Kappa-type opioid receptor",
866,CCL2 in Prostate Cancer,20,1.210E-01,2.078E-01,1.303E-01,2.078E-01,3,"AKT(PKB), CCL2, G-protein alpha-i family",1.210E-01,2.379E-01,3,"AKT(PKB), CCL2, G-protein alpha-i family",
867,Role of XBP1 protein in multiple myeloma,20,1.210E-01,2.078E-01,1.303E-01,2.078E-01,3,"IL-6, BOB1, BLIMP1 (PRDI-BF1)",1.210E-01,2.379E-01,3,"IL-6, BOB1, BLIMP1 (PRDI-BF1)",
868,Immune response_Antimicrobial actions of IFN-gamma,43,1.217E-01,2.126E-01,1.349E-01,2.126E-01,5,"IDO1, TLR3, NGAL, Staf-50, MD-2",1.217E-01,2.379E-01,5,"IDO1, TLR3, NGAL, Staf-50, MD-2",
869,Signal transduction_Modulation of calcium and potassium channels by Adenosine A1 receptor,43,1.217E-01,2.126E-01,1.349E-01,2.126E-01,5,"cPKC (conventional), PKC-alpha, cPLA2, G-protein alpha-i family, Adenylate cyclase",1.217E-01,2.379E-01,5,"cPKC (conventional), PKC-alpha, cPLA2, G-protein alpha-i family, Adenylate cyclase",
870,Role of TNF-alpha in type 2 diabetes in skeletal muscle cells,42,1.253E-01,2.021E-01,1.253E-01,2.021E-01,5,"PPARGC1 (PGC1-alpha), HGK(MAP4K4), PKC-theta, ERK2 (MAPK1), PKC-alpha",2.564E-01,4.132E-01,4,"PPARGC1 (PGC1-alpha), HGK(MAP4K4), PKC-theta, PKC-alpha",
871,Apoptosis and survival_BAD phosphorylation,42,1.253E-01,2.021E-01,1.253E-01,2.021E-01,5,"BAD, PI3K cat class IA, AKT(PKB), EGFR, ERK1/2",4.813E-01,6.459E-01,3,"PI3K cat class IA, AKT(PKB), EGFR",
872,Inhibition of GTPase prenylation by statins in asthma and COPD,42,1.253E-01,2.021E-01,1.253E-01,2.021E-01,5,"COX-2 (PTGS2), IL-6, AKT(PKB), IL-8, ERK1/2",2.564E-01,4.132E-01,4,"COX-2 (PTGS2), IL-6, AKT(PKB), IL-8",
873,Immune response_IFN-gamma signaling via JAK/STAT and PLC-gamma,54,1.259E-01,2.022E-01,1.259E-01,2.022E-01,6,"STAT3, NOXA, Fyn, PKC-alpha, XAF1, Aquaporin 1",2.360E-01,3.873E-01,5,"NOXA, Fyn, PKC-alpha, XAF1, Aquaporin 1",
874,Development_Differentiation of white adipocytes ,54,1.259E-01,2.022E-01,1.259E-01,2.022E-01,6,"FOXC2, PPARGC1 (PGC1-alpha), BMP4, PSAT, BMP2, ERK1/2",2.360E-01,3.873E-01,5,"FOXC2, PPARGC1 (PGC1-alpha), BMP4, PSAT, BMP2",
875,Muscle contraction_ACM regulation of smooth muscle contraction,56,1.275E-01,2.236E-01,1.428E-01,2.236E-01,6,"TRPC4, CPI-17, PKC, MLCK, MRLC, ACM3",1.275E-01,2.474E-01,6,"TRPC4, CPI-17, PKC, MLCK, MRLC, ACM3",
876,Neurogenesis_NGF/ TrkA MAPK-mediated signaling,105,1.294E-01,2.075E-01,1.294E-01,2.075E-01,10,"NGF, SHPS-1, PLAUR (uPAR), SGK1, SORBS1, RGS2, Fra-1, Ephrin-A receptor 2, ERK1/2, MEF2C",1.957E-01,3.359E-01,9,"NGF, SHPS-1, PLAUR (uPAR), SGK1, SORBS1, RGS2, Fra-1, Ephrin-A receptor 2, MEF2C",
877,Stem cells_Putative pathways of telomerase regulation in glioblastoma stem cells,20,1.303E-01,2.078E-01,1.303E-01,2.078E-01,3,"PI3K cat class IA, AKT(PKB), p53",3.502E-01,5.162E-01,2,"PI3K cat class IA, AKT(PKB)",
878,wtCFTR and deltaF508-CFTR traffic / Clathrin coated vesicles formation (normal and CF),20,1.303E-01,2.078E-01,1.303E-01,2.078E-01,3,"Actin cytoskeletal, AP180, Actin",3.502E-01,5.162E-01,2,"AP180, Actin",
879,Th2 cytokine-induced alternative activation of alveolar macrophages in asthma,32,1.305E-01,2.235E-01,1.424E-01,2.235E-01,4,"CHI3L1, ST2(L), Eotaxin-2, IL-33",1.305E-01,2.510E-01,4,"CHI3L1, ST2(L), Eotaxin-2, IL-33",
880,Selective Insulin resistance in type 2 diabetes in liver,32,1.305E-01,2.235E-01,1.424E-01,2.235E-01,4,"PPARGC1 (PGC1-alpha), PKC-theta, AKT(PKB), IRS-2",1.305E-01,2.510E-01,4,"PPARGC1 (PGC1-alpha), PKC-theta, AKT(PKB), IRS-2",
881,Development_Activation of ERK by Kappa-type opioid receptor,31,1.308E-01,2.078E-01,1.308E-01,2.078E-01,4,"ERK2 (MAPK1), PKC-alpha, G-protein alpha-i family, Kappa-type opioid receptor",2.964E-01,4.587E-01,3,"PKC-alpha, G-protein alpha-i family, Kappa-type opioid receptor",
882,Development_FGF and BMP signaling in early embryonic hepatogenesis,31,1.308E-01,2.078E-01,1.308E-01,2.078E-01,4,"FGF2, BMP4, BMP2, ERK1/2",2.964E-01,4.587E-01,3,"FGF2, BMP4, BMP2",
883,Immune response_IL-23 signaling pathway,31,1.308E-01,2.078E-01,1.308E-01,2.078E-01,4,"STAT3, PI3K cat class IA, AKT(PKB), STAT4",2.964E-01,4.587E-01,3,"PI3K cat class IA, AKT(PKB), STAT4",
884,Impaired Lipoxin A4 signaling in CF,44,1.308E-01,2.258E-01,1.447E-01,2.258E-01,5,"G-protein alpha-q/11, EGFR, G-protein alpha-i family, Adenylate cyclase, PDGF-R-beta",1.308E-01,2.510E-01,5,"G-protein alpha-q/11, EGFR, G-protein alpha-i family, Adenylate cyclase, PDGF-R-beta",
885,Development_Thrombopoietin signaling via ERK1/2 and PI3K,67,1.314E-01,2.086E-01,1.314E-01,2.086E-01,7,"HOXA9, NF-E2 (45 kDa), PI3K cat class IA, AKT(PKB), IRS-2, BMP4, ERK1/2",2.280E-01,3.780E-01,6,"HOXA9, NF-E2 (45 kDa), PI3K cat class IA, AKT(PKB), IRS-2, BMP4",
886,B cell signaling in hematological malignancies,80,1.342E-01,2.124E-01,1.342E-01,2.124E-01,8,"STAT3, Syk, IL-6, AKT(PKB), CD38, Lyn, CD70(TNFSF7), PI3K cat class IA (p110-delta)",2.197E-01,3.680E-01,7,"Syk, IL-6, AKT(PKB), CD38, Lyn, CD70(TNFSF7), PI3K cat class IA (p110-delta)",
887,Tau pathology in Alzheimer disease,55,1.343E-01,2.124E-01,1.343E-01,2.124E-01,6,"PKC, ERK2 (MAPK1), Caspase-8, NR2, MAP2, ERK1/2",6.651E-01,8.110E-01,3,"PKC, NR2, MAP2",
888,Development_Fetal brown fat cell differentiation,55,1.343E-01,2.124E-01,1.343E-01,2.124E-01,6,"PPARGC1 (PGC1-alpha), PI3K cat class IA, AKT(PKB), IRS-2, Adenylate cyclase, ERK1/2",2.477E-01,4.006E-01,5,"PPARGC1 (PGC1-alpha), PI3K cat class IA, AKT(PKB), IRS-2, Adenylate cyclase",
889,Neurophysiological process_HTR1A receptor signaling in neuronal cells,43,1.349E-01,2.126E-01,1.349E-01,2.126E-01,5,"ERK2 (MAPK1), Kir3.4, G-protein alpha-i family, Adenylate cyclase, MAP2",2.702E-01,4.284E-01,4,"Kir3.4, G-protein alpha-i family, Adenylate cyclase, MAP2",
890,Nicotine signaling (general schema),21,1.351E-01,2.258E-01,1.452E-01,2.258E-01,3,"nAChR alpha-7, HTR3, GABA-A receptor",1.351E-01,2.587E-01,3,"nAChR alpha-7, HTR3, GABA-A receptor",
891,Muscle contraction_Role of kappa-type opioid receptor in heart,33,1.417E-01,2.394E-01,1.545E-01,2.394E-01,4,"Beta-2 adrenergic receptor, G-protein alpha-i family, Adenylate cyclase, Kappa-type opioid receptor",1.417E-01,2.681E-01,4,"Beta-2 adrenergic receptor, G-protein alpha-i family, Adenylate cyclase, Kappa-type opioid receptor",
892,Putative pathways for stimulation of fat cell differentiation by Bisphenol A,32,1.424E-01,2.235E-01,1.424E-01,2.235E-01,4,"Beta-catenin, PPARGC1 (PGC1-alpha), PI3K cat class IA, AKT(PKB)",3.135E-01,4.750E-01,3,"PPARGC1 (PGC1-alpha), PI3K cat class IA, AKT(PKB)",
893,Development_Transcription regulation of granulocyte development,32,1.424E-01,2.235E-01,1.424E-01,2.235E-01,4,"STAT3, c-Fes, PKC, CD13",3.135E-01,4.750E-01,3,"c-Fes, PKC, CD13",
894,Platelet activation as a result of endothelial dysfunction after stenting,56,1.428E-01,2.236E-01,1.428E-01,2.236E-01,6,"Actin cytoskeletal, PKC, PDE3A, PLAT (TPA), G-protein alpha-i family, Adenylate cyclase",2.595E-01,4.157E-01,5,"PKC, PDE3A, PLAT (TPA), G-protein alpha-i family, Adenylate cyclase",
895,Development_Flt3 signaling,44,1.447E-01,2.258E-01,1.447E-01,2.258E-01,5,"BAD, Fyn, PI3K cat class IA, AKT(PKB), ERK1/2",5.127E-01,6.787E-01,3,"Fyn, PI3K cat class IA, AKT(PKB)",
896,Chemotaxis_C5a-induced chemotaxis,44,1.447E-01,2.258E-01,1.447E-01,2.258E-01,5,"Actin cytoskeletal, G-protein alpha-15, G-protein alpha-i family, F-Actin cytoskeleton, ERK1/2",7.620E-01,8.737E-01,2,"G-protein alpha-15, G-protein alpha-i family",
897,Development_Beta-catenin destruction complex signaling,21,1.452E-01,2.258E-01,1.452E-01,2.258E-01,3,"Beta-catenin, Tcf(Lef), TCF7 (TCF1)",3.729E-01,5.379E-01,2,"Tcf(Lef), TCF7 (TCF1)",
898,HCV-dependent transcription regulation leading to HCC,21,1.452E-01,2.258E-01,1.452E-01,2.258E-01,3,"STAT3, p53, Cyclin E",7.361E-01,8.609E-01,1,Cyclin E,
899,Regulation of Adenylate cyclase and IMPA1 by lithium in major depressive disorder,22,1.496E-01,2.469E-01,1.606E-01,2.469E-01,3,"G-protein alpha-i1, G-protein alpha-i family, Adenylate cyclase",1.496E-01,2.774E-01,3,"G-protein alpha-i1, G-protein alpha-i family, Adenylate cyclase",
900,LRRK2 and immune function in Parkinson's disease,22,1.496E-01,2.469E-01,1.606E-01,2.469E-01,3,"MHC class II, CD14, IFN-beta",1.496E-01,2.774E-01,3,"MHC class II, CD14, IFN-beta",
901,G-protein signaling_RhoA regulation pathway,34,1.533E-01,2.541E-01,1.669E-01,2.541E-01,4,"Fyn, BMX, Ephrin-A receptors, G-protein alpha-q/11",1.533E-01,2.806E-01,4,"Fyn, BMX, Ephrin-A receptors, G-protein alpha-q/11",
902,Development_BMP signaling in cardiac myogenesis,34,1.533E-01,2.541E-01,1.669E-01,2.541E-01,4,"BMP6, BMP4, BMP2, MEF2C",1.533E-01,2.806E-01,4,"BMP6, BMP4, BMP2, MEF2C",
903,G-protein signaling_G-Protein alpha-q signaling cascades,34,1.533E-01,2.541E-01,1.669E-01,2.541E-01,4,"PI3K cat class IA, AKT(PKB), G-protein alpha-q/11, RGS2",1.533E-01,2.806E-01,4,"PI3K cat class IA, AKT(PKB), G-protein alpha-q/11, RGS2",
904,Apoptosis and survival_Regulation of Apoptosis by Mitochondrial Proteins,33,1.545E-01,2.394E-01,1.545E-01,2.394E-01,4,"BAD, NOXA, Caspase-8, Bcl-B",6.103E-01,7.696E-01,2,"NOXA, Bcl-B",
905,IL-2 as a growth factor for T cells in multiple sclerosis,33,1.545E-01,2.394E-01,1.545E-01,2.394E-01,4,"PCNA, PI3K cat class IA, AKT(PKB), Cyclin E",3.307E-01,4.939E-01,3,"PI3K cat class IA, AKT(PKB), Cyclin E",
906,Development_Activation of ERK by Alpha-1 adrenergic receptors,45,1.549E-01,2.398E-01,1.549E-01,2.398E-01,5,"G-protein alpha-15, Alpha-1B adrenergic receptor, PKC-alpha, Alpha-1D adrenergic receptor, ERK1/2",2.981E-01,4.604E-01,4,"G-protein alpha-15, Alpha-1B adrenergic receptor, PKC-alpha, Alpha-1D adrenergic receptor",
907,Neurophysiological process_PGE2-induced pain processing,47,1.599E-01,2.654E-01,1.760E-01,2.654E-01,5,"COX-2 (PTGS2), PGE2R2, PGE2R4, cPLA2, Adenylate cyclase",1.599E-01,2.907E-01,5,"COX-2 (PTGS2), PGE2R2, PGE2R4, cPLA2, Adenylate cyclase",
908,Microsatellite instability in gastric cancer,22,1.606E-01,2.469E-01,1.606E-01,2.469E-01,3,"PCNA, p16INK4, TGF-beta receptor type II",3.952E-01,5.612E-01,2,"p16INK4, TGF-beta receptor type II",
909,T regulatory cell migration in asthma,22,1.606E-01,2.469E-01,1.606E-01,2.469E-01,3,"Lck, AKT(PKB), G-protein alpha-i family",3.952E-01,5.612E-01,2,"AKT(PKB), G-protein alpha-i family",
910,Development_Prolactin receptor signaling,58,1.607E-01,2.469E-01,1.607E-01,2.469E-01,6,"STAT3, Fyn, PI3K cat class IA, AKT(PKB), NMI, ERK1/2",4.808E-01,6.459E-01,4,"Fyn, PI3K cat class IA, AKT(PKB), NMI",
911,Immune response_CCR5 signaling in macrophages and T lymphocytes,58,1.607E-01,2.469E-01,1.607E-01,2.469E-01,6,"STAT3, Lck, AKT(PKB), PKC-alpha, G-protein alpha-i family, ERK1/2",7.001E-01,8.364E-01,3,"AKT(PKB), PKC-alpha, G-protein alpha-i family",
912,Effect of H. pylori infection on gastric epithelial cell proliferation,58,1.607E-01,2.469E-01,1.607E-01,2.469E-01,6,"p53, HGF receptor (Met), Lyn, EGFR, TLR4, ERK1/2",4.808E-01,6.459E-01,4,"HGF receptor (Met), Lyn, EGFR, TLR4",
913,Triacylglycerol metabolism p.1,60,1.613E-01,2.677E-01,1.795E-01,2.677E-01,6,"ALDR, AKR1C1, ACSL4, AKR1C4, AK1BA, PLCD",1.613E-01,2.921E-01,6,"ALDR, AKR1C1, ACSL4, AKR1C4, AK1BA, PLCD",
914,Regulation of lipid metabolism_Alpha-1 adrenergic receptors signaling via arachidonic acid,71,1.630E-01,2.502E-01,1.630E-01,2.502E-01,7,"COX-2 (PTGS2), PTGIS, Alpha-1B adrenergic receptor, PKC-alpha, Alpha-1D adrenergic receptor, cPLA2, ERK1/2",2.696E-01,4.284E-01,6,"COX-2 (PTGS2), PTGIS, Alpha-1B adrenergic receptor, PKC-alpha, Alpha-1D adrenergic receptor, cPLA2",
915,Transcription_ChREBP regulation pathway,23,1.647E-01,2.654E-01,1.766E-01,2.654E-01,3,"AMPK gamma subunit, G-protein alpha-i family, Acyl-CoA synthetase",1.647E-01,2.953E-01,3,"AMPK gamma subunit, G-protein alpha-i family, Acyl-CoA synthetase",
916,Development_NODAL signaling in early mesendoderm formation,23,1.647E-01,2.654E-01,1.766E-01,2.654E-01,3,"Mixl1, WNT3, BMP4",1.647E-01,2.953E-01,3,"Mixl1, WNT3, BMP4",
917,G-protein signaling_S1P2 receptor signaling pathway,35,1.652E-01,2.677E-01,1.796E-01,2.677E-01,4,"AKT(PKB), G-protein alpha-i family, Adenylate cyclase, Adenylate cyclase type VII",1.652E-01,2.953E-01,4,"AKT(PKB), G-protein alpha-i family, Adenylate cyclase, Adenylate cyclase type VII",
918,Altered Ca2+ handling in heart failure,35,1.652E-01,2.677E-01,1.796E-01,2.677E-01,4,"Beta-2 adrenergic receptor, NCX1, G-protein alpha-i family, Adenylate cyclase",1.652E-01,2.953E-01,4,"Beta-2 adrenergic receptor, NCX1, G-protein alpha-i family, Adenylate cyclase",
919,TMPRSS2-ERG fusion in Prostate Cancer,46,1.653E-01,2.532E-01,1.653E-01,2.532E-01,5,"YB-1, MxA, Osteonectin, ICAM2, IL-8",3.123E-01,4.750E-01,4,"MxA, Osteonectin, ICAM2, IL-8",
920,Apoptosis and survival_IL-17-induced CIKS-independent signaling pathways,46,1.653E-01,2.532E-01,1.653E-01,2.532E-01,5,"STAT3, PI3K cat class IA, Fra-1, STAT4, ERK1/2",5.431E-01,7.092E-01,3,"PI3K cat class IA, Fra-1, STAT4",
921,Development_CNTF receptor signaling,34,1.669E-01,2.541E-01,1.669E-01,2.541E-01,4,"STAT3, PI3K cat class IA, AKT(PKB), ERK1/2",6.267E-01,7.809E-01,2,"PI3K cat class IA, AKT(PKB)",
922,G-protein signaling_G-Protein beta/gamma signaling cascades,34,1.669E-01,2.541E-01,1.669E-01,2.541E-01,4,"G-protein alpha-15, AKT(PKB), Caveolin-1, ERK1/2",3.479E-01,5.150E-01,3,"G-protein alpha-15, AKT(PKB), Caveolin-1",
923,Regulation of lipid metabolism_G-alpha(q) regulation of lipid metabolism,59,1.700E-01,2.586E-01,1.700E-01,2.586E-01,6,"COX-2 (PTGS2), APOC1, PKC, G-protein alpha-q/11, cPLA2, ERK1/2",2.955E-01,4.587E-01,5,"COX-2 (PTGS2), APOC1, PKC, G-protein alpha-q/11, cPLA2",
924,Protein folding and maturation_Angiotensin system maturation,48,1.701E-01,2.781E-01,1.870E-01,2.781E-01,5,"MC-CPA, MMP-8, Neprilysin, ACE2, CD13",1.701E-01,3.027E-01,5,"MC-CPA, MMP-8, Neprilysin, ACE2, CD13",
925,Aminoglycoside- and cisplatin-induced hair cell death,112,1.735E-01,2.636E-01,1.735E-01,2.636E-01,10,"COX-2 (PTGS2), IL-1 beta, IL-6, Beta-catenin, iNOS, PKC, Caspase-1, Caspase-8, p53, ERK1/2",6.926E-01,8.333E-01,6,"COX-2 (PTGS2), IL-1 beta, IL-6, iNOS, PKC, Caspase-1",
926,Development_Beta-adrenergic receptor-induced regulation of ERK,47,1.760E-01,2.654E-01,1.760E-01,2.654E-01,5,"Beta-2 adrenergic receptor, CD44, G-protein alpha-i family, Adenylate cyclase, ERK1/2",3.264E-01,4.902E-01,4,"Beta-2 adrenergic receptor, CD44, G-protein alpha-i family, Adenylate cyclase",
927,Development_Hedgehog signaling,47,1.760E-01,2.654E-01,1.760E-01,2.654E-01,5,"Beta-catenin, GAS1, GLI-1, PTCH1, GLI-2",3.264E-01,4.902E-01,4,"GAS1, GLI-1, PTCH1, GLI-2",
928,Development_PIP3 signaling in cardiac myocytes,47,1.760E-01,2.654E-01,1.760E-01,2.654E-01,5,"BAD, HGF, PI3K cat class IA, AKT(PKB), HGF receptor (Met)",3.264E-01,4.902E-01,4,"HGF, PI3K cat class IA, AKT(PKB), HGF receptor (Met)",
929,Role of proinflammatory cytokines in activation of p53 in major depressive disorder,47,1.760E-01,2.654E-01,1.760E-01,2.654E-01,5,"3HAO, NOXA, IDO1, TGF-beta, p53",3.264E-01,4.902E-01,4,"3HAO, NOXA, IDO1, TGF-beta",
930,KLF6 and regulation of KLF6 alternative splicing in HCC,23,1.766E-01,2.654E-01,1.766E-01,2.654E-01,3,"PI3K cat class IA, p53, EGFR",4.171E-01,5.821E-01,2,"PI3K cat class IA, EGFR",
931,Development_ERK5 in cell proliferation and neuronal survival,23,1.766E-01,2.654E-01,1.766E-01,2.654E-01,3,"NGF, Lck, MEF2C",4.171E-01,5.821E-01,2,"NGF, MEF2C",
932,Development_Thrombopoietin signaling via JAK-STAT pathway,23,1.766E-01,2.654E-01,1.766E-01,2.654E-01,3,"STAT3, TAP1 (PSF1), Pim-1",4.171E-01,5.821E-01,2,"TAP1 (PSF1), Pim-1",
933,Regulation of CFTR activity (normal and CF),62,1.794E-01,2.927E-01,1.991E-01,2.927E-01,6,"Syk, PGE2R4, Beta-2 adrenergic receptor, Adenosine A2b receptor, G-protein alpha-i family, Adenylate cyclase",1.794E-01,3.149E-01,6,"Syk, PGE2R4, Beta-2 adrenergic receptor, Adenosine A2b receptor, G-protein alpha-i family, Adenylate cyclase",
934,Oxidative stress_Role of Sirtuin1 and PGC1-alpha in activation of antioxidant defense system,60,1.795E-01,2.677E-01,1.795E-01,2.677E-01,6,"GSTP1, AMPK gamma subunit, PPARGC1 (PGC1-alpha), Sestrin 3, p53, SLC7A11",3.077E-01,4.693E-01,5,"GSTP1, AMPK gamma subunit, PPARGC1 (PGC1-alpha), Sestrin 3, SLC7A11",
935,Development_Thyroliberin signaling,60,1.795E-01,2.677E-01,1.795E-01,2.677E-01,6,"RGS4, G-protein alpha-q/11, PKC-alpha, ETS1, Adenylate cyclase, ERK1/2",3.077E-01,4.693E-01,5,"RGS4, G-protein alpha-q/11, PKC-alpha, ETS1, Adenylate cyclase",
936,Stimulation of gastric acid secretion in gastric cancer,60,1.795E-01,2.677E-01,1.795E-01,2.677E-01,6,"G-protein alpha-q/11, PKC-alpha, Kir2.1, Adenylate cyclase, ERK1/2, ACM3",3.077E-01,4.693E-01,5,"G-protein alpha-q/11, PKC-alpha, Kir2.1, Adenylate cyclase, ACM3",
937,TNF-alpha and IL-1 beta induce hyperglycemia in obesity and type 2 diabetes in adipocytes,35,1.796E-01,2.677E-01,1.796E-01,2.677E-01,4,"IL-1 beta, TNF-R2, ERK2 (MAPK1), NGAL",3.650E-01,5.317E-01,3,"IL-1 beta, TNF-R2, NGAL",
938,Cell cycle_ESR1 regulation of G1/S transition,35,1.796E-01,2.677E-01,1.796E-01,2.677E-01,4,"ERK2 (MAPK1), Cyclin E, ERK1/2, CDK6",6.425E-01,7.912E-01,2,"Cyclin E, CDK6",
939,Reproduction_Gonadotropin-releasing hormone (GnRH) signaling,73,1.800E-01,2.679E-01,1.800E-01,2.679E-01,7,"Follistatin, CaMK I, G-protein alpha-q/11, Secretogranin II, PACAP, Adenylate cyclase, ERK1/2",2.911E-01,4.536E-01,6,"Follistatin, CaMK I, G-protein alpha-q/11, Secretogranin II, PACAP, Adenylate cyclase",
940,Development_MicroRNA-dependent regulation of EMT,24,1.802E-01,2.845E-01,1.929E-01,2.845E-01,3,"TGF-beta 2, TCF8, SIP1 (ZFHX1B)",1.802E-01,3.149E-01,3,"TGF-beta 2, TCF8, SIP1 (ZFHX1B)",
941,Regulation of lipid metabolism_Regulation of lipid metabolism by niacin and isoprenaline,49,1.805E-01,2.917E-01,1.982E-01,2.917E-01,5,"Beta-2 adrenergic receptor, PKC, PKC-alpha, G-protein alpha-i family, Adenylate cyclase type VII",1.805E-01,3.149E-01,5,"Beta-2 adrenergic receptor, PKC, PKC-alpha, G-protein alpha-i family, Adenylate cyclase type VII",
942,IgE- and MGF-induced Fyn-mediated activation of lung mast cells in asthma,49,1.805E-01,2.917E-01,1.982E-01,2.917E-01,5,"Syk, S1P1 receptor, Fyn, AKT(PKB), Lyn",1.805E-01,3.149E-01,5,"Syk, S1P1 receptor, Fyn, AKT(PKB), Lyn",
943,Immune response_Inhibitory action of lipoxins on superoxide production induced by IL-8 and Leukotriene B4 in neutrophils,50,1.912E-01,3.034E-01,2.097E-01,3.034E-01,5,"G-protein alpha-15, Rac2, PKC-alpha, IL-8, G-protein alpha-i family",1.912E-01,3.310E-01,5,"G-protein alpha-15, Rac2, PKC-alpha, IL-8, G-protein alpha-i family",
944,Prolactin/ ERK signaling in breast cancer,36,1.926E-01,2.845E-01,1.926E-01,2.845E-01,4,"PI3K cat class IA, AKT(PKB), ERK1/2, MMP-2",3.821E-01,5.472E-01,3,"PI3K cat class IA, AKT(PKB), MMP-2",
945,Endothelial cell apoptosis in COPD,36,1.926E-01,2.845E-01,1.926E-01,2.845E-01,4,"BAD, PI3K cat class IA, AKT(PKB), Neuropilin-1",3.821E-01,5.472E-01,3,"PI3K cat class IA, AKT(PKB), Neuropilin-1",
946,iNKT cell-keratinocyte interactions in allergic contact dermatitis,36,1.926E-01,2.845E-01,1.926E-01,2.845E-01,4,"TCR beta subunit, ICAM1, CD1d, ERK1/2",3.821E-01,5.472E-01,3,"TCR beta subunit, ICAM1, CD1d",
947,Dual role of TGF-beta 1 in HCC ,24,1.929E-01,2.845E-01,1.929E-01,2.845E-01,3,"p15, SMAD3, TGF-beta receptor type II",4.387E-01,6.029E-01,2,"p15, TGF-beta receptor type II",
948,Apoptosis and survival_NO signaling in survival,24,1.929E-01,2.845E-01,1.929E-01,2.845E-01,3,"BAD, AKT(PKB), PI3K cat class IA (p110-delta)",4.387E-01,6.029E-01,2,"AKT(PKB), PI3K cat class IA (p110-delta)",
949,Immune response_IL-27 signaling pathway,24,1.929E-01,2.845E-01,1.929E-01,2.845E-01,3,"STAT3, ICAM1, Pim-1",4.387E-01,6.029E-01,2,"ICAM1, Pim-1",
950,G-protein signaling_M-RAS regulation pathway,24,1.929E-01,2.845E-01,1.929E-01,2.845E-01,3,"Lck, CalDAG-GEFIII, ERK1/2",7.819E-01,8.899E-01,1,CalDAG-GEFIII,
951,Defective macrophage-mediated bacterial phagocytosis in COPD,25,1.961E-01,3.034E-01,2.096E-01,3.034E-01,3,"AKT(PKB), MSR1, MARCO",1.961E-01,3.359E-01,3,"AKT(PKB), MSR1, MARCO",
952,Apoptosis and survival_Role of nuclear PI3K in NGF/ TrkA signaling,25,1.961E-01,3.034E-01,2.096E-01,3.034E-01,3,"NGF, PI3K cat class IA, AKT(PKB)",1.961E-01,3.359E-01,3,"NGF, PI3K cat class IA, AKT(PKB)",
953,Immune response_T cell subsets: secreted signals,25,1.961E-01,3.034E-01,2.096E-01,3.034E-01,3,"IL-6, TGF-beta, CCL20",1.961E-01,3.359E-01,3,"IL-6, TGF-beta, CCL20",
954,Putative pathways of n-3 and n-6 fatty acids in obesity and type 2 diabetes,51,2.022E-01,3.183E-01,2.213E-01,3.183E-01,5,"COX-2 (PTGS2), PTGIS, AKT(PKB), G-protein alpha-q/11, Adenylate cyclase",2.022E-01,3.459E-01,5,"COX-2 (PTGS2), PTGIS, AKT(PKB), G-protein alpha-q/11, Adenylate cyclase",
955,Signal transduction_Cyclic AMP signaling,38,2.029E-01,3.164E-01,2.196E-01,3.164E-01,4,"PKC, PKC-alpha, G-protein alpha-i family, Adenylate cyclase type VII",2.029E-01,3.462E-01,4,"PKC, PKC-alpha, G-protein alpha-i family, Adenylate cyclase type VII",
956,Deregulation of PSD-95-dependent signaling in Huntington's disease,37,2.060E-01,3.025E-01,2.060E-01,3.025E-01,4,"ERK2 (MAPK1), NR2A, NR2, ERK1/2",6.726E-01,8.180E-01,2,"NR2A, NR2",
957,Signal transduction_mTORC2 upstream signaling,65,2.081E-01,3.300E-01,2.299E-01,3.300E-01,6,"Sestrin 3, PI3K cat class IA, AKT(PKB), Protor-2, EGFR, Frizzled",2.081E-01,3.547E-01,6,"Sestrin 3, PI3K cat class IA, AKT(PKB), Protor-2, EGFR, Frizzled",
958,Transcription_PPAR Pathway,63,2.092E-01,3.034E-01,2.092E-01,3.034E-01,6,"COX-2 (PTGS2), PI3K cat class IA, PTGIS, AKT(PKB), PDGF receptor, ERK1/2",3.447E-01,5.120E-01,5,"COX-2 (PTGS2), PI3K cat class IA, PTGIS, AKT(PKB), PDGF receptor",
959,Immune response_IL-2 signaling via JAK/ STAT,25,2.096E-01,3.034E-01,2.096E-01,3.034E-01,3,"STAT3, Syk, STAT4",4.598E-01,6.237E-01,2,"Syk, STAT4",
960,Transcription_Transcription regulation of aminoacid metabolism,25,2.096E-01,3.034E-01,2.096E-01,3.034E-01,3,"NF-E2 (45 kDa), PKC, ERK1/2",4.598E-01,6.237E-01,2,"NF-E2 (45 kDa), PKC",
