Enrichment analysis report,,,,,,,,,,,,,
Enrichment by Pathway Maps,,,,,down_genes_int_061520_genelist,,,,down_genes_rna_061620_genelist,,,,
#,Maps,Total,min(pValue),Min FDR,p-value,FDR,In Data,"Network Objects from
Active Data",p-value,FDR,In Data,"Network Objects from
Active Data",
1,Protein folding and maturation_POMC processing,30,2.188E-16,1.886E-13,4.055E-16,1.886E-13,19,"PAM, proACTH, POMC, N-POMC, beta-MSH, beta-Endorphin extracellular region, N-POC, gamma-LPH, ACTH 1-17, gamma3-MSH, ACTH, alpha-MSH, Joining peptide (JP), DA-alphaMSH, CLIP, PC1, gamma-MSH, beta-LPH, gamma2-MSH",2.188E-16,2.981E-13,19,"PAM, proACTH, POMC, N-POMC, beta-MSH, beta-Endorphin extracellular region, N-POC, gamma-LPH, ACTH 1-17, gamma3-MSH, ACTH, alpha-MSH, Joining peptide (JP), DA-alphaMSH, CLIP, PC1, gamma-MSH, beta-LPH, gamma2-MSH",
2,Development_Regulation of epithelial-to-mesenchymal transition (EMT),64,2.706E-16,1.886E-13,2.706E-16,1.886E-13,27,"HGF, IL-1 beta, N-cadherin, TGF-beta 2, NOTCH4, Caldesmon, ACTA2, FGF2, SNAIL1, PDGF-R-alpha, HGF receptor (Met), Fibronectin, Jagged1, Vimentin, TCF8, Claudin-1, WNT, TGF-beta receptor type II, SLUG, EGFR, MMP-9, Frizzled, EDNRA, ACTB, SIP1 (ZFHX1B), PDGF-R-beta, MMP-2",1.401E-14,6.361E-12,25,"HGF, IL-1 beta, N-cadherin, TGF-beta 2, NOTCH4, ACTA2, Caldesmon, FGF2, PDGF-R-alpha, HGF receptor (Met), Fibronectin, Jagged1, Vimentin, TCF8, Claudin-1, WNT, TGF-beta receptor type II, SLUG, EGFR, MMP-9, Frizzled, EDNRA, SIP1 (ZFHX1B), PDGF-R-beta, MMP-2",
3,Cell adhesion_ECM remodeling,55,4.000E-16,1.886E-13,4.000E-16,1.886E-13,25,"Matrilysin (MMP-7), Laminin 5, PLAUR (uPAR), alpha-5/beta-1 integrin, Actin cytoskeletal, alpha-1/beta-1 integrin, MMP-13, Collagen IV, CD44, SERPINE2, Caveolin-2, PLAT (TPA), MSN (moesin), Fibronectin, Nidogen, Osteonectin, IL-8, EGFR, LAMA4, MMP-9, PLAU (UPA), MMP-14, MMP-2, Versican, Collagen III",2.340E-15,1.593E-12,24,"Matrilysin (MMP-7), Laminin 5, PLAUR (uPAR), alpha-5/beta-1 integrin, alpha-1/beta-1 integrin, MMP-13, Collagen IV, CD44, SERPINE2, Caveolin-2, PLAT (TPA), MSN (moesin), Fibronectin, Nidogen, Osteonectin, IL-8, EGFR, LAMA4, MMP-9, PLAU (UPA), MMP-14, MMP-2, Versican, Collagen III",
4,Role of stellate cells in progression of pancreatic cancer,60,4.962E-15,1.730E-12,4.962E-15,1.730E-12,25,"GRO-2, IL-6, Galectin-1, NGF, ACTA2, alpha-5/beta-1 integrin, PI3K cat class IA, RECK, FGF2, MMP-13, SMAD3, CTGF, PDGF-R-alpha, AKT(PKB), PDGF receptor, OSF-2, CCL2, Fibronectin, IL-8, TGF-beta receptor type II, EGFR, ERK1/2, PDGF-R-beta, MMP-2, Collagen III",2.595E-13,8.834E-11,23,"GRO-2, IL-6, Galectin-1, NGF, ACTA2, alpha-5/beta-1 integrin, PI3K cat class IA, RECK, FGF2, MMP-13, CTGF, PDGF-R-alpha, AKT(PKB), PDGF receptor, OSF-2, CCL2, Fibronectin, IL-8, TGF-beta receptor type II, EGFR, PDGF-R-beta, MMP-2, Collagen III",
5,TGF-beta signaling via SMADs in breast cancer,47,1.700E-12,4.742E-10,1.700E-12,4.742E-10,20,"TGF-beta 2, PTHrP, HMGA2, SNAIL1, MMP-13, SMAD3, CTGF, RUNX2, CD44, p53, IL-8, ETS1, FOXQ1 (HFH1), TGF-beta receptor type II, SLUG, MMP-9, CD44 soluble, Fascin, GLI-2, MMP-14",1.008E-09,1.526E-07,17,"TGF-beta 2, PTHrP, HMGA2, MMP-13, CTGF, RUNX2, CD44, IL-8, ETS1, FOXQ1 (HFH1), TGF-beta receptor type II, SLUG, MMP-9, CD44 soluble, Fascin, GLI-2, MMP-14",
6,Putative roles of SETDB1 and PLU-1 in melanoma,23,4.696E-12,1.279E-09,7.375E-12,1.715E-09,14,"HOXA6, HOXA4, HOXA9, p14ARF, HOXA10, HOXA7, HOXA3, HOXA2, HOXA5, p16INK4, Jagged1, HOXA11, LMO2, CDK6",4.696E-12,1.279E-09,14,"HOXA6, HOXA4, HOXA9, p14ARF, HOXA10, HOXA7, HOXA3, HOXA2, HOXA5, p16INK4, Jagged1, HOXA11, LMO2, CDK6",
7,Stromal-epithelial interaction in Prostate Cancer,42,1.927E-11,3.793E-09,1.927E-11,3.793E-09,18,"HGF, Keratin 17, IL-6, TGF-beta 2, ACTA2, FGF2, SNAIL1, SMAD3, PDGF-R-alpha, HIC5, HGF receptor (Met), Fibronectin, Vimentin, TGF-beta receptor type II, MMP-9, PDGF-R-beta, MMP-2, Versican",1.290E-09,1.757E-07,16,"HGF, Keratin 17, IL-6, TGF-beta 2, ACTA2, FGF2, PDGF-R-alpha, HIC5, HGF receptor (Met), Fibronectin, Vimentin, TGF-beta receptor type II, MMP-9, PDGF-R-beta, MMP-2, Versican",
8,Stellate cells activation and liver fibrosis,70,2.175E-11,3.793E-09,2.175E-11,3.793E-09,23,"GRO-2, IL-1 beta, Biglycan, Beta-catenin, ACTA2, TNF-R2, PI3K cat class IA, GLI-1, SMAD3, PDGF-R-alpha, ERK2 (MAPK1), AKT(PKB), PTCH1, PDGF receptor, ICAM1, CCL2, Tcf(Lef), Dsh, TGF-beta receptor type II, Frizzled, TLR2, PDGF-R-beta, MMP-2",2.454E-08,1.990E-06,19,"GRO-2, IL-1 beta, Biglycan, ACTA2, TNF-R2, PI3K cat class IA, GLI-1, PDGF-R-alpha, AKT(PKB), PTCH1, PDGF receptor, ICAM1, CCL2, Tcf(Lef), TGF-beta receptor type II, Frizzled, TLR2, PDGF-R-beta, MMP-2",
9,Stimulation of TGF-beta signaling in lung cancer,48,2.877E-11,4.460E-09,2.877E-11,4.460E-09,19,"COX-2 (PTGS2), IL-1 beta, N-cadherin, TGF-beta 2, ITGB1, ACTA2, TGF-beta, Fyn, SNAIL1, SMAD3, AKT(PKB), Fibronectin, Vimentin, TGF-beta receptor type II, SLUG, MMP-9, IRAKM, Tropomyosin-2, MMP-2",1.473E-09,1.824E-07,17,"COX-2 (PTGS2), IL-1 beta, N-cadherin, TGF-beta 2, ITGB1, ACTA2, TGF-beta, Fyn, AKT(PKB), Fibronectin, Vimentin, TGF-beta receptor type II, SLUG, MMP-9, IRAKM, Tropomyosin-2, MMP-2",
10,TGF-beta 1-mediated induction of EMT in normal and asthmatic airway epithelium,44,4.971E-11,6.935E-09,4.971E-11,6.935E-09,18,"IL-1 beta, N-cadherin, ACTA2, HMGA2, SNAIL1, SMAD3, CTGF, CD44, Fibronectin, Jagged1, Vimentin, ITGB3, ETS1, TGF-beta receptor type II, BMP4, SLUG, MMP-9, MMP-2",2.874E-09,3.262E-07,16,"IL-1 beta, N-cadherin, ACTA2, HMGA2, CTGF, CD44, Fibronectin, Jagged1, Vimentin, ITGB3, ETS1, TGF-beta receptor type II, BMP4, SLUG, MMP-9, MMP-2",
11,Development_TGF-beta-dependent induction of EMT via SMADs ,35,7.776E-11,9.861E-09,7.776E-11,9.861E-09,16,"N-cadherin, TGF-beta 2, TGF-beta, HMGA2, SNAIL1, SMAD3, Fibronectin, Jagged1, Vimentin, TCF8, ETS1, Claudin-1, TGF-beta receptor type II, SLUG, SIP1 (ZFHX1B), MMP-2",6.665E-09,6.484E-07,14,"N-cadherin, TGF-beta 2, TGF-beta, HMGA2, Fibronectin, Jagged1, Vimentin, TCF8, ETS1, Claudin-1, TGF-beta receptor type II, SLUG, SIP1 (ZFHX1B), MMP-2",
12,Beta-catenin-dependent transcription regulation in colorectal cancer,36,1.318E-10,1.532E-08,1.318E-10,1.532E-08,16,"COX-2 (PTGS2), Beta-catenin, PLAUR (uPAR), LAMC2, LAMC2 (80kDa), LAMC2 (100kDa), CD44, IL-8, Claudin-1, CDX2, CD44 soluble, PLAU (UPA), MDR1, Fascin, MMP-14, CD44 (EXT)",9.608E-10,1.526E-07,15,"COX-2 (PTGS2), PLAUR (uPAR), LAMC2, LAMC2 (80kDa), LAMC2 (100kDa), CD44, IL-8, Claudin-1, CDX2, CD44 soluble, PLAU (UPA), MDR1, Fascin, MMP-14, CD44 (EXT)",
13,Inhibition of remyelination in multiple sclerosis: role of cell-cell and ECM-cell interactions,47,1.840E-10,1.975E-08,1.840E-10,1.975E-08,18,"Connexin 30, NGF, ITGB1, Myelin basic protein, Claudin-11, NGFR(TNFRSF16), Actin cytoskeletal, Fyn, Caspr1, Tetraspanin-2, NCAM1, PKC, Connexin 45, CD44, Fibronectin, Connexin 26, MMP-9, TLR2",1.008E-09,1.526E-07,17,"Connexin 30, NGF, ITGB1, Myelin basic protein, Claudin-11, NGFR(TNFRSF16), Fyn, Caspr1, Tetraspanin-2, NCAM1, PKC, Connexin 45, CD44, Fibronectin, Connexin 26, MMP-9, TLR2",
14,Immune response_CCL2 signaling,54,3.184E-10,3.173E-08,3.184E-10,3.173E-08,19,"IL-1 beta, IL-6, alpha-5/beta-1 integrin, Actin cytoskeletal, iNOS, Caveolin-1, alpha-4/beta-1 integrin, ICAM1, CCL2, PKC-alpha, p53, ITGB3, ETS1, CDH19, G-protein alpha-i family, PI3K cat class IA (p110-delta), ERK1/2, MMP-14, MMP-2",8.147E-08,5.284E-06,16,"IL-1 beta, IL-6, alpha-5/beta-1 integrin, iNOS, Caveolin-1, alpha-4/beta-1 integrin, ICAM1, CCL2, PKC-alpha, ITGB3, ETS1, CDH19, G-protein alpha-i family, PI3K cat class IA (p110-delta), MMP-14, MMP-2",
15,Rheumatoid arthritis (general schema),50,3.538E-10,5.641E-08,6.066E-10,5.641E-08,18,"IL-15, IL-1 beta, IL-6, TNF-R2, HLA-DRB1, TGF-beta, MHC class II, FGF2, MMP-8, PTPN22, CSF1, alpha-4/beta-1 integrin, ICAM1, MHC class II beta chain, HLA-DRB, MMP-9, TLR4, TLR2",3.538E-10,8.032E-08,18,"IL-15, IL-1 beta, IL-6, TNF-R2, HLA-DRB1, TGF-beta, MHC class II, FGF2, MMP-8, PTPN22, CSF1, alpha-4/beta-1 integrin, ICAM1, MHC class II beta chain, HLA-DRB, MMP-9, TLR4, TLR2",
16,Inflammatory mechanisms of pancreatic cancerogenesis,67,3.002E-09,2.617E-07,3.002E-09,2.617E-07,20,"STAT3, COX-2 (PTGS2), IL-32 (NK4), IL-1 beta, IL-6, TNF-R2, CCL20, TGF-alpha, GRO-1, iNOS, ICAM1, CCL2, IL-8, EGFR, MMP-9, G-protein alpha-i family, TLR4, PLAU (UPA), ENA-78, MMP-2",1.112E-08,1.010E-06,19,"COX-2 (PTGS2), IL-32 (NK4), IL-1 beta, IL-6, TNF-R2, CCL20, TGF-alpha, GRO-1, iNOS, ICAM1, CCL2, IL-8, EGFR, MMP-9, G-protein alpha-i family, TLR4, PLAU (UPA), ENA-78, MMP-2",
17,Cell adhesion_Tight junctions,38,3.753E-09,3.080E-07,3.753E-09,3.080E-07,15,"Claudin-16, Myosin II, ITGB1, Claudin-18, Claudin-11, Actomyosin, SNAIL1, F-Actin, Caveolin-1, Claudin-8, Tcf(Lef), Claudin-1, CDX2, Actin, CDX1",1.134E-05,2.117E-04,11,"Claudin-16, ITGB1, Claudin-18, Claudin-11, Caveolin-1, Claudin-8, Tcf(Lef), Claudin-1, CDX2, Actin, CDX1",
18,Hedgehog signaling in gastric cancer,29,4.325E-09,4.515E-07,6.474E-09,4.515E-07,13,"N-cadherin, GLI-1, SFRP1, PTCH1, CDX2, BMP4, SLUG, EDNRA, TWIST2, GLI-2, SIP1 (ZFHX1B), MEF2C, PDGF-R-beta",4.325E-09,4.531E-07,13,"N-cadherin, GLI-1, SFRP1, PTCH1, CDX2, BMP4, SLUG, EDNRA, TWIST2, GLI-2, SIP1 (ZFHX1B), MEF2C, PDGF-R-beta",
19,Airway smooth muscle contraction in asthma,56,4.966E-09,3.695E-07,4.966E-09,3.695E-07,18,"PGF2aR, PGE2R2, Histamine H1 receptor, Myosin II, Beta-2 adrenergic receptor, TRPC6, CPI-17, TRPC3, G-protein alpha-q/11, MELC, PKC-alpha, MyHC, G-protein alpha-i family, Adenylate cyclase, MLCK, MRLC, ACM3, Telokin",1.433E-07,8.343E-06,16,"PGF2aR, PGE2R2, Histamine H1 receptor, Beta-2 adrenergic receptor, TRPC6, CPI-17, TRPC3, G-protein alpha-q/11, MELC, PKC-alpha, G-protein alpha-i family, Adenylate cyclase, MLCK, MRLC, ACM3, Telokin",
20,TGF-beta 1-induced transactivation of membrane receptors signaling in HCC,50,5.032E-09,3.695E-07,5.032E-09,3.695E-07,17,"Beta-catenin, ITGB1, Laminin 5, alpha-5/beta-1 integrin, TGF-beta, PI3K cat class IA, SNAIL1, PDGF-R-alpha, AKT(PKB), PDGF receptor, ITGA5, Fibronectin, Cyclin E, Actin, TGF-beta receptor type II, SLUG, PDGF-R-beta",1.728E-07,9.415E-06,15,"ITGB1, Laminin 5, alpha-5/beta-1 integrin, TGF-beta, PI3K cat class IA, PDGF-R-alpha, AKT(PKB), PDGF receptor, ITGA5, Fibronectin, Cyclin E, Actin, TGF-beta receptor type II, SLUG, PDGF-R-beta",
21,WNT signaling in HCC,40,8.655E-09,5.683E-07,8.655E-09,5.683E-07,15,"WNT3, Beta-catenin, Prickle-1, p14ARF, LGR5, DVL-3, SFRP1, p53, Tcf(Lef), FZD7, Dsh, WNT, EGFR, Frizzled, DACT1",1.947E-05,3.156E-04,11,"WNT3, Prickle-1, p14ARF, LGR5, SFRP1, Tcf(Lef), FZD7, WNT, EGFR, Frizzled, DACT1",
22,Glomerular injury in Lupus Nephritis,92,8.963E-09,5.683E-07,8.963E-09,5.683E-07,23,"GRO-2, IL-1 beta, IL-6, TGF-beta, GRO-1, iNOS, AKT(PKB), CSF1, ICAM1, CCL2, PKC-alpha, TLR3, Fibronectin, C3a, IL-8, NGAL, GRO-3, A20, IFN-beta, MMP-9, IFI56, ERK1/2, PDGF-R-beta",2.484E-08,1.990E-06,22,"GRO-2, IL-1 beta, IL-6, TGF-beta, GRO-1, iNOS, AKT(PKB), CSF1, ICAM1, CCL2, PKC-alpha, TLR3, Fibronectin, C3a, IL-8, NGAL, GRO-3, A20, IFN-beta, MMP-9, IFI56, PDGF-R-beta",
23,"Development_TGF-beta-dependent induction of EMT via RhoA,  PI3K and ILK",46,9.799E-09,5.944E-07,9.799E-09,5.944E-07,16,"TGF-beta 2, Beta-catenin, Caldesmon, ACTA2, PI3K cat class IA, SNAIL1, SMAD3, AKT(PKB), HIC5, Fibronectin, Vimentin, Claudin-1, Actin, TGF-beta receptor type II, SLUG, ACTB",1.477E-05,2.646E-04,12,"TGF-beta 2, ACTA2, Caldesmon, PI3K cat class IA, AKT(PKB), HIC5, Fibronectin, Vimentin, Claudin-1, Actin, TGF-beta receptor type II, SLUG",
24,TNF-alpha and IL-1 beta-mediated regulation of contraction and secretion of inflammatory factors in normal and asthmatic airway smooth muscle,65,1.098E-08,6.384E-07,1.098E-08,6.384E-07,19,"COX-2 (PTGS2), GRO-2, IL-1 beta, IL-6, PA24A, GRO-1, TRPC3, AKT(PKB), PLA2, CCL2, PKC-alpha, CD38, IL-8, GRO-3, EGFR, MMP-9, ERK1/2, PDGF-R-beta, CCL7",4.073E-08,3.082E-06,18,"COX-2 (PTGS2), GRO-2, IL-1 beta, IL-6, PA24A, GRO-1, TRPC3, AKT(PKB), PLA2, CCL2, PKC-alpha, CD38, IL-8, GRO-3, EGFR, MMP-9, PDGF-R-beta, CCL7",
25,SHH signaling in colorectal cancer,31,1.747E-08,9.731E-07,1.747E-08,9.731E-07,13,"FOXC2, Beta-catenin, SNAIL1, GLI-1, PDGF-R-alpha, PTCH1, p53, Vimentin, WNT, IMP1(ZBP1), Frizzled, GLI-2, SIP1 (ZFHX1B)",9.777E-06,1.902E-04,10,"FOXC2, GLI-1, PDGF-R-alpha, PTCH1, Vimentin, WNT, IMP1(ZBP1), Frizzled, GLI-2, SIP1 (ZFHX1B)",
26,IL-1 signaling in melanoma,42,1.883E-08,9.731E-07,1.883E-08,9.731E-07,15,"COX-2 (PTGS2), GRO-2, IL-1 beta, IL-6, PD-L2, GRO-1, iNOS, alpha-4/beta-1 integrin, ICAM1, CCL2, p53, IL-8, GRO-3, MMP-9, PD-L1",1.014E-07,6.280E-06,14,"COX-2 (PTGS2), GRO-2, IL-1 beta, IL-6, PD-L2, GRO-1, iNOS, alpha-4/beta-1 integrin, ICAM1, CCL2, IL-8, GRO-3, MMP-9, PD-L1",
27,Signal transduction_WNT/Beta-catenin signaling in tissue homeostasis,42,1.883E-08,9.731E-07,1.883E-08,9.731E-07,15,"COX-2 (PTGS2), Beta-catenin, SNAIL1, iNOS, Tcf(Lef), IL-8, WNT, SLUG, ACADL, MMP-9, TCF7 (TCF1), CDX1, Frizzled, MMP-2, Versican",7.712E-07,2.452E-05,13,"COX-2 (PTGS2), iNOS, Tcf(Lef), IL-8, WNT, SLUG, ACADL, MMP-9, TCF7 (TCF1), CDX1, Frizzled, MMP-2, Versican",
28,Main genetic and epigenetic alterations in lung cancer,48,1.976E-08,9.846E-07,1.976E-08,9.846E-07,16,"GSTP1, HGF, Neuropilin-2, p14ARF, RECK, TGF-alpha, Caspase-8, p53, HGF receptor (Met), p16INK4, TGF-beta receptor type II, EGFR, IBP, Neuropilin-1, IBP3, MMP-2",6.553E-07,2.262E-05,14,"GSTP1, HGF, Neuropilin-2, p14ARF, RECK, TGF-alpha, HGF receptor (Met), p16INK4, TGF-beta receptor type II, EGFR, IBP, Neuropilin-1, IBP3, MMP-2",
29,Immune response_IL-1 signaling pathway,82,2.506E-08,1.206E-06,2.506E-08,1.206E-06,21,"COX-2 (PTGS2), IL-1 beta, IL-6, c-IAP2, PI3K cat class IA, FGF2, GRO-1, MMP-13, iNOS, RUNX2, AKT(PKB), ICAM1, CD44, CCL2, MYLK1, IL-8, IFN-beta, MMP-9, PLAU (UPA), ERK1/2, CCL7",7.526E-08,5.125E-06,20,"COX-2 (PTGS2), IL-1 beta, IL-6, c-IAP2, PI3K cat class IA, FGF2, GRO-1, MMP-13, iNOS, RUNX2, AKT(PKB), ICAM1, CD44, CCL2, MYLK1, IL-8, IFN-beta, MMP-9, PLAU (UPA), CCL7",
30,Development_WNT/Beta-catenin signaling in embryogenesis,43,2.724E-08,1.267E-06,2.724E-08,1.267E-06,15,"LBH, p15, Mixl1, Beta-catenin, p14ARF, SNAIL1, Oct-3/4, p16INK4, Tcf(Lef), En1, WNT, CDX2, TCF7 (TCF1), CDX1, Frizzled",1.044E-06,3.001E-05,13,"LBH, p15, Mixl1, p14ARF, Oct-3/4, p16INK4, Tcf(Lef), En1, WNT, CDX2, TCF7 (TCF1), CDX1, Frizzled",
31,Vascular endothelial cell damage in SLE,63,3.969E-08,1.786E-06,3.969E-08,1.786E-06,18,"HGF, IL-1 beta, IL-6, alpha-5/beta-1 integrin, PD-L2, iNOS, CSF1, alpha-4/beta-1 integrin, Tissue factor, ICAM1, CCL2, Caspase-1, Fibronectin, C3a, MSR1, IL-8, ERK1/2, PD-L1",1.470E-07,8.343E-06,17,"HGF, IL-1 beta, IL-6, alpha-5/beta-1 integrin, PD-L2, iNOS, CSF1, alpha-4/beta-1 integrin, Tissue factor, ICAM1, CCL2, Caspase-1, Fibronectin, C3a, MSR1, IL-8, PD-L1",
32,Signal transduction_PDGF signaling via PI3K/AKT and NFkB pathways,70,4.183E-08,1.824E-06,4.183E-08,1.824E-06,19,"PDGF-C, Transgelin, Beta-catenin, YB-1, ACTA2, SGK1, PDGFR-ab, PDGF-R-alpha, AKT(PKB), MYH11, PDGF receptor, CCL2, p53, ETS1, MMP-9, Phox1 (PRRX1), ERK1/2, PDGF-R-beta, MMP-2",7.439E-05,9.046E-04,14,"PDGF-C, Transgelin, ACTA2, SGK1, PDGFR-ab, PDGF-R-alpha, AKT(PKB), PDGF receptor, CCL2, ETS1, MMP-9, Phox1 (PRRX1), PDGF-R-beta, MMP-2",
33,TGF-beta-induced fibroblast/ myofibroblast migration and extracellular matrix production in asthmatic airways,64,5.199E-08,2.133E-06,5.199E-08,2.133E-06,18,"ITGA1, Biglycan, TGF-beta 2, ITGB1, PI3K cat class IA, COL4A1, MMP-13, SMAD3, AKT(PKB), COL5A1, Collagen IV, ITGA5, Fibronectin, TGF-beta receptor type II, MMP-9, ERK1/2, MMP-2, Collagen III",1.058E-06,3.001E-05,16,"ITGA1, Biglycan, TGF-beta 2, ITGB1, PI3K cat class IA, COL4A1, MMP-13, AKT(PKB), COL5A1, Collagen IV, ITGA5, Fibronectin, TGF-beta receptor type II, MMP-9, MMP-2, Collagen III",
34,Development_Positive regulation of WNT/Beta-catenin signaling at the receptor level,64,5.199E-08,2.133E-06,5.199E-08,2.133E-06,18,"R-spondins, WLS, Biglycan, RECK, LGR5, SFRP1, Caveolin-1, CD44, LGR6, GPR124, Tcf(Lef), WNT7A, WNT5B, Dsh, WNT, EGFR, Frizzled, ERK1/2",1.058E-06,3.001E-05,16,"R-spondins, WLS, Biglycan, RECK, LGR5, SFRP1, Caveolin-1, CD44, LGR6, GPR124, Tcf(Lef), WNT7A, WNT5B, WNT, EGFR, Frizzled",
35,Role of IL-8 in colorectal cancer,19,5.496E-08,2.190E-06,5.496E-08,2.190E-06,10,"HGF, IL-1 beta, PI3K cat class IA, ICAM1, CD44, HGF receptor (Met), IL-8, EGFR, ERK1/2, MMP-2",6.265E-07,2.262E-05,9,"HGF, IL-1 beta, PI3K cat class IA, ICAM1, CD44, HGF receptor (Met), IL-8, EGFR, MMP-2",
36,Disruption of epithelial layer restitution in asthma,34,6.575E-08,2.548E-06,6.575E-08,2.548E-06,13,"HGF, IL-1 beta, TGF-beta 2, ITGB1, PLAUR (uPAR), alpha-5/beta-1 integrin, SMAD3, HGF receptor (Met), Fibronectin, EGFR, MMP-9, PLAU (UPA), EDNRA",4.121E-07,1.701E-05,12,"HGF, IL-1 beta, TGF-beta 2, ITGB1, PLAUR (uPAR), alpha-5/beta-1 integrin, HGF receptor (Met), Fibronectin, EGFR, MMP-9, PLAU (UPA), EDNRA",
37,Role of adhesion of SCLC cells in tumor progression,35,6.665E-08,3.437E-06,9.856E-08,3.437E-06,13,"N-cadherin, ITGB1, alpha-5/beta-1 integrin, PTHrP, NCAM1, Caveolin-1, Collagen IV, alpha-4/beta-1 integrin, ICAM1, Fibronectin, ACM3, MMP-14, MMP-2",6.665E-08,4.778E-06,13,"N-cadherin, ITGB1, alpha-5/beta-1 integrin, PTHrP, NCAM1, Caveolin-1, Collagen IV, alpha-4/beta-1 integrin, ICAM1, Fibronectin, ACM3, MMP-14, MMP-2",
38,Role of Tissue factor-induced Thrombin signaling in cancerogenesis,65,6.770E-08,2.552E-06,6.770E-08,2.552E-06,18,"Angiopoietin 1, PAR3, Actin cytoskeletal, GRO-1, MMP-13, ERK2 (MAPK1), AKT(PKB), G-protein alpha-q/11, Tissue factor, MELC, PKC-alpha, IL-8, EGFR, G-protein alpha-i family, MLCK, MRLC, ERK1/2, MMP-2",6.705E-06,1.379E-04,15,"Angiopoietin 1, PAR3, GRO-1, MMP-13, AKT(PKB), G-protein alpha-q/11, Tissue factor, MELC, PKC-alpha, IL-8, EGFR, G-protein alpha-i family, MLCK, MRLC, MMP-2",
39,Transcription_HIF-1 targets,95,8.361E-08,3.069E-06,8.361E-08,3.069E-06,22,"Galectin-1, TGF-beta 2, NOXA, PLAUR (uPAR), 5'-NTD, FGF2, Ceruloplasmin, iNOS, CTGF, Lysyl oxidase, Transferrin, Alpha-1B adrenergic receptor, PLGF, Oct-3/4, p53, HGF receptor (Met), MMP-9, Carbonic anhydrase IX, MDR1, LOXL2, IBP3, MMP-2",2.187E-07,1.103E-05,21,"Galectin-1, TGF-beta 2, NOXA, PLAUR (uPAR), 5'-NTD, FGF2, Ceruloplasmin, iNOS, CTGF, Lysyl oxidase, Transferrin, Alpha-1B adrenergic receptor, PLGF, Oct-3/4, HGF receptor (Met), MMP-9, Carbonic anhydrase IX, MDR1, LOXL2, IBP3, MMP-2",
40,Role of growth factor receptors transactivation by Hyaluronic acid / CD44 signaling in tumor progression,35,9.856E-08,3.437E-06,9.856E-08,3.437E-06,13,"HGF, Ankyrin 1, PI3K cat class IA, PTHrP, SMAD3, CD44, PKC-alpha, HGF receptor (Met), EGFR, MMP-9, MDR1, ERK1/2, MMP-2",4.661E-06,1.024E-04,11,"HGF, Ankyrin 1, PI3K cat class IA, PTHrP, CD44, PKC-alpha, HGF receptor (Met), EGFR, MMP-9, MDR1, MMP-2",
41,Immune response_IL-17 signaling pathways,60,1.084E-07,3.688E-06,1.084E-07,3.688E-06,17,"COX-2 (PTGS2), IL-1 beta, IL-6, PI3K cat class IA, CCL20, GRO-1, iNOS, AKT(PKB), GCP2, ICAM1, CCL2, IL-8, NGAL, MMP-9, ERK1/2, ENA-78, CCL7",4.082E-07,1.701E-05,16,"COX-2 (PTGS2), IL-1 beta, IL-6, PI3K cat class IA, CCL20, GRO-1, iNOS, AKT(PKB), GCP2, ICAM1, CCL2, IL-8, NGAL, MMP-9, ENA-78, CCL7",
42,Development_WNT/Beta-catenin signaling in organogenesis,30,1.177E-07,3.820E-06,1.177E-07,3.820E-06,12,"FOXC2, LBH, Beta-catenin, PLA2G7, Oct-3/4, Tcf(Lef), IL-8, En1, WNT, BMP2, Frizzled, Neuropilin-1",8.101E-07,2.452E-05,11,"FOXC2, LBH, PLA2G7, Oct-3/4, Tcf(Lef), IL-8, En1, WNT, BMP2, Frizzled, Neuropilin-1",
43,Regulation of IGF family activity in colorectal cancer,30,1.177E-07,3.820E-06,1.177E-07,3.820E-06,12,"COX-2 (PTGS2), IL-1 beta, IL-6, Matrilysin (MMP-7), PLAUR (uPAR), PCSK5, IBP6, p53, MMP-9, IBP, PLAU (UPA), IBP3",8.101E-07,2.452E-05,11,"COX-2 (PTGS2), IL-1 beta, IL-6, Matrilysin (MMP-7), PLAUR (uPAR), PCSK5, IBP6, MMP-9, IBP, PLAU (UPA), IBP3",
44,E-cadherin signaling and its regulation in gastric cancer,36,1.454E-07,4.609E-06,1.454E-07,4.609E-06,13,"HGF, Beta-catenin, SNAIL1, HGF receptor (Met), TCF8, Dsh, WNT, Actin, SLUG, EGFR, BMP2, Frizzled, SIP1 (ZFHX1B)",4.233E-05,5.709E-04,10,"HGF, HGF receptor (Met), TCF8, WNT, Actin, SLUG, EGFR, BMP2, Frizzled, SIP1 (ZFHX1B)",
45,Muscle contraction_GPCRs in the regulation of smooth muscle tone,83,1.609E-07,4.988E-06,1.609E-07,4.988E-06,20,"PGE2R2, Histamine H1 receptor, Myosin II, TRPC4, Beta-2 adrenergic receptor, TRPC6, TRPC3, Adenosine A2b receptor, G-protein alpha-q/11, MELC, PKC-alpha, MyHC, NCX1, G-protein alpha-i family, Adenylate cyclase, MLCK, MRLC, EDNRA, ACM3, Telokin",2.146E-06,5.620E-05,18,"PGE2R2, Histamine H1 receptor, TRPC4, Beta-2 adrenergic receptor, TRPC6, TRPC3, Adenosine A2b receptor, G-protein alpha-q/11, MELC, PKC-alpha, NCX1, G-protein alpha-i family, Adenylate cyclase, MLCK, MRLC, EDNRA, ACM3, Telokin",
46,Glucocorticoid-induced elevation of intraocular pressure as glaucoma risk factor,62,1.836E-07,5.425E-06,1.836E-07,5.425E-06,17,"COX-2 (PTGS2), ITGB1, Laminin 5, Actin cytoskeletal, PI3K cat class IA, COL4A1, LAMB3, Collagen IV, PLAT (TPA), HGF receptor (Met), Fibronectin, ITGB3, Elastin, EGFR, LAMA1, MLCK, MMP-2",6.643E-07,2.262E-05,16,"COX-2 (PTGS2), ITGB1, Laminin 5, PI3K cat class IA, COL4A1, LAMB3, Collagen IV, PLAT (TPA), HGF receptor (Met), Fibronectin, ITGB3, Elastin, EGFR, LAMA1, MLCK, MMP-2",
47,Immune response_TLR2 and TLR4 signaling pathways,69,1.840E-07,5.425E-06,1.840E-07,5.425E-06,18,"COX-2 (PTGS2), IL-1 beta, IL-6, TLR1, PI3K cat class IA, Pellino 1, iNOS, CD14, AKT(PKB), Pellino 2, TLR10, IL-8, TLR6, Lyn, TLR4, TLR2, ERK1/2, MD-2",6.112E-07,2.262E-05,17,"COX-2 (PTGS2), IL-1 beta, IL-6, TLR1, PI3K cat class IA, Pellino 1, iNOS, CD14, AKT(PKB), Pellino 2, TLR10, IL-8, TLR6, Lyn, TLR4, TLR2, MD-2",
48,Probable BMP4-mediated induction of EMT in airway epithelium,21,1.867E-07,5.425E-06,1.867E-07,5.425E-06,10,"N-cadherin, Beta-catenin, SNAIL1, COL5A1, TCF8, BMP4, SLUG, MMP-9, SIP1 (ZFHX1B), MMP-2",1.937E-05,3.156E-04,8,"N-cadherin, COL5A1, TCF8, BMP4, SLUG, MMP-9, SIP1 (ZFHX1B), MMP-2",
49,Development_Neural stem cell lineage commitment (schema),38,2.058E-07,7.843E-06,3.025E-07,7.843E-06,13,"Myelin basic protein, Nestin, MCT1 (SLC16A1), MAP-1B, PDGF-R-alpha, PTCH1, Vimentin, WNT7A, BMP4, MAP2, GLAST1/EAAT1, BMP2, LIF",2.058E-07,1.078E-05,13,"Myelin basic protein, Nestin, MCT1 (SLC16A1), MAP-1B, PDGF-R-alpha, PTCH1, Vimentin, WNT7A, BMP4, MAP2, GLAST1/EAAT1, BMP2, LIF",
50,Development_Early embryonal hypaxial myogenesis,37,2.112E-07,6.013E-06,2.112E-07,6.013E-06,13,"Beta-catenin, GLI-1, SMAD3, PKC, PTCH1, WNT7A, FZD7, Dsh, BMP4, Adenylate cyclase, Frizzled, GLI-2, WNT6",5.485E-05,7.092E-04,10,"GLI-1, PKC, PTCH1, WNT7A, FZD7, BMP4, Adenylate cyclase, Frizzled, GLI-2, WNT6",
51,Macrophage and dendritic cell phenotype shift in cancer,100,2.202E-07,6.144E-06,2.202E-07,6.144E-06,22,"STAT3, COX-2 (PTGS2), PGE2R2, MFGE8, IL-1 beta, IL-6, HPRG, PGE2R4, IDO1, MHC class II, CD137 ligand(TNFSF9), TLR7, iNOS, CSF1, Activin A, OSF-2, PLGF, Jagged1, MSR1, IFN-beta, TLR4, TLR2",5.457E-07,2.186E-05,21,"COX-2 (PTGS2), PGE2R2, MFGE8, IL-1 beta, IL-6, HPRG, PGE2R4, IDO1, MHC class II, CD137 ligand(TNFSF9), TLR7, iNOS, CSF1, Activin A, OSF-2, PLGF, Jagged1, MSR1, IFN-beta, TLR4, TLR2",
52,Development_YAP/TAZ-mediated co-regulation of transcription,56,2.259E-07,6.178E-06,2.259E-07,6.178E-06,16,"Beta-catenin, HBP17, TAZ, SNAIL1, SMAD3, CTGF, RUNX2, ITGB2, Oct-3/4, UFO, Neurotractin, CDX2, SLUG, UCA1, SIP1 (ZFHX1B), CDK6",2.566E-05,3.973E-04,13,"HBP17, TAZ, CTGF, RUNX2, ITGB2, Oct-3/4, UFO, Neurotractin, CDX2, SLUG, UCA1, SIP1 (ZFHX1B), CDK6",
53,Expression targets of Tissue factor signaling in cancer,22,2.366E-07,8.042E-06,3.228E-07,8.042E-06,10,"PTX3, ITGB1, PLAUR (uPAR), GRO-1, CTGF, CSF1, Tissue factor, GFPT2, IL-8, PLAU (UPA)",2.366E-07,1.111E-05,10,"PTX3, ITGB1, PLAUR (uPAR), GRO-1, CTGF, CSF1, Tissue factor, GFPT2, IL-8, PLAU (UPA)",
54,Role of fibroblasts in the sensitization phase of allergic contact dermatitis,22,2.366E-07,8.042E-06,3.228E-07,8.042E-06,10,"IL-1 beta, IL-6, Laminin 5, Collagen IV, Fibronectin, Elastin, IL-8, MMP-9, MMP-2, Collagen III",2.366E-07,1.111E-05,10,"IL-1 beta, IL-6, Laminin 5, Collagen IV, Fibronectin, Elastin, IL-8, MMP-9, MMP-2, Collagen III",
55,HGF signaling in colorectal cancer,64,3.036E-07,7.843E-06,3.036E-07,7.843E-06,17,"HGF, COX-2 (PTGS2), Beta-catenin, Laminin 5, PLAUR (uPAR), Actin cytoskeletal, PI3K cat class IA, LAMC2, AKT(PKB), LAMB3, CD44, HGF receptor (Met), EGFR, MMP-9, LAMA3 (Epiligrin), ERK1/2, MMP-2",2.596E-05,3.973E-04,14,"HGF, COX-2 (PTGS2), Laminin 5, PLAUR (uPAR), PI3K cat class IA, LAMC2, AKT(PKB), LAMB3, CD44, HGF receptor (Met), EGFR, MMP-9, LAMA3 (Epiligrin), MMP-2",
56,Immune response_IFN-alpha/beta signaling via JAK/STAT,64,3.036E-07,7.843E-06,3.036E-07,7.843E-06,17,"STAT3, IFI17, TAP1 (PSF1), RSAD2, IFI27, ISG15, STAT4, CCL2, Caspase-8, p53, IFI6, I-TAC, ERAP140, IFN-beta, ISG54, XAF1, RIG-G",2.596E-05,3.973E-04,14,"IFI17, TAP1 (PSF1), RSAD2, IFI27, ISG15, STAT4, CCL2, IFI6, I-TAC, ERAP140, IFN-beta, ISG54, XAF1, RIG-G",
57,"Development_Hedgehog, BMP and Parathyroid hormone in osteogenesis",51,3.552E-07,8.543E-06,3.552E-07,8.543E-06,15,"ALPL, EGR2 (Krox20), TAZ, PTHrP, GLI-1, RUNX2, Osteoprotegerin, G-protein alpha-q/11, PTCH1, BMP6, DLX5, Adenylate cyclase, BMP2, ERK1/2, GLI-2",1.478E-06,4.109E-05,14,"ALPL, EGR2 (Krox20), TAZ, PTHrP, GLI-1, RUNX2, Osteoprotegerin, G-protein alpha-q/11, PTCH1, BMP6, DLX5, Adenylate cyclase, BMP2, GLI-2",
