Enrichment analysis report,,,,,,,,,,,,,
447,Development_Schema: Adult neuron differentiation in the Subventricular and Subgranular Zones,35,4.752E-03,1.706E-02,5.698E-03,1.706E-02,7,"Nestin, DLX2, NCAM1, GAD1, Vimentin, Chordin-like 1, MAP2",4.752E-03,2.108E-02,7,"Nestin, DLX2, NCAM1, GAD1, Vimentin, Chordin-like 1, MAP2",
448,Apoptosis and survival_Role of CDK5 in neuronal death and survival,34,4.817E-03,1.517E-02,4.817E-03,1.517E-02,7,"BAD, NGF, NGFR(TNFRSF16), PI3K cat class IA, AKT(PKB), p53, ERK1/2",1.533E-01,2.806E-01,4,"NGF, NGFR(TNFRSF16), PI3K cat class IA, AKT(PKB)",
449,Hedgehog signaling in prostate cancer,26,4.942E-03,1.542E-02,4.942E-03,1.542E-02,6,"Nestin, SNAIL1, GLI-1, PTCH1, IBP6, GLI-2",1.931E-02,6.087E-02,5,"Nestin, GLI-1, PTCH1, IBP6, GLI-2",
450,Muscle contraction_Delta-type opioid receptor in smooth muscle contraction,26,4.942E-03,1.542E-02,4.942E-03,1.542E-02,6,"Myosin II, Metenkefalin, CPI-17, Leu-enkephalin, G-protein alpha-i family, MRLC",1.931E-02,6.087E-02,5,"Metenkefalin, CPI-17, Leu-enkephalin, G-protein alpha-i family, MRLC",
451,Immune response_Role of HMGB1 in dendritic cell maturation and migration,26,4.942E-03,1.542E-02,4.942E-03,1.542E-02,6,"IL-15, IL-1 beta, IL-6, MHC class II, IL-8, ERK1/2",1.931E-02,6.087E-02,5,"IL-15, IL-1 beta, IL-6, MHC class II, IL-8",
452,Immune response_IL-3 signaling via ERK and PI3K,102,4.989E-03,1.554E-02,4.989E-03,1.554E-02,14,"BAD, Syk, ITGB1, alpha-5/beta-1 integrin, cPKC (conventional), PI3K cat class IA, AKT(PKB), alpha-4/beta-1 integrin, p53, NGAL, cPLA2, Lyn, PI3K cat class IA (p110-delta), ERK1/2",4.810E-02,1.236E-01,11,"Syk, ITGB1, alpha-5/beta-1 integrin, cPKC (conventional), PI3K cat class IA, AKT(PKB), alpha-4/beta-1 integrin, NGAL, cPLA2, Lyn, PI3K cat class IA (p110-delta)",
453,Signal transduction_Additional pathways of NF-kB activation (in the cytoplasm),52,5.004E-03,1.555E-02,5.004E-03,1.555E-02,9,"PI3K cat class IA, Lck, PKC-theta, AKT(PKB), PKC-alpha, Pim-1, Adenylate cyclase, ERK1/2, CDK6",3.859E-02,1.066E-01,7,"PI3K cat class IA, PKC-theta, AKT(PKB), PKC-alpha, Pim-1, Adenylate cyclase, CDK6",
454,Immune response_IL-7 signaling in B lymphocytes,43,5.079E-03,1.561E-02,5.079E-03,1.561E-02,8,"STAT3, Fyn, IL7RA, EBF, AKT(PKB), Lyn, Pim-1, ERK1/2",4.613E-02,1.188E-01,6,"Fyn, IL7RA, EBF, AKT(PKB), Lyn, Pim-1",
455,Th2-cytokines-induced expression of mucins in asthma ,43,5.079E-03,1.561E-02,5.079E-03,1.561E-02,8,"STAT3, GRO-2, IL-6, TGF-beta 2, GRO-1, IL-8, TGF-beta receptor type II, ERK1/2",4.613E-02,1.188E-01,6,"GRO-2, IL-6, TGF-beta 2, GRO-1, IL-8, TGF-beta receptor type II",
456,Environmental factors-induced inflammatory signaling in normal and asthmatic airway epithelium,43,5.079E-03,1.561E-02,5.079E-03,1.561E-02,8,"IL-1 beta, IL-6, iNOS, PKC, ICAM1, IL-8, ERK1/2, sICAM1",1.490E-02,4.987E-02,7,"IL-1 beta, IL-6, iNOS, PKC, ICAM1, IL-8, sICAM1",
457,Regulation of Tissue factor signaling in cancer,43,5.079E-03,1.561E-02,5.079E-03,1.561E-02,8,"TNF-R2, Heparanase 1, ERK2 (MAPK1), AKT(PKB), Tissue factor, p53, EGFR, ERK1/2",1.217E-01,2.379E-01,5,"TNF-R2, Heparanase 1, AKT(PKB), Tissue factor, EGFR",
458,Eosinophil chemotaxis in asthma,64,5.327E-03,1.973E-02,6.705E-03,1.973E-02,10,"NGF, Secretoneurin, S1P1 receptor, NGFR(TNFRSF16), CCL20, Eotaxin-2, C3a, IL-8, G-protein alpha-i family, CCL7",5.327E-03,2.318E-02,10,"NGF, Secretoneurin, S1P1 receptor, NGFR(TNFRSF16), CCL20, Eotaxin-2, C3a, IL-8, G-protein alpha-i family, CCL7",
459,Muscle contraction_Oxytocin signaling in uterus and mammary gland,62,5.333E-03,1.632E-02,5.333E-03,1.632E-02,10,"PGF2aR, COX-2 (PTGS2), cPKC (conventional), AKR1C3, PKC, G-protein alpha-q/11, PKC-alpha, cPLA2, EGFR, ERK1/2",1.287E-02,4.484E-02,9,"PGF2aR, COX-2 (PTGS2), cPKC (conventional), AKR1C3, PKC, G-protein alpha-q/11, PKC-alpha, cPLA2, EGFR",
460,G-protein signaling_Regulation of Cyclic AMP levels by ACM,45,5.543E-03,1.979E-02,6.753E-03,1.979E-02,8,"ACM4, PDE1A, PDE1C, G-protein alpha-q/11, PKC-alpha, G-protein alpha-i family, ACM3, Adenylate cyclase type VII",5.543E-03,2.397E-02,8,"ACM4, PDE1A, PDE1C, G-protein alpha-q/11, PKC-alpha, G-protein alpha-i family, ACM3, Adenylate cyclase type VII",
461,Development_Hedgehog and PTH signaling pathways in bone and cartilage development,36,5.594E-03,1.973E-02,6.695E-03,1.973E-02,7,"PTHrP, MMP-13, GLI-1, RUNX2, G-protein alpha-q/11, PTCH1, GLI-2",5.594E-03,2.403E-02,7,"PTHrP, MMP-13, GLI-1, RUNX2, G-protein alpha-q/11, PTCH1, GLI-2",
462,Cytoskeleton remodeling_Alpha-1A adrenergic receptor-dependent inhibition of PI3K,19,5.610E-03,1.706E-02,5.610E-03,1.706E-02,5,"Myosin II, AKT(PKB), MELC, MLCK, MRLC",2.611E-02,7.852E-02,4,"AKT(PKB), MELC, MLCK, MRLC",
463,Development_Role of growth factors in the maintenance of embryonic stem cell pluripotency,53,5.696E-03,1.706E-02,5.696E-03,1.706E-02,9,"Myosin II, PI3K cat class IA, FGF2, SMAD3, AKT(PKB), Activin A, Oct-3/4, TGF-beta receptor type II, ERK1/2",1.048E-01,2.146E-01,6,"PI3K cat class IA, FGF2, AKT(PKB), Activin A, Oct-3/4, TGF-beta receptor type II",
464,Proinflammatory cytokine production by Th17 cells in asthma,53,5.696E-03,1.706E-02,5.696E-03,1.706E-02,9,"STAT3, COX-2 (PTGS2), IL-1 beta, IL-6, MHC class II, CCL20, C3a, C3, IL-8",1.483E-02,4.987E-02,8,"COX-2 (PTGS2), IL-1 beta, IL-6, MHC class II, CCL20, C3a, C3, IL-8",
465,Cell cycle_Influence of Ras and Rho proteins on G1/S Transition,53,5.696E-03,1.706E-02,5.696E-03,1.706E-02,9,"STAT3, alpha-5/beta-1 integrin, PI3K cat class IA, AKT(PKB), Cyclin E, MLCK, MRLC, ERK1/2, CDK6",4.220E-02,1.139E-01,7,"alpha-5/beta-1 integrin, PI3K cat class IA, AKT(PKB), Cyclin E, MLCK, MRLC, CDK6",
466,Production and activation of TGF-beta in airway smooth muscle cells,35,5.698E-03,1.706E-02,5.698E-03,1.706E-02,7,"TGF-beta 2, TGF-beta, TGF-beta receptor type II, G-protein alpha-i family, TLR4, PLAU (UPA), ERK1/2",1.852E-02,5.964E-02,6,"TGF-beta 2, TGF-beta, TGF-beta receptor type II, G-protein alpha-i family, TLR4, PLAU (UPA)",
467,IL-6 signaling pathway in lung cancer,35,5.698E-03,1.706E-02,5.698E-03,1.706E-02,7,"STAT3, COX-2 (PTGS2), IL-6, PI3K cat class IA, AKT(PKB), EGFR, ERK1/2",6.078E-02,1.461E-01,5,"COX-2 (PTGS2), IL-6, PI3K cat class IA, AKT(PKB), EGFR",
468,Cell adhesion_Alpha-4 integrins in cell migration and adhesion,35,5.698E-03,1.706E-02,5.698E-03,1.706E-02,7,"ITGB1, Actin cytoskeletal, PI3K cat class IA, ITGA4, alpha-4/beta-1 integrin, Fibronectin, F-Actin cytoskeleton",6.078E-02,1.461E-01,5,"ITGB1, PI3K cat class IA, ITGA4, alpha-4/beta-1 integrin, Fibronectin",
469,NALP3 inflammasome activation in age-related macular degeneration (AMD),35,5.698E-03,1.706E-02,5.698E-03,1.706E-02,7,"IL-1 beta, IL-6, IL-18R1, CCL20, Caspase-1, Caspase-8, TLR2",1.852E-02,5.964E-02,6,"IL-1 beta, IL-6, IL-18R1, CCL20, Caspase-1, TLR2",
470,Influence of smoking on activation of EGFR signaling in lung cancer cells,44,5.871E-03,1.754E-02,5.871E-03,1.754E-02,8,"ERK2 (MAPK1), Fra-1, Epiregulin, EGFR, MMP-9, Adenylate cyclase, ERK1/2, MMP-2",5.076E-02,1.264E-01,6,"Fra-1, Epiregulin, EGFR, MMP-9, Adenylate cyclase, MMP-2",
471,Activation of TGF-beta signaling in pancreatic cancer,27,6.020E-03,1.794E-02,6.020E-03,1.794E-02,6,"SMAD3, ERK2 (MAPK1), ICAM1, TGF-beta receptor type II, SLUG, GLI-2",8.058E-02,1.792E-01,4,"ICAM1, TGF-beta receptor type II, SLUG, GLI-2",
472,Eosinophil granule protein release in asthma,54,6.461E-03,1.922E-02,6.461E-03,1.922E-02,9,"NGF, ST2(L), cPKC (conventional), PKC, PRG2, PKC-alpha, C3a, IL-33, ERK1/2",1.650E-02,5.403E-02,8,"NGF, ST2(L), cPKC (conventional), PKC, PRG2, PKC-alpha, C3a, IL-33",
473,Cigarette smoke components TCDD and Benzo[a]pyrene and receptor AHR signaling in lung epithelial cells,36,6.695E-03,1.973E-02,6.695E-03,1.973E-02,7,"COX-2 (PTGS2), IL-1 beta, TGF-alpha, SMAD3, CYP1A1, CCL2, TGF-beta receptor type II",2.111E-02,6.572E-02,6,"COX-2 (PTGS2), IL-1 beta, TGF-alpha, CYP1A1, CCL2, TGF-beta receptor type II",
474,HBV signaling via protein kinases leading to HCC,36,6.695E-03,1.973E-02,6.695E-03,1.973E-02,7,"cPKC (conventional), SMAD3, PKC, ERK2 (MAPK1), PKC-alpha, MMP-9, ERK1/2",1.775E-01,3.127E-01,4,"cPKC (conventional), PKC, PKC-alpha, MMP-9",
475,Upregulation of MITF in melanoma,36,6.695E-03,1.973E-02,6.695E-03,1.973E-02,7,"SOX10, ERK2 (MAPK1), alpha-MSH, HGF receptor (Met), p16INK4, IMP1(ZBP1), ERK1/2",6.718E-02,1.567E-01,5,"SOX10, alpha-MSH, HGF receptor (Met), p16INK4, IMP1(ZBP1)",
476,Signal transduction_Angiotensin II/ AGTR1 signaling via JAK/STAT,45,6.753E-03,1.979E-02,6.753E-03,1.979E-02,8,"STAT3, IL-6, IL-18R1, Fyn, PKC, RGS2, p53, ERK1/2",1.402E-01,2.664E-01,5,"IL-6, IL-18R1, Fyn, PKC, RGS2",
477,Development_H3K36 demethylation in stem cell maintenance,20,7.096E-03,2.075E-02,7.096E-03,2.075E-02,5,"p15, p14ARF, p53, p16INK4, CDK6",3.110E-02,8.937E-02,4,"p15, p14ARF, p16INK4, CDK6",
478,Immune response_Innate immune response to RNA viral infection,28,7.258E-03,2.118E-02,7.258E-03,2.118E-02,6,"Caspase-10, TLR7, Caspase-8, TLR3, IL-8, IFN-beta",2.609E-02,7.852E-02,5,"Caspase-10, TLR7, TLR3, IL-8, IFN-beta",
479,Immune response_Platelet activating factor/ PTAFR pathway signaling,55,7.301E-03,2.122E-02,7.301E-03,2.122E-02,9,"STAT3, IL-1 beta, PI3K cat class IA, AKT(PKB), CCL2, MMP-9, G-protein alpha-i family, Adenylate cyclase, F-Actin cytoskeleton",5.008E-02,1.263E-01,7,"IL-1 beta, PI3K cat class IA, AKT(PKB), CCL2, MMP-9, G-protein alpha-i family, Adenylate cyclase",
480,Aberrant B-Raf signaling in melanoma progression,55,7.301E-03,2.122E-02,7.301E-03,2.122E-02,9,"BAD, ITGB1, ERK2 (MAPK1), AKT(PKB), SPRY2, ITGB3, MAP2, AKT3, ERK1/2",1.197E-01,2.373E-01,6,"ITGB1, AKT(PKB), SPRY2, ITGB3, MAP2, AKT3",
481,Stem cells_Notch signaling in medulloblastoma stem cells,29,7.402E-03,2.464E-02,8.671E-03,2.464E-02,6,"GLI-1, HES5, PTCH1, FKHL1, Jagged1, GLI-2",7.402E-03,2.991E-02,6,"GLI-1, HES5, PTCH1, FKHL1, Jagged1, GLI-2",
482,EZH2 in Prostate Cancer,29,7.402E-03,2.464E-02,8.671E-03,2.464E-02,6,"Follistatin, Keratin 17, Alpha-synuclein, ITGB2, RUNX3, Ephrin-B receptor 6",7.402E-03,2.991E-02,6,"Follistatin, Keratin 17, Alpha-synuclein, ITGB2, RUNX3, Ephrin-B receptor 6",
483,Noise-induced hair cell death and spiral ganglion neuron degeneration,96,7.486E-03,2.167E-02,7.486E-03,2.167E-02,13,"BAD, STAT3, COX-2 (PTGS2), IL-1 beta, IL-6, AMPK gamma subunit, iNOS, CCL2, Caspase-8, p53, ERM proteins, Actin, F-Actin cytoskeleton",2.364E-01,3.874E-01,8,"COX-2 (PTGS2), IL-1 beta, IL-6, AMPK gamma subunit, iNOS, CCL2, ERM proteins, Actin",
484,Dysregulation of germinal center response in SLE,65,7.486E-03,2.167E-02,7.486E-03,2.167E-02,10,"STAT3, IL-15, MFGE8, IL-15RA, TLR7, C3dg, alpha-4/beta-1 integrin, ICAM1, BOB1, PI3K cat class IA (p110-delta)",1.724E-02,5.605E-02,9,"IL-15, MFGE8, IL-15RA, TLR7, C3dg, alpha-4/beta-1 integrin, ICAM1, BOB1, PI3K cat class IA (p110-delta)",
485,Substance P-mediated inflammation and pain in Sickle cell disease,38,7.604E-03,2.540E-02,9.068E-03,2.540E-02,7,"IL-1 beta, IL-6, CD14, alpha-4/beta-1 integrin, Tissue factor, ICAM1, IL-8",7.604E-03,3.019E-02,7,"IL-1 beta, IL-6, CD14, alpha-4/beta-1 integrin, Tissue factor, ICAM1, IL-8",
486,Development_Schema: Osteogenic and adipogenic differentiation of mesenchymal stem cells,21,7.694E-03,2.490E-02,8.835E-03,2.490E-02,5,"RUNX2, BMP6, Beta-adrenergic receptor, BMP4, BMP2",7.694E-03,3.046E-02,5,"RUNX2, BMP6, Beta-adrenergic receptor, BMP4, BMP2",
487,Immune response_Inhibitory action of Lipoxins on pro-inflammatory TNF-alpha signaling,46,7.731E-03,2.224E-02,7.731E-03,2.224E-02,8,"STAT3, IL-1 beta, IL-6, TNF-R2, PI3K cat class IA, AKT(PKB), IL-8, Cyclin E",2.114E-02,6.572E-02,7,"IL-1 beta, IL-6, TNF-R2, PI3K cat class IA, AKT(PKB), IL-8, Cyclin E",
488,EGFR signaling in Prostate Cancer,46,7.731E-03,2.224E-02,7.731E-03,2.224E-02,8,"STAT3, PI3K cat class IA, TGF-alpha, ERK2 (MAPK1), AKT(PKB), Caveolin-1, EGFR, ERK1/2",1.499E-01,2.774E-01,5,"PI3K cat class IA, TGF-alpha, AKT(PKB), Caveolin-1, EGFR",
489,Dual function of Treg cells in cancer development,46,7.731E-03,2.224E-02,7.731E-03,2.224E-02,8,"STAT3, COX-2 (PTGS2), IL-6, Beta-catenin, 5'-NTD, ETS1, WNT, Neuropilin-1",6.084E-02,1.461E-01,6,"COX-2 (PTGS2), IL-6, 5'-NTD, ETS1, WNT, Neuropilin-1",
490,IL-6 signaling in colorectal cancer,37,7.815E-03,2.243E-02,7.815E-03,2.243E-02,7,"STAT3, IL-6, TNF-R2, ICAM1, p53, Cyclin E, TGF-beta receptor type II",7.394E-02,1.684E-01,5,"IL-6, TNF-R2, ICAM1, Cyclin E, TGF-beta receptor type II",
491,Nociception_Nociceptin receptor signaling,76,8.194E-03,2.347E-02,8.194E-03,2.347E-02,11,"STAT3, cPKC (conventional), G-protein alpha-15, PKC, PKC-alpha, Kir3.4, cPLA2, Actin, G-protein alpha-i family, Adenylate cyclase, ERK1/2",4.256E-02,1.139E-01,9,"cPKC (conventional), G-protein alpha-15, PKC, PKC-alpha, Kir3.4, cPLA2, Actin, G-protein alpha-i family, Adenylate cyclase",
492,Regulation of Beta-catenin activity in colorectal cancer,56,8.223E-03,2.351E-02,8.223E-03,2.351E-02,9,"PGE2R2, PGE2R4, Beta-catenin, PI3K cat class IA, SNAIL1, DVL-3, AKT(PKB), Adenylate cyclase, ERK1/2",2.595E-01,4.157E-01,5,"PGE2R2, PGE2R4, PI3K cat class IA, AKT(PKB), Adenylate cyclase",
493,Common mechanisms of Th17 cell migration,48,8.256E-03,2.747E-02,1.000E-02,2.747E-02,8,"MCAM, CCL20, alpha-4/beta-1 integrin, ICAM1, CCL2, I-TAC, G-protein alpha-i family, CCL7",8.256E-03,3.250E-02,8,"MCAM, CCL20, alpha-4/beta-1 integrin, ICAM1, CCL2, I-TAC, G-protein alpha-i family, CCL7",
494,Oxidative stress_ROS-induced cellular signaling,108,8.267E-03,2.359E-02,8.267E-03,2.359E-02,14,"GSTP1, Syk, COX-2 (PTGS2), IL-1 beta, IL-6, NOXA, iNOS, PKC, HES5, AKT(PKB), p53, IL-8, Carbonic anhydrase IX, ERK1/2",3.295E-02,9.407E-02,12,"GSTP1, Syk, COX-2 (PTGS2), IL-1 beta, IL-6, NOXA, iNOS, PKC, HES5, AKT(PKB), IL-8, Carbonic anhydrase IX",
495,Type 2 diabetes (general schema),14,8.606E-03,2.676E-02,9.667E-03,2.676E-02,4,"IL-1 beta, IL-6, POMC, CCL2",8.606E-03,3.349E-02,4,"IL-1 beta, IL-6, POMC, CCL2",
496,Immune response_Fc gamma R-mediated phagocytosis in macrophages,47,8.812E-03,2.489E-02,8.812E-03,2.489E-02,8,"Syk, Myosin II, Actin cytoskeletal, PI3K cat class IA, Fc gamma RII alpha, PKC-alpha, Lyn, F-Actin cytoskeleton",1.599E-01,2.907E-01,5,"Syk, PI3K cat class IA, Fc gamma RII alpha, PKC-alpha, Lyn",
497,Mitogenic action of ESR1 (membrane) in breast cancer,47,8.812E-03,2.489E-02,8.812E-03,2.489E-02,8,"SGK1, ERK2 (MAPK1), AKT(PKB), Cyclin E, EGFR, MMP-9, ERK1/2, MMP-2",6.629E-02,1.557E-01,6,"SGK1, AKT(PKB), Cyclin E, EGFR, MMP-9, MMP-2",
498,Canonical Leptin pathways in breast cancer,47,8.812E-03,2.489E-02,8.812E-03,2.489E-02,8,"STAT3, IL-1 beta, Beta-catenin, PI3K cat class IA, AKT(PKB), IRS-2, Tcf(Lef), ERK1/2",1.599E-01,2.907E-01,5,"IL-1 beta, PI3K cat class IA, AKT(PKB), IRS-2, Tcf(Lef)",
499,Apoptosis and survival_NGF/ TrkA PI3K-mediated signaling,77,9.028E-03,2.539E-02,9.028E-03,2.539E-02,11,"BAD, NGF, Myosin II, Actin cytoskeletal, PI3K cat class IA, AKT(PKB), MSN (moesin), ARAP3, CLCN4, MRLC, ERK1/2",1.932E-01,3.339E-01,7,"NGF, PI3K cat class IA, AKT(PKB), MSN (moesin), ARAP3, CLCN4, MRLC",
500,Cell cycle_Regulation of G1/S transition (part 1),38,9.068E-03,2.540E-02,9.068E-03,2.540E-02,7,"p15, TGF-beta 2, SMAD3, p16INK4, Cyclin E, TGF-beta receptor type II, CDK6",2.699E-02,7.973E-02,6,"p15, TGF-beta 2, p16INK4, Cyclin E, TGF-beta receptor type II, CDK6",
501,Immune response_Role of PKR in stress-induced antiviral cell response,57,9.231E-03,2.570E-02,9.231E-03,2.570E-02,9,"IL-1 beta, IL-6, Caspase-8, TLR3, IL-8, IFN-beta, TLR4, TLR2, ERK1/2",5.882E-02,1.428E-01,7,"IL-1 beta, IL-6, TLR3, IL-8, IFN-beta, TLR4, TLR2",
502,CCR7 signaling pathways in dendritic cells in allergic contact dermatitis,57,9.231E-03,2.570E-02,9.231E-03,2.570E-02,9,"Myosin II, Actin cytoskeletal, Rac2, AKT(PKB), alpha-4/beta-1 integrin, ICAM1, Fibronectin, G-protein alpha-i family, ERK1/2",1.356E-01,2.587E-01,6,"Rac2, AKT(PKB), alpha-4/beta-1 integrin, ICAM1, Fibronectin, G-protein alpha-i family",
503,Signal transduction_Angiotensin II signaling via Beta-arrestin,57,9.231E-03,2.570E-02,9.231E-03,2.570E-02,9,"BAD, DGK, TRPC3, AKT(PKB), MYLK1, EGFR, MLCK, MRLC, ERK1/2",5.882E-02,1.428E-01,7,"DGK, TRPC3, AKT(PKB), MYLK1, EGFR, MLCK, MRLC",
504,Ligand-independent activation of Androgen receptor in Prostate Cancer,67,9.257E-03,2.572E-02,9.257E-03,2.572E-02,10,"STAT3, Beta-catenin, PI3K cat class IA, FGF2, ERK2 (MAPK1), AKT(PKB), Tcf(Lef), EGFR, Frizzled, IBP3",1.158E-01,2.322E-01,7,"PI3K cat class IA, FGF2, AKT(PKB), Tcf(Lef), EGFR, Frizzled, IBP3",
505,Development_H3K9 demethylases in pluripotency maintenance of stem cells,22,9.463E-03,2.927E-02,1.085E-02,2.927E-02,5,"ZFP57, AKT(PKB), Oct-3/4, CDX2, LBP9",9.463E-03,3.580E-02,5,"ZFP57, AKT(PKB), Oct-3/4, CDX2, LBP9",
506,IL-6 signaling in tumor-associated monocytes/macrophages in breast cancer,14,9.667E-03,2.676E-02,9.667E-03,2.676E-02,4,"STAT3, IL-6, Fra-1, MMP-9",5.054E-02,1.264E-01,3,"IL-6, Fra-1, MMP-9",
507,Signal transduction_Angiotensin II/ AGTR1 signaling via RhoA and JNK,78,9.927E-03,2.742E-02,9.927E-03,2.742E-02,11,"RECK, CTGF, G-protein alpha-q/11, CCL2, MMP-9, TLR4, MLCK, MRLC, ERK1/2, MMP-2, Collagen III",2.057E-02,6.454E-02,10,"RECK, CTGF, G-protein alpha-q/11, CCL2, MMP-9, TLR4, MLCK, MRLC, MMP-2, Collagen III",
508,Immune response_IL-12 signaling pathway,48,1.000E-02,2.747E-02,1.000E-02,2.747E-02,8,"STAT3, PI3K cat class IA, Lck, iNOS, AKT(PKB), RUNX3, STAT4, ERM",7.202E-02,1.654E-01,6,"PI3K cat class IA, iNOS, AKT(PKB), RUNX3, STAT4, ERM",
509,Development_Role of Thyroid hormone in regulation of oligodendrocyte differentiation,48,1.000E-02,2.747E-02,1.000E-02,2.747E-02,8,"p15, NGF, Myelin basic protein, p14ARF, PDGF-R-alpha, AKT(PKB), ID4, p53",2.618E-02,7.853E-02,7,"p15, NGF, Myelin basic protein, p14ARF, PDGF-R-alpha, AKT(PKB), ID4",
510,"Immune response_Mast cell proliferation, differentiation and survival",30,1.027E-02,2.814E-02,1.027E-02,2.814E-02,6,"STAT3, Syk, Fyn, AKT(PKB), Lyn, ERK1/2",1.092E-01,2.213E-01,4,"Syk, Fyn, AKT(PKB), Lyn",
511,Development_Negative regulation of WNT/Beta-catenin signaling in the nucleus,89,1.031E-02,2.814E-02,1.031E-02,2.814E-02,12,"Beta-catenin, RUNX3, HIC5, Oct-3/4, Tcf(Lef), Dsh, WNT, CDX2, TCF7 (TCF1), CDX1, Frizzled, DACT1",4.581E-02,1.188E-01,10,"RUNX3, HIC5, Oct-3/4, Tcf(Lef), WNT, CDX2, TCF7 (TCF1), CDX1, Frizzled, DACT1",
512,"Immune response_TLR5, TLR7, TLR8 and TLR9 signaling pathways",58,1.033E-02,2.814E-02,1.033E-02,2.814E-02,9,"STAT3, IL-1 beta, IL-6, PI3K cat class IA, TLR7, AKT(PKB), IL-8, IFN-beta, ERK1/2",6.352E-02,1.510E-01,7,"IL-1 beta, IL-6, PI3K cat class IA, TLR7, AKT(PKB), IL-8, IFN-beta",
513,Hyaluronic acid/ CD44 signaling in cancer,58,1.033E-02,2.814E-02,1.033E-02,2.814E-02,9,"STAT3, Ankyrin 1, HOXD10, Actin cytoskeletal, ERK2 (MAPK1), Collagen IV, CD44, MMP-9, MDR1",1.439E-01,2.712E-01,6,"Ankyrin 1, HOXD10, Collagen IV, CD44, MMP-9, MDR1",
514,Development_Regulation of endothelial progenitor cell differentiation from adult stem cells,60,1.045E-02,3.361E-02,1.282E-02,3.361E-02,9,"Angiopoietin 1, TIE2, PI3K cat class IA, AKT(PKB), CSF1, alpha-4/beta-1 integrin, ICAM1, MMP-9, G-protein alpha-i family",1.045E-02,3.822E-02,9,"Angiopoietin 1, TIE2, PI3K cat class IA, AKT(PKB), CSF1, alpha-4/beta-1 integrin, ICAM1, MMP-9, G-protein alpha-i family",
515,Signal transduction_Leptin signaling via JAK/STAT and MAPK cascade,39,1.046E-02,2.845E-02,1.046E-02,2.845E-02,7,"STAT3, POMC, cPLA2, NT/NN, MMP-9, BMP2, ERK1/2",8.852E-02,1.926E-01,5,"POMC, cPLA2, NT/NN, MMP-9, BMP2",
516,EGF- and HGF-dependent stimulation of metastasis in gastric cancer,22,1.085E-02,2.927E-02,1.085E-02,2.927E-02,5,"HGF, HGF receptor (Met), EGFR, PLAU (UPA), ERK1/2",4.264E-02,1.139E-01,4,"HGF, HGF receptor (Met), EGFR, PLAU (UPA)",
517,Ubiquitin-proteasome system in Huntington's disease,22,1.085E-02,2.927E-02,1.085E-02,2.927E-02,5,"PSMB9, PKC-alpha, p53, NR2A, NR2",4.264E-02,1.139E-01,4,"PSMB9, PKC-alpha, NR2A, NR2",
518,Immune response_IL-15 signaling via JAK-STAT cascade,22,1.085E-02,2.927E-02,1.085E-02,2.927E-02,5,"STAT3, Syk, IL-15, sIL-15RA, IL-15RA",4.264E-02,1.139E-01,4,"Syk, IL-15, sIL-15RA, IL-15RA",
519,Immune response_Regulatory role of C1q in platelet activation,15,1.117E-02,3.330E-02,1.253E-02,3.330E-02,4,"PKC, Fc gamma RII alpha, C3b, Collagen III",1.117E-02,4.026E-02,4,"PKC, Fc gamma RII alpha, C3b, Collagen III",
520,Stem cells_Aberrant Hedgehog signaling in medulloblastoma stem cells,15,1.117E-02,3.330E-02,1.253E-02,3.330E-02,4,"GLI-1, SFRP1, PTCH1, GLI-2",1.117E-02,4.026E-02,4,"GLI-1, SFRP1, PTCH1, GLI-2",
521,Development_Melanocyte development and pigmentation,49,1.131E-02,3.028E-02,1.131E-02,3.028E-02,8,"Beta-catenin, SOX10, PI3K cat class IA, AKT(PKB), ACTH, alpha-MSH, Frizzled, ERK1/2",7.803E-02,1.764E-01,6,"SOX10, PI3K cat class IA, AKT(PKB), ACTH, alpha-MSH, Frizzled",
522,Transcription_CREB signaling pathway,49,1.131E-02,3.028E-02,1.131E-02,3.028E-02,8,"CDO1, cPKC (conventional), PI3K cat class IA, Galpha(s)-specific amine GPCRs, AKT(PKB), PKC-alpha, DREAM, ERK1/2",2.898E-02,8.507E-02,7,"CDO1, cPKC (conventional), PI3K cat class IA, Galpha(s)-specific amine GPCRs, AKT(PKB), PKC-alpha, DREAM",
523,Development_PEDF signaling,49,1.131E-02,3.028E-02,1.131E-02,3.028E-02,8,"IL-1 beta, IL-6, NGF, c-IAP2, PI3K cat class IA, AKT(PKB), Fra-1, ERK1/2",2.898E-02,8.507E-02,7,"IL-1 beta, IL-6, NGF, c-IAP2, PI3K cat class IA, AKT(PKB), Fra-1",
524,Development_G-CSF signaling,49,1.131E-02,3.028E-02,1.131E-02,3.028E-02,8,"STAT3, ITGA9, c-IAP2, PI3K cat class IA, AKT(PKB), Lyn, ERK1/2, GFI-1",7.803E-02,1.764E-01,6,"ITGA9, c-IAP2, PI3K cat class IA, AKT(PKB), Lyn, GFI-1",
525,Stem cells_MMP-14-induced COX-2 expression in glioblastoma stem cells,23,1.149E-02,3.404E-02,1.315E-02,3.404E-02,5,"COX-2 (PTGS2), AKT(PKB), cPLA2, MMP-14, MMP-2",1.149E-02,4.077E-02,5,"COX-2 (PTGS2), AKT(PKB), cPLA2, MMP-14, MMP-2",
526,Translation_Opioid receptors in regulation of translation ,23,1.149E-02,3.404E-02,1.315E-02,3.404E-02,5,"Metenkefalin, AKT(PKB), Leu-enkephalin, G-protein alpha-i family, Kappa-type opioid receptor",1.149E-02,4.077E-02,5,"Metenkefalin, AKT(PKB), Leu-enkephalin, G-protein alpha-i family, Kappa-type opioid receptor",
527,Development_Delta- and kappa-type opioid receptors signaling via beta-arrestin,23,1.149E-02,3.404E-02,1.315E-02,3.404E-02,5,"Metenkefalin, PKC, Leu-enkephalin, G-protein alpha-i family, Kappa-type opioid receptor",1.149E-02,4.077E-02,5,"Metenkefalin, PKC, Leu-enkephalin, G-protein alpha-i family, Kappa-type opioid receptor",
528,Role of IL-17-producing T cells in allergic contact dermatitis,23,1.149E-02,3.404E-02,1.315E-02,3.404E-02,5,"IL-6, MHC class II, GRO-1, ICAM1, IL-8",1.149E-02,4.077E-02,5,"IL-6, MHC class II, GRO-1, ICAM1, IL-8",
529,IL-6 signaling in Prostate Cancer,40,1.201E-02,3.208E-02,1.201E-02,3.208E-02,7,"STAT3, IL-6, BMX, PI3K cat class IA, ERK2 (MAPK1), AKT(PKB), Pim-1",9.633E-02,2.023E-01,5,"IL-6, BMX, PI3K cat class IA, AKT(PKB), Pim-1",
530,Neutrophil adhesion and transendothelial migration in asthma,31,1.207E-02,3.219E-02,1.207E-02,3.219E-02,6,"alpha-4/beta-1 integrin, ICAM1, alpha-9/beta-1 integrin, IL-8, cPLA2, ERK1/2",3.881E-02,1.066E-01,5,"alpha-4/beta-1 integrin, ICAM1, alpha-9/beta-1 integrin, IL-8, cPLA2",
531,Modulation of tumor response to cytotoxic T cells by hypoxia in tumors,50,1.274E-02,3.352E-02,1.274E-02,3.352E-02,8,"STAT3, 5'-NTD, CD137 ligand(TNFSF9), HOXA1, AKT(PKB), CD137(TNFRSF9), ERK1/2, PD-L1",8.431E-02,1.846E-01,6,"5'-NTD, CD137 ligand(TNFSF9), HOXA1, AKT(PKB), CD137(TNFRSF9), PD-L1",
532,Development_GM-CSF signaling,50,1.274E-02,3.352E-02,1.274E-02,3.352E-02,8,"BAD, STAT3, PI3K cat class IA, AKT(PKB), CCL2, Lyn, Pim-1, ERK1/2",1.912E-01,3.310E-01,5,"PI3K cat class IA, AKT(PKB), CCL2, Lyn, Pim-1",
533,Proteases and EGFR-activated mucin production in airway epithelium in COPD,50,1.274E-02,3.352E-02,1.274E-02,3.352E-02,8,"PPARGC1 (PGC1-alpha), PI3K cat class IA, TGF-alpha, AKT(PKB), CD44, EGFR, MMP-9, ERK1/2",3.198E-02,9.151E-02,7,"PPARGC1 (PGC1-alpha), PI3K cat class IA, TGF-alpha, AKT(PKB), CD44, EGFR, MMP-9",
534,Immune response_C5a signaling,50,1.274E-02,3.352E-02,1.274E-02,3.352E-02,8,"BAD, IL-1 beta, Rac2, PKC, AKT(PKB), IL-8, G-protein alpha-i family, ERK1/2",8.431E-02,1.846E-01,6,"IL-1 beta, Rac2, PKC, AKT(PKB), IL-8, G-protein alpha-i family",
535,Signal transduction_CXCR4 signaling via second messengers and JAK/STAT,50,1.274E-02,3.352E-02,1.274E-02,3.352E-02,8,"STAT3, alpha-1 Adrenergic receptor, Beta-2 adrenergic receptor, Alpha-1B adrenergic receptor, G-protein alpha-i family, Adenylate cyclase, MLCK, MRLC",3.198E-02,9.151E-02,7,"alpha-1 Adrenergic receptor, Beta-2 adrenergic receptor, Alpha-1B adrenergic receptor, G-protein alpha-i family, Adenylate cyclase, MLCK, MRLC",
536,IGF family signaling in colorectal cancer,60,1.282E-02,3.361E-02,1.282E-02,3.361E-02,9,"COX-2 (PTGS2), Beta-catenin, ERK2 (MAPK1), AKT(PKB), IRS-2, IL-8, IBP, ERK1/2, IBP3",1.613E-01,2.921E-01,6,"COX-2 (PTGS2), AKT(PKB), IRS-2, IL-8, IBP, IBP3",
537,Cytoskeleton remodeling_ESR1 action on cytoskeleton remodeling and cell migration,23,1.315E-02,3.404E-02,1.315E-02,3.404E-02,5,"PI3K cat class IA, AKT(PKB), MSN (moesin), ERM proteins, F-Actin cytoskeleton",4.920E-02,1.246E-01,4,"PI3K cat class IA, AKT(PKB), MSN (moesin), ERM proteins",
538,FGF signaling in gastric cancer,23,1.315E-02,3.404E-02,1.315E-02,3.404E-02,5,"Beta-catenin, FGF2, ERK2 (MAPK1), MMP-9, PLAU (UPA)",1.647E-01,2.953E-01,3,"FGF2, MMP-9, PLAU (UPA)",
539,Role of Leptin in regulation of eating behavior in obesity,23,1.315E-02,3.404E-02,1.315E-02,3.404E-02,5,"NPY, STAT3, POMC, AKT(PKB), ERK1/2",1.647E-01,2.953E-01,3,"NPY, POMC, AKT(PKB)",
