Enrichment analysis report,,,,,,,,,,,,,
Enrichment by Pathway Maps,,,,,transformed_FC,,,,rna_all_FC,,,,
#,Maps,Total,min(pValue),Min FDR,p-value,FDR,In Data,"Network Objects from
Active Data",p-value,FDR,In Data,"Network Objects from
Active Data",
1,Apoptosis and survival_NGF/ TrkA PI3K-mediated signaling,77,5.804E-09,5.339E-06,1.114E-04,2.483E-03,28,"AKT1, Calcineurin A (catalytic), GRB2, GAB1, H-Ras, PAK2, ERK1/2, p190RhoGAP, Myosin II, PAK1, ILK, RhoG, PI3K reg class IA (p85), FOXO4, p70 S6 kinase1, Calmodulin, Kalirin, MRLC, Bcl-2, VAV-2, Tau (MAPT), PARD6A, VAV-3, LIMK2, AKT(PKB), PDK (PDPK1), PREX1, Tubulin (in microtubules)",5.804E-09,5.339E-06,41,"TrkA, AKT1, ELMO2, Calcineurin A (catalytic), GRB2, GAB1, H-Ras, PAK2, ERK1/2, PKC-zeta, Rac1, BAD, RhoG, PI3K reg class IA (p85), Kalirin, VAV-2, Tau (MAPT), LIMK2, AKT(PKB), PDK (PDPK1), Tubulin (in microtubules), BETA-PIX, Destrin, p190RhoGAP, Myosin II, PAK1, ILK, 4E-BP1, MRCKalpha, FOXO4, p70 S6 kinase1, Cofilin, non-muscle, Calmodulin, N-WASP, MRLC, Bcl-2, FOXO3A, PARD6A, VAV-3, Cofilin, PREX1",
2,Development_PIP3 signaling in cardiac myocytes,47,1.163E-08,5.339E-06,8.684E-05,2.127E-03,20,"Tuberin, G-protein alpha-12 family, GRB2, GAB1, Insulin processed, H-Ras, Cyclin D, p90Rsk, GYS1, p70 S6 kinase1, PI3K reg class IA, PTEN, Insulin receptor, GSK3 alpha/beta, Bcl-XL, IGF-1 receptor, AKT(PKB), IGF-1, PDK (PDPK1), PARD6",1.163E-08,5.339E-06,29,"Tuberin, GRB2, GAB1, Insulin processed, IRS-1, H-Ras, 14-3-3, PKC-zeta, BAD, PI3K reg class IA, Insulin receptor, GSK3 alpha/beta, Bcl-XL, IGF-1 receptor, AKT(PKB), PDK (PDPK1), c-Myc, PARD6, G-protein alpha-12 family, Cyclin D, PTP-1B, Hamartin, GYS1, 4E-BP1, p70 S6 kinase1, PTEN, FOXO3A, IGF-1, PI3K reg class IB (p101)",
3,Development_Positive regulation of WNT/Beta-catenin signaling in the cytoplasm,76,1.378E-08,5.339E-06,5.815E-04,7.718E-03,26,"GSKIP, TBL1X, EGF, BIG1, GRB2, SIAH2, Insulin processed, PP1-cat, Alpha-1 catenin, HSP105, PKA-reg type II (cAMP-dependent), Dsh, ILK, YAP1 (YAp65), BIG2, WNT, Insulin receptor, USP7, FAK1, GSK3 alpha/beta, PP2C alpha, IGF-1 receptor, JNK(MAPK8-10), AKT(PKB), Axin, SET7",1.378E-08,5.339E-06,40,"TBL1X, EGF, BIG1, GRB2, Insulin processed, NKD1, IRS-1, UBE2B, PP1-cat, Alpha-1 catenin, 14-3-3, Makorin-1, Dsh, USP47, ZBED3, Rac1, Insulin receptor, GSK3 alpha/beta, IGF-1 receptor, AKT(PKB), Axin, GSKIP, HECTD1, SIAH2, Tcf(Lef), c-Jun, HSP105, PKA-reg type II (cAMP-dependent), ILK, Trabid, Tankyrases, BIG2, WNT, USP7, FAK1, PP2C alpha, JNK(MAPK8-10), Parathyroid hormone, Frizzled, SET7",
4,Signal transduction_mTORC1 downstream signaling,60,1.429E-08,5.339E-06,3.612E-07,1.079E-04,28,"PDK1, eEF2, SREBP1 (nuclear), G6PD, SCD, PDCD4, MAF1, Cyclin D, eIF4B, HMGCS2, Cytochrome c, MVK, SIN1, ULK1, STAT3, RRN3, p70 S6 kinases, GLUT1, p70 S6 kinase1, MTHFD2, eIF4A, ACSL3, MDM2, 4E-BP2, CLIP170, p70 S6 kinase2, p27KIP1, GRB10",1.429E-08,5.339E-06,34,"SREBP1 (nuclear), SCD, IRS-1, eIF4E, ATF-4, HMGCS2, Cytochrome c, SIN1, ULK1, BAD, p70 S6 kinases, ACSL3, MDM2, 4E-BP2, CLIP170, p27KIP1, YY1, eEF2, G6PD, PDCD4, MAF1, Cyclin D, eEF2K, eIF4B, MVK, 4E-BP1, RRN3, GLUT1, p70 S6 kinase1, MTHFD2, eIF4A, ATG13, p70 S6 kinase2, GRB10",
5,Signal transduction_AKT signaling,43,2.177E-08,6.509E-06,8.129E-04,8.613E-03,17,"Tuberin, GAB1, Cyclin D, p21, GYS1, I-kB, p70 S6 kinase1, PI3K reg class IA, PTEN, MDM2, GSK3 alpha/beta, Bcl-XL, IGF-1 receptor, AKT(PKB), HSP90, PDK (PDPK1), p27KIP1",2.177E-08,6.509E-06,27,"Tuberin, Cyclin D3, GAB1, IRS-1, IKK (cat), p21, BAD, I-kB, PI3K reg class IA, IKK-alpha, MDM2, GSK3 alpha/beta, Bcl-XL, IGF-1 receptor, FasL(TNFSF6), AKT(PKB), HSP90, PDK (PDPK1), p27KIP1, c-Myc, Cyclin D, Hamartin, GYS1, 4E-BP1, p70 S6 kinase1, PTEN, FOXO3A",
6,Development_G-CSF-induced myeloid differentiation,30,5.338E-08,4.349E-05,5.338E-08,4.349E-05,19,"PU.1, E2F1, H-Ras, CCR2, ERK1/2, Lactoferrin, c-Raf-1, ITGAM, PERM, STAT3, Rb protein, CalDAG-GEFII, MEK1/2, G-CSF receptor, Myeloblastin, SHP-1, G-CSF, p27KIP1, C/EBPalpha",3.624E-07,5.548E-05,20,"H-Ras, CCR2, ERK1/2, Lactoferrin, Rb protein, CalDAG-GEFII, C/EBPepsilon, G-CSF receptor, SHP-1, p27KIP1, c-Myc, PU.1, E2F1, c-Jun, ITGAM, PERM, SHP-2, Myeloblastin, G-CSF, C/EBPalpha",
7,Development_Ligand-independent activation of ESR1 and ESR2,44,5.822E-08,4.349E-05,5.822E-08,4.349E-05,24,"MEK1(MAP2K1), EGF, GRB2, ESR1 (nuclear), NCOA3 (pCIP/SRC3), Neuregulin 1, H-Ras, ERK1/2, ErbB3, PKA-reg (cAMP-dependent), c-Raf-1, p90RSK1, ESR2 (nuclear), Adenylate cyclase type V, G-protein alpha-s, ErbB2, PI3K reg class IA, IGF-1 receptor, Cyclin D1, AKT(PKB), TFF1, IGF-1, PDK (PDPK1), ERK1 (MAPK3)",2.382E-04,4.178E-03,21,"EGF, GRB2, ESR1 (nuclear), IRS-1, H-Ras, ERK1/2, ErbB3, PKA-reg (cAMP-dependent), ESR2 (nuclear), Adenylate cyclase type V, ErbB2, PI3K reg class IA, IGF-1 receptor, AKT(PKB), PDK (PDPK1), ERK1 (MAPK3), NCOA3 (pCIP/SRC3), G-protein alpha-s, Cyclin D1, TFF1, IGF-1",
8,Regulation of lipid metabolism_Insulin signaling: generic cascades,47,6.178E-08,1.539E-05,3.033E-07,1.079E-04,24,"MEK1(MAP2K1), Tuberin, eEF2, IPP-1, GRB2, eIF2B5, Insulin processed, PDE3B, PP1-cat, H-Ras, ERK1/2, eIF4B, PKA-reg (cAMP-dependent), c-Raf-1, p90RSK1, LIPS, PP1G regulatory subunit, ACLY, p70 S6 kinase1, PI3K reg class IA, Insulin receptor, AKT(PKB), PDK (PDPK1), p70 S6 kinase2",6.178E-08,1.539E-05,28,"Tuberin, GRB2, eIF2B5, Insulin processed, PDE3B, IRS-1, PP1-cat, H-Ras, ERK1/2, PKC-zeta, PKA-reg (cAMP-dependent), GLUT4, PP1G regulatory subunit, PI3K reg class IA, Insulin receptor, AKT(PKB), PDK (PDPK1), eEF2, IPP-1, eEF2K, eIF4B, LIPS, PDHA (somatic), 4E-BP1, ACLY, p70 S6 kinase1, AKT2, p70 S6 kinase2",
9,Development_Negative regulation of WNT/Beta-catenin signaling in the nucleus,89,1.048E-07,2.239E-05,1.612E-03,1.392E-02,28,"ZNF703, KDM2, TBL1X, SP7, AKT1, Calcineurin A (catalytic), WWOX, E2F1, PGAM5, Alpha-1 catenin, NF-AT3(NFATC4), TRIM33, CHD8, TLE, Nitrilase 1, Dsh, KLF4, Menin, FHIT, NLK, SOX2, WNT, eNOS, GPX4, TAB2, Plakoglobin, RUVBL2, Axin",1.048E-07,2.239E-05,43,"ZNF703, TBL1X, SP7, Casein kinase I delta, AKT1, Calcineurin A (catalytic), Lef-1, PGAM5, Alpha-1 catenin, 14-3-3, NF-AT3(NFATC4), PAX7, PC1-CTT, TLE, Nitrilase 1, Dsh, KLF4, Menin, FHIT, RANBP3, CtBP, TAB2, PJA2, Axin, KDM2, WWOX, PKC-delta, Tcf(Lef), E2F1, TRIM33, CHD8, SENP2, NLK, RNF43, SOX2, WNT, FOXO3A, eNOS, GPX4, CHIBBY, Plakoglobin, RUVBL2, Frizzled",
10,Adiponectin in pathogenesis of type 2 diabetes,29,1.888E-07,9.404E-05,1.888E-07,9.404E-05,18,"p38alpha (MAPK14), AdipoR2, ACACA, SREBP1 (nuclear), Adiponectin, Insulin processed, SCD, G6PT, AMPK alpha subunit, FASN, CPT-1B, SREBP1 precursor, CPT-1A, ACACB, Insulin receptor, TORC2, ACOX1, AdipoR1",6.339E-04,8.537E-03,15,"SREBP1 (nuclear), Insulin processed, SCD, FASN, SREBP1 precursor, CPT-1A, ACACB, Insulin receptor, TORC2, ACOX1, AdipoR2, Adiponectin, AMPK alpha subunit, CPT-1B, AdipoR1",
11,Ubiquinone metabolism,74,2.686E-07,5.019E-05,1.634E-06,2.713E-04,31,"NDUFB9, COQ6, NDUFS1, NDUFS3, NDUFS7, NDUFAB1, NDUFC1, TAT, NDUFS4, NDUFA2, NDUFA3, NDUFB4, NDUFA10, NDUFB6, NDUFB10, NDUFA8, NDUFS8, NDUFV1, DAP13, NDUFB1, NDUFB5, NDUFC2, NDUFV3, NDUFA7, NDUFA9, NDUFA13, NDUFA5, NDUFS2, NDUFA1, NDUFA4, NDUFB8",2.686E-07,5.019E-05,37,"NDUFB9, NDUFS1, NDUFS3, NDUFAB1, NDUFC1, TAT, NDUFA2, NDUFA3, NDUFB4, NDUFB6, NDUFA8, NDUFS8, NDUFV1, DAP13, NDUFB1, NDUFB5, NDUFC2, NDUFA7, NDUFA9, COQ3, NDUFA13, NDUFA5, NDUFA4, NDUFB8, NDUFB7, COQ6, NDUFS7, NDUFA6, NDUFS4, NDUFB2, NDUFV2, NDUFA10, NDUFB10, NDUFB3, NDUFV3, NDUFS2, NDUFA1",
12,Cytoskeleton remodeling_Regulation of actin cytoskeleton organization by the kinase effectors of Rho GTPases,58,3.711E-07,5.548E-05,2.957E-04,4.649E-03,22,"Spectrin, SLC9A1, Myosin II, Alpha-actinin, PAK1, RhoB, PIP5KI, MyHC, LIMK, Rac3, MRCK, GIT1, DMPK, PAK, Rac1-related, Cdc42 subfamily, ERM proteins, Rhov, MRLC, RhoA-related, Cortactin, MLCK",3.711E-07,5.548E-05,31,"WRCH-1, Spectrin, SLC9A1, RhoC, Rac1, GIT1, Cdc42 subfamily, ERM proteins, RhoA-related, Cortactin, MLCK, BETA-PIX, Destrin, Myosin II, PAK1, RhoB, PIP5KI, MyHC, LIMK, Rac3, Paxillin, MRCK, DMPK, Actomyosin, MRCKalpha, PAK, Cofilin, non-muscle, Rac1-related, Rhov, MRLC, Cofilin",
13,LRRK2 in neurons in Parkinson's disease,33,5.940E-07,8.073E-05,1.412E-05,7.815E-04,17,"MARK2, LRRK2, ERK1/2, AP2A1, PAK1, eEF1A2, VIL2 (ezrin), Ubiquitin, AP-2 alpha subunits, MEK1/2, Tau (MAPT), RAB-5B, HSP90, CHIP, Clathrin heavy chain, eEF1A, Tubulin (in microtubules)",5.940E-07,8.073E-05,21,"NSF, ERK1/2, 14-3-3, PKC-zeta, eEF1A2, Rac1, VIL2 (ezrin), Ubiquitin, AP-2 alpha subunits, Tau (MAPT), HSP90, Clathrin heavy chain, Tubulin (in microtubules), MARK2, LRRK2, MARKK, PAK1, AP2A2, RAB-5B, CHIP, eEF1A",
14,IL-6 signaling in Prostate Cancer,40,9.204E-07,2.077E-04,9.204E-07,2.077E-04,21,"MEK1(MAP2K1), gp130, MCP, GRB2, GAB1, H-Ras, c-Raf-1, p21, IL6RA, Kallikrein 3 (PSA), STAT3, Androgen receptor, AP-1, ErbB2, PI3K reg class IA, PTEN, Cyclin D1, AKT(PKB), PDK (PDPK1), p27KIP1, IL-6 receptor",1.500E-04,3.296E-03,20,"gp130, GRB2, GAB1, IRS-1, H-Ras, p21, Kallikrein 3 (PSA), Androgen receptor, ErbB2, PI3K reg class IA, AKT(PKB), PDK (PDPK1), p27KIP1, MCP, IL6RA, AP-1, PTEN, SHP-2, Cyclin D1, IL-6 receptor",
15,G protein-coupled receptors signaling in lung cancer,76,9.733E-07,2.077E-04,9.733E-07,2.077E-04,32,"EGF, G-protein alpha-12 family, SSTR2, c-Fos, G-protein alpha-i family, ERK1/2, PKA-reg (cAMP-dependent), BDKRB2, Galpha(q)-specific peptide GPCRs, G-protein alpha-q/11, IL8RA, PGE2R3, STAT3, I-kB, GRP-R, Amphiregulin, p70 S6 kinase1, G-protein alpha-s, Calmodulin, CNR1, NTSR1, Bcl-XL, VIP receptor 1, Galpha(i)-specific peptide GPCRs, Cyclin D1, CCR5, VIP receptor 2, Galpha(i)-specific cannabis GPSRs, AKT(PKB), PDK (PDPK1), SDF-1, IL8RB",2.040E-06,2.346E-04,36,"EGF, SSTR2, c-Fos, ERK1/2, PKA-reg (cAMP-dependent), BDKRB2, G-protein alpha-q/11, I-kB, GRP-R, Amphiregulin, CNR1, IKK-alpha, NTSR1, Bcl-XL, Galpha(i)-specific peptide GPCRs, VIP, CCR5, Galpha(i)-specific cannabis GPSRs, AKT(PKB), PDK (PDPK1), SDF-1, IL8RB, G-protein alpha-12 family, G-protein alpha-i family, Galpha(q)-specific peptide GPCRs, IL8RA, PGE2R3, Bradykinin, p70 S6 kinase1, G-protein alpha-s, Calmodulin, Somatostatin, VIP receptor 1, Cyclin D1, VIP receptor 2, SSTR5",
16,IGF family signaling in colorectal cancer,60,9.911E-07,1.235E-04,1.806E-04,3.459E-03,23,"GRB2, c-Fos, E2F1, H-Ras, ERK1/2, Clusterin, c-Raf-1, I-kB, p70 S6 kinase1, PTEN, c-Myb, GSK3 alpha/beta, Bcl-XL, IGF-1 receptor, MNK2(GPRK7), MEK1/2, Cyclin D1, AKT(PKB), IGF-1, ERK1 (MAPK3), IBP, FosB, C/EBPalpha",9.911E-07,1.235E-04,31,"GRB2, c-Fos, IRS-1, H-Ras, eIF4E, ERK1/2, Clusterin, IKK (cat), Rad51, GIPC, I-kB, IKK-alpha, c-Myb, GSK3 alpha/beta, Bcl-XL, IGF-1 receptor, AKT(PKB), ERK1 (MAPK3), IBP, E2F1, c-Jun, 4E-BP1, ZNF143, p70 S6 kinase1, PTEN, MNK2(GPRK7), Cyclin D1, IGF-1, MAT2A, FosB, C/EBPalpha",
17,Regulation of lipid metabolism_Insulin regulation of glycogen metabolism ,57,1.621E-06,2.713E-04,1.621E-06,2.713E-04,26,"MEK1(MAP2K1), IPP-1, GRB2, PHK gamma (liver), Insulin processed, PDE3B, PP1-cat, G6PT, H-Ras, PHK gamma, ERK1/2, PKA-reg (cAMP-dependent), c-Raf-1, p90RSK1, PP1G regulatory subunit, GYS1, Calmodulin, PI3K reg class IA, PHK alpha, Insulin receptor, PPCKM, GSK3 alpha/beta, PYGM, PHK beta, AKT(PKB), PDK (PDPK1)",1.161E-04,2.800E-03,26,"GRB2, PHK gamma (liver), Insulin processed, PDE3B, GYS2, IRS-1, PP1-cat, H-Ras, ERK1/2, PKA-reg (cAMP-dependent), GLUT4, PP1G regulatory subunit, PI3K reg class IA, PHK alpha, Insulin receptor, PPCKM, GSK3 alpha/beta, AKT(PKB), PDK (PDPK1), IPP-1, PHK gamma, GYS1, Calmodulin, AKT2, PYGM, PHK beta",
18,Putative role of Estrogen receptor and Androgen receptor signaling in progression of lung cancer,58,2.435E-06,3.191E-04,2.435E-06,3.191E-04,26,"MEK1(MAP2K1), E-cadherin, Tuberin, EGF, GRB2, ESR1 (nuclear), NCOA3 (pCIP/SRC3), G-protein alpha-i family, H-Ras, ERK1/2, ESR1 (membrane), c-Raf-1, Cytochrome c, ESR2 (nuclear), ESR2 (mitochondrial), ESR2 (membrane), Kallikrein 3 (PSA), Androgen receptor, ID2, p70 S6 kinase1, MAPKAPK2, Bcl-2, Bcl-XL, Cyclin D1, p38 MAPK, ERK1 (MAPK3)",1.756E-05,9.225E-04,28,"Tuberin, EGF, GRB2, ESR1 (nuclear), H-Ras, ERK1/2, 14-3-3, ESR1 (membrane), Cytochrome c, ESR2 (nuclear), Kallikrein 3 (PSA), BAD, Androgen receptor, ID2, MAPKAPK2, CYP19, Bcl-XL, ERK1 (MAPK3), E-cadherin, NCOA3 (pCIP/SRC3), G-protein alpha-i family, TAS2R50, ESR2 (mitochondrial), ESR2 (membrane), p70 S6 kinase1, Bcl-2, Cyclin D1, p38 MAPK",
19,Apoptosis and survival_BAD phosphorylation,42,2.598E-06,3.191E-04,2.598E-06,3.191E-04,21,"MEK1(MAP2K1), Calcineurin A (catalytic), GRB2, H-Ras, ERK1/2, PKA-reg (cAMP-dependent), c-Raf-1, Adenylate cyclase type I, PP2C, Cytochrome c, p90Rsk, p70 S6 kinase1, G-protein alpha-s, PI3K reg class IA, PP1-cat alpha, Bcl-2, Bcl-XL, IGF-1 receptor, AKT(PKB), PDK (PDPK1), p70 S6 kinase2",2.795E-05,1.129E-03,22,"Calcineurin A (catalytic), GRB2, IRS-1, H-Ras, ERK1/2, 14-3-3, PKA-reg (cAMP-dependent), PP2C, Cytochrome c, BAD, PI3K reg class IA, PP1-cat alpha, Bcl-XL, IGF-1 receptor, AKT(PKB), PDK (PDPK1), Adenylate cyclase type I, p70 S6 kinase1, G-protein alpha-s, Bcl-2, Beclin 1, p70 S6 kinase2",
20,Translation _Regulation of EIF2 activity,39,2.709E-06,3.191E-04,2.709E-06,3.191E-04,20,"MEK1(MAP2K1), EGF, GRB2, eIF2B5, GAB1, eIF2AK3, Insulin processed, PP1-cat, H-Ras, ERK1/2, c-Raf-1, PI3K reg class IA, Insulin receptor, PP1-cat alpha, GSK3 alpha/beta, Casein kinase I, eIF2S1, AKT(PKB), PDK (PDPK1), eIF2AK1",3.361E-04,5.367E-03,19,"EGF, GRB2, eIF2B5, GAB1, Insulin processed, IRS-1, PP1-cat, H-Ras, ERK1/2, PI3K reg class IA, Insulin receptor, PP1-cat alpha, GSK3 alpha/beta, eIF2S1, AKT(PKB), PDK (PDPK1), eIF2AK3, Casein kinase I, eIF2AK1",
21,Signal transduction_mTORC2 downstream signaling,68,2.761E-06,2.929E-04,1.405E-03,1.242E-02,23,"Tuberin, cPKC (conventional), ACACA, AKT1, SREBP1 (nuclear), SCD, G6PT, PKA-reg (cAMP-dependent), p21, FASN, Adenylate cyclase type IX, RAG2, FBX29, SLC12A1, PKC, Insulin receptor, MDM2, GSK3 alpha/beta, IGF-1 receptor, Cyclin D1, AKT(PKB), p27KIP1, PREX1",2.761E-06,2.929E-04,33,"Tuberin, AKT1, SREBP1 (nuclear), SCD, IRS-1, PKC-zeta, PRAS40, PKA-reg (cAMP-dependent), GLUT4, p21, FASN, FBX29, Rac1, BAD, Insulin receptor, MDM2, GSK3 alpha/beta, IGF-1 receptor, AKT(PKB), p27KIP1, c-Myc, cPKC (conventional), PKC-delta, Adenylate cyclase type IX, Paxillin, SLC12A1, PKC, Rab-10, FOXO3A, AKT2, Cyclin D1, ENaC, PREX1",
22,Development_Fetal brown fat cell differentiation,55,2.777E-06,3.191E-04,2.777E-06,3.191E-04,25,"MEK1(MAP2K1), SREBP1 (nuclear), GRB2, Insulin processed, H-Ras, ERK1/2, PKA-reg (cAMP-dependent), c-Raf-1, USF1, FASN, TR-beta, Prolactin receptor, SREBP1 precursor, PI3K reg class IA (p85), p70 S6 kinase1, G-protein alpha-s, Insulin receptor, Adenylate cyclase, IGF-1 receptor, AKT(PKB), IGF-1, PDK (PDPK1), p70 S6 kinase2, Leptin, C/EBPalpha",1.681E-05,9.225E-04,27,"SREBP1 (nuclear), GRB2, Insulin processed, IRS-1, H-Ras, ERK1/2, PKC-zeta, PKA-reg (cAMP-dependent), GLUT4, USF1, FASN, TR-beta, Prolactin receptor, SREBP1 precursor, PI3K reg class IA (p85), Insulin receptor, Adenylate cyclase, IGF-1 receptor, AKT(PKB), PDK (PDPK1), c-Myc, p70 S6 kinase1, G-protein alpha-s, IGF-1, p70 S6 kinase2, Leptin, C/EBPalpha",
23,Possible regulation of HSF-1/ chaperone pathway in Huntington's disease,21,2.939E-06,2.929E-04,7.093E-05,1.879E-03,12,"Huntingtin, HSP90 alpha, E2I, Calmodulin, HSP27, GSK3 alpha/beta, JNK(MAPK8-10), HSP90, PLA2, HSP70, ERK1 (MAPK3), p23 co-chaperone",2.939E-06,2.929E-04,15,"Huntingtin, HSP90 alpha, E2I, GSK3 alpha/beta, HSP40, HSP90, HSP70, ERK1 (MAPK3), HSF1, Calmodulin, SUMO-2, HSP27, JNK(MAPK8-10), PLA2, p23 co-chaperone",
24,Transcription_CREB signaling pathway,49,3.509E-06,3.668E-04,3.509E-06,3.668E-04,23,"MEK1(MAP2K1), cPKC (conventional), Galpha(s)-specific amine GPCRs, GRB2, PP1-cat, H-Ras, ERK1/2, CACNA1C, MSK1/2 (RPS6KA5/4), PKA-reg (cAMP-dependent), c-Raf-1, Adenylate cyclase type I, p90Rsk, G-protein alpha-s, Calmodulin, PI3K reg class IA, MEK6(MAP2K6), IGF-1 receptor, Cyclin D1, AKT(PKB), PDK (PDPK1), HPD, p38 MAPK",5.023E-04,7.017E-03,22,"GRB2, IRS-1, PP1-cat, H-Ras, ERK1/2, MSK1/2 (RPS6KA5/4), PKA-reg (cAMP-dependent), Rac1, PI3K reg class IA, MEK6(MAP2K6), IGF-1 receptor, AKT(PKB), PDK (PDPK1), cPKC (conventional), Galpha(s)-specific amine GPCRs, CACNA1C, Adenylate cyclase type I, G-protein alpha-s, Calmodulin, Cyclin D1, HPD, p38 MAPK",
25,Main pathways of Schwann cells transformation in neurofibromatosis type 1 ,80,3.713E-06,3.668E-04,3.713E-06,3.668E-04,32,"MEK1(MAP2K1), Tuberin, EGF, PDGF-B, c-Fos, K-RAS, Neuregulin 1, H-Ras, TPT1, ERK1/2, ErbB3, c-Raf-1, PAK1, IP3 receptor, PI3K reg class IA (p85), AP-1, Amphiregulin, p70 S6 kinase1, ErbB2, Calmodulin, PTEN, Bcl-2, FAK1, Bcl-XL, IGF-1 receptor, MEK1/2, Cyclin D1, B-FABP, AKT(PKB), PDK (PDPK1), p38 MAPK, SDF-1",9.467E-04,1.097E-02,31,"Tuberin, EGF, PDGF-B, c-Fos, H-Ras, ERK1/2, ErbB3, c-Jun/c-Fos, IP3 receptor, BAD, PI3K reg class IA (p85), Amphiregulin, ErbB2, Bcl-XL, IGF-1 receptor, B-FABP, AKT(PKB), PDK (PDPK1), SDF-1, K-RAS, TPT1, PAK1, miR-106b-5p, AP-1, p70 S6 kinase1, Calmodulin, PTEN, Bcl-2, FAK1, Cyclin D1, p38 MAPK",
26,Mitogenic action of ErbB2 in breast cancer,56,4.157E-06,3.668E-04,4.157E-06,3.668E-04,25,"Tuberin, EGF, GRB2, c-Fos, Neuregulin 1, H-Ras, ERK1/2, ErbB3, JAB1, c-Raf-1, PAK1, p21, I-kB, PI3K reg class IA (p85), p70 S6 kinase1, BRK, ErbB2, MEK1/2, Cyclin D1, MSK1, AKT(PKB), Cullin 3, PDK (PDPK1), p70 S6 kinase2, p27KIP1",7.522E-06,6.248E-04,28,"Tuberin, EGF, GRB2, c-Fos, H-Ras, ERK1/2, ErbB3, Cyclin G2, IKK (cat), p21, Rac1, I-kB, PI3K reg class IA (p85), BRK, ErbB2, IKK-alpha, MSK1, AKT(PKB), Cullin 3, PDK (PDPK1), p27KIP1, c-Myc, JAB1, PAK1, p70 S6 kinase1, FOXO3A, Cyclin D1, p70 S6 kinase2",
27,Androgen receptor activation and downstream signaling in Prostate cancer,110,4.174E-06,3.668E-04,4.174E-06,3.668E-04,40,"MEK1(MAP2K1), E-cadherin, SLC45A3, EGF, gp130, GRB2, GAB1, K-RAS, NCOA3 (pCIP/SRC3), H-Ras, Kallikrein 4, Clusterin, c-Raf-1, FRS2, p21, ESR2 (nuclear), FGFR1, IL6RA, Kallikrein 3 (PSA), VIL2 (ezrin), STAT3, Androgen receptor, Rb protein, ErbB2, PI3K reg class IA (p85-beta), PTEN, Kallikrein 2, MDM2, SCAP, Bcl-XL, IGF-1 receptor, Cyclin D1, Relaxin 1, PSCA, AKT(PKB), IGF-1, PDK (PDPK1), HNF3-alpha, ERK1 (MAPK3), IL-6 receptor",8.612E-05,2.429E-03,43,"EGF, gp130, GRB2, GAB1, IRS-1, H-Ras, Clusterin, FRS2, p21, Bak, ESR2 (nuclear), FGFR1, Kallikrein 3 (PSA), VIL2 (ezrin), Androgen receptor, Rb protein, ErbB2, PI3K reg class IA (p85-beta), MDM2, Bcl-XL, IGF-1 receptor, Relaxin 1, AKT(PKB), PDK (PDPK1), c-Myc, ERK1 (MAPK3), E-cadherin, SLC45A3, K-RAS, NCOA3 (pCIP/SRC3), PKC-delta, FOLH1 (GCP2), IL6RA, PTEN, SHP-2, Kallikrein 2, SCAP, Cyclin D1, microRNA 125b, PSCA, IGF-1, HNF3-alpha, IL-6 receptor",
28,Development_FGF signaling in pancreatic and hepatic differentiation of embryonic stem cells,40,4.498E-06,3.733E-04,4.498E-06,3.733E-04,20,"MEK1(MAP2K1), PTF1-p48, GRB2, FGFR4, H-Ras, ERK1/2, GATA-4, c-Raf-1, FRS2, GSC, FGFR1, FGF4, Alpha 1-antitrypsin, Keratin 18, FGF10, Neurogenin 3, AFP, Keratin 8, HNF6, Albumin",1.546E-03,1.531E-02,18,"GRB2, WNT3A, FGFR4, H-Ras, ERK1/2, GATA-4, FRS2, GSC, FGFR1, FGF4, Alpha 1-antitrypsin, Keratin 18, FGF10, Neurogenin 3, Albumin, SHP-2, Keratin 8, HNF6",
29,Development_Thromboxane A2 signaling pathway,50,5.389E-06,4.078E-04,5.389E-06,4.078E-04,23,"EGF, cPKC (conventional), G-protein alpha-12 family, G-protein alpha-i family, H-Ras, ERK1/2, MSK1/2 (RPS6KA5/4), PKA-reg (cAMP-dependent), c-Raf-1, IP3 receptor, G-protein alpha-13, PI3K reg class IA (p85), p70 S6 kinase1, G-protein alpha-s, PKC, PI3K reg class IA, PLC-beta, Adenylate cyclase, GSK3 alpha/beta, MEK1/2, Cyclin D1, AKT(PKB), p38 MAPK",2.431E-04,4.178E-03,23,"EGF, H-Ras, ERK1/2, MSK1/2 (RPS6KA5/4), PKA-reg (cAMP-dependent), IP3 receptor, G-protein alpha-13, PI3K reg class IA (p85), PI3K reg class IA, PLC-beta, Adenylate cyclase, GSK3 alpha/beta, AKT(PKB), cPKC (conventional), G-protein alpha-12 family, Tcf(Lef), G-protein alpha-i family, p70 S6 kinase1, G-protein alpha-s, PKC, G-protein alpha-q, Cyclin D1, p38 MAPK",
30,Ligand-independent activation of Androgen receptor in Prostate Cancer,67,5.459E-06,4.078E-04,5.459E-06,4.078E-04,28,"MEK1(MAP2K1), EGF, GRB2, GAB1, K-RAS, NCOA3 (pCIP/SRC3), Neuregulin 1, H-Ras, ErbB3, PP2A regulatory, c-Raf-1, FRS2, DDX5, FGFR1, Kallikrein 3 (PSA), Prolactin receptor, STAT3, Androgen receptor, ErbB2, PI3K reg class IA, MDM2, Bcl-XL, IGF-1 receptor, Cyclin D1, AKT(PKB), IGF-1, PDK (PDPK1), ERK1 (MAPK3)",1.521E-04,3.296E-03,29,"EGF, GRB2, GAB1, WNT3A, IRS-1, H-Ras, ErbB3, PP2A regulatory, FRS2, FGFR1, Kallikrein 3 (PSA), Prolactin receptor, Androgen receptor, ErbB2, PI3K reg class IA, MDM2, Bcl-XL, IGF-1 receptor, AKT(PKB), PDK (PDPK1), c-Myc, ERK1 (MAPK3), K-RAS, NCOA3 (pCIP/SRC3), Tcf(Lef), DDX5, Cyclin D1, IGF-1, Frizzled",
31,Regulation of degradation of deltaF508-CFTR in CF,39,5.727E-06,5.351E-04,7.126E-04,8.030E-03,16,"UFD1, HSP105, CFTR, VCP, E2I, DNAJB12, Ubiquitin, RNF4, Csp, Aha1, HSP27, AMFR, HSP90, CHIP, HSP70, Derlin1",5.727E-06,5.351E-04,22,"VCP, Sti1, E2I, Ubiquitin, Csp, HSP90, HSP70, UFD1, HSC70, HSP105, SAE1, DNAJB12, RNF4, USP19, UBE1, Aha1, SUMO-2, HSP27, HSPBP1, AMFR, CHIP, Derlin1",
32,Development_IGF-1 receptor signaling,50,6.311E-06,5.550E-04,7.310E-04,8.030E-03,19,"MEK1(MAP2K1), GRB2, H-Ras, ERK1/2, Cyclin D, c-Raf-1, p90Rsk, GYS1, I-kB, p70 S6 kinase1, PI3K reg class IA, GSK3 alpha/beta, Bcl-XL, IGF-1 receptor, MNK2(GPRK7), AKT(PKB), IGF-1, PDK (PDPK1), p70 S6 kinase2",6.311E-06,5.550E-04,26,"GRB2, IRS-1, H-Ras, eIF4E, ERK1/2, PKC-zeta, IKK (cat), BAD, I-kB, PI3K reg class IA, IKK-alpha, GSK3 alpha/beta, Bcl-XL, IGF-1 receptor, AKT(PKB), PDK (PDPK1), c-Myc, Cyclin D, GYS1, 4E-BP1, 14-3-3 beta/alpha, p70 S6 kinase1, FOXO3A, MNK2(GPRK7), IGF-1, p70 S6 kinase2",
33,Regulation of metabolism_Bile acids regulation of glucose and lipid metabolism via FXR,41,7.291E-06,5.187E-04,7.291E-06,5.187E-04,20,"ACACA, LXR-alpha/RXR-alpha, SREBP1 (nuclear), Insulin processed, SCD, G6PT, FASN, SHP, F16P, SREBP1 precursor, ME1, ACACB, Insulin receptor, NIPK, GSK3 alpha/beta, LXR-alpha, HNF3-gamma, AKT(PKB), HNF3-alpha, HNF3",5.831E-03,3.340E-02,17,"SREBP1 (nuclear), Insulin processed, SCD, HNF1-alpha, APOC2, FASN, F16P, SREBP1 precursor, ME1, ACACB, Insulin receptor, GSK3 alpha/beta, AKT(PKB), HNF3, NIPK, HNF3-gamma, HNF3-alpha",
34,Signal transduction_PDGF signaling via MAPK cascades,65,9.161E-06,6.012E-04,9.161E-06,6.012E-04,27,"NOR1, PDGF-B, GRB2, c-Fos, GAB1, H-Ras, ERK1/2, c-Raf-1, p21, KLF4, p90Rsk, GIT1, AP-1, MAPKAPK2, JunD, HSP27, MEK6(MAP2K6), VAV-2, FAK1, CNK1, MEK1/2, Cyclin D1, JNK(MAPK8-10), SP1, p27KIP1, p38 MAPK, GRB10",2.687E-05,1.129E-03,30,"PDGF-B, GRB2, c-Fos, GAB1, H-Ras, ERK1/2, EGR1, p21, KLF4, Rac1, GIT1, MAPKAPK2, JunD, MEK6(MAP2K6), VAV-2, p27KIP1, c-Myc, NOR1, PKC-delta, c-Jun, AP-1, SHP-2, HSP27, FAK1, CNK1, Cyclin D1, JNK(MAPK8-10), SP1, p38 MAPK, GRB10",
35,Main genetic and epigenetic alterations in lung cancer,48,9.255E-06,6.012E-04,9.255E-06,6.012E-04,22,"DNMT3B, EGF, K-RAS, E2F1, Semaphorin 3B, MGMT, MSP, DNMT3A, MSP receptor (RON), IBP4, FADD, FHIT, Rb protein, LKB1, PTEN, Bcl-2, MDM2, Bcl-XL, IGF-1 receptor, Cyclin D1, IGF-1, IBP",1.128E-04,2.800E-03,23,"DNMT3B, EGF, Semaphorin 3B, FADD, FHIT, Rb protein, MDM2, Bcl-XL, IGF-1 receptor, c-Myc, IBP, K-RAS, E2F1, MGMT, MSP, DNMT3A, MSP receptor (RON), IBP4, LKB1, PTEN, Bcl-2, Cyclin D1, IGF-1",
36,Role of ER stress in obesity and type 2 diabetes,54,1.091E-05,8.586E-04,8.627E-05,2.127E-03,22,"AdipoR2, SREBP1 (nuclear), eIF2AK3, Adiponectin, Insulin processed, SCD, XBP1, G6PT, FASN, SREBP1 (Golgi membrane), SREBP1 precursor, PI3K reg class IA (p85), BI-1, PI3K reg class IA (p85-beta), Insulin receptor, TORC2, NIPK, PPCKM, eIF2S1, IRE1, DnaJB9, C/EBPalpha",1.091E-05,8.586E-04,27,"SREBP1 (nuclear), Insulin processed, SCD, IRS-1, XBP1, GLUT4, FASN, SREBP1 precursor, PI3K reg class IA (p85), HMGCS1, PI3K reg class IA (p85-beta), Resistin, Insulin receptor, TORC2, PPCKM, eIF2S1, IRE1, AdipoR2, eIF2AK3, Adiponectin, PTP-1B, SREBP1 (Golgi membrane), BI-1, NIPK, AKT2, DnaJB9, C/EBPalpha",
37,HSP70 and HSP40-dependent folding in Huntington's disease,25,1.220E-05,9.123E-04,1.301E-04,2.699E-03,13,"Huntingtin, HSP22, Parkin, HSP90 alpha, SGTA, HSPA1A, Ubiquitin, HSP27, HSP90, BAG-1, CHIP, HSP70, Cathepsin D",1.220E-05,9.123E-04,16,"Huntingtin, Parkin, HSP90 alpha, Sti1, Ubiquitin, HSP40, HSP90, BAG-1, HSP70, Cathepsin D, HSC70, HSP22, SGTA, HSPA1A, HSP27, CHIP",
38,Reproduction_Gonadotropin-releasing hormone (GnRH) signaling,73,1.226E-05,7.632E-04,1.226E-05,7.632E-04,29,"MEK1(MAP2K1), p38alpha (MAPK14), GRB2, c-Fos, JunB, GnRH receptor, H-Ras, ERK1/2, CACNA1C, MKP-2, PKA-reg (cAMP-dependent), c-Raf-1, FosB/JunB, G-protein alpha-q/11, p90Rsk, IP3 receptor, MEF2D, AP-1, PER1, G-protein alpha-s, Calmodulin, NUR77, PLC-beta, CG alpha, Adenylate cyclase, MEK6(MAP2K6), MKP-1, JNK(MAPK8-10), FosB",5.233E-05,1.630E-03,32,"GRB2, c-Fos, GnRH receptor, H-Ras, ERK1/2, EGR1, c-Jun/c-Fos, PKA-reg (cAMP-dependent), G-protein alpha-q/11, IP3 receptor, PER1, PLC-beta, CG alpha, Adenylate cyclase, MEK6(MAP2K6), FSH-beta, JunB, PKC-delta, c-Jun, CACNA1C, MKP-2, FosB/JunB, MKK7 (MAP2K7), MEF2D, AP-1, G-protein alpha-s, Calmodulin, NUR77, MEKK1(MAP3K1), MKP-1, JNK(MAPK8-10), FosB",
