Enrichment analysis report,,,,,,,,,,,,,
280,Inflammatory factors-induced expression of mucins in normal and asthmatic epithelium,51,2.642E-03,1.898E-02,2.642E-03,1.898E-02,18,"MEK1(MAP2K1), GRB2, H-Ras, SF4, ERK1/2, c-Raf-1, p90RSK1, IL8RA, CLCA1, I-kB, Mucin 2, Mucin 5AC, IKK-beta, IL-1RI, Mucin 5B, PGES2, IL-6 receptor, IL8RB",5.584E-02,1.454E-01,17,"GRB2, H-Ras, SF4, ERK1/2, CLCA1, I-kB, IL-1RI, Mucin 5B, PGES2, C3aR, IL8RB, IL8RA, Mucin 2, SHP-2, Mucin 5AC, IKK-beta, IL-6 receptor",
281,Immune response_NF-AT signaling and leukocyte interactions,48,2.705E-03,2.042E-02,8.175E-02,1.884E-01,13,"MHC class II, Calcineurin A (catalytic), CCR3, NF-AT, IP3 receptor, CD3, cPLA2, IGHE, CD40(TNFRSF5), STAT6, IL-4, Ca(II) channels, CD40L(TNFSF5)",2.705E-03,2.042E-02,20,"MHC class II, Calcineurin A (catalytic), NF-AT1(NFATC2), IP3 receptor, ZAP70, cPLA2, ITK, IL-13, FasL(TNFSF6), IL-4, CCR3, CD79 complex, LAT, IL-5 receptor, NF-AT, IGHE, CD40(TNFRSF5), STAT6, TCR alpha/beta, Ca(II) channels",
282,GLP-1 in beta cell apoptosis in type 2 diabetes,48,2.705E-03,2.042E-02,8.175E-02,1.884E-01,13,"AKT1, ERK1/2, ChREBP, PKA-reg (cAMP-dependent), p90RSK1, Cytochrome c, I-kB, Bcl-2, MDM2, IL-1RI, IGF-1 receptor, Beta-arrestin1, IGF-1",2.705E-03,2.042E-02,20,"AKT1, IRS-1, ERK1/2, ChREBP, PKA-reg (cAMP-dependent), IKK (cat), Cytochrome c, BAD, I-kB, IKK-alpha, MDM2, IL-1RI, IGF-1 receptor, Amylin, Thioredoxin, c-Jun, MKK7 (MAP2K7), Bcl-2, Beta-arrestin1, IGF-1",
283,Inhibition of apoptosis in pancreatic cancer,59,2.723E-03,1.938E-02,2.723E-03,1.938E-02,20,"EGF, K-RAS, G-protein alpha-i family, ERK1/2, Cytochrome c, LTBR1, NFKBIA, STAT3, PI3K reg class IA (p85), PKR1, PER1, ErbB2, ALOX12, PTEN, Bcl-2, Bcl-XL, AKT(PKB), LTBR2, IGF-1, IL-6 receptor",1.740E-02,6.553E-02,21,"EGF, ERK1/2, 14-3-3, Cytochrome c, BAD, PI3K reg class IA (p85), PER1, ErbB2, IKK-alpha, Bcl-XL, AKT(PKB), LTBR2, K-RAS, G-protein alpha-i family, LTBR1, NFKBIA, PKR1, PTEN, Bcl-2, IGF-1, IL-6 receptor",
284,Upregulation of MITF in melanoma,36,2.767E-03,1.959E-02,2.767E-03,1.959E-02,14,"Livin, E2F1, ERK1/2, p90RSK1, p21, PM17, MGF, E2I, TYRP1, Rb protein, PDE4D, Bcl-2, TBX2, p27KIP1",8.878E-03,4.380E-02,15,"ERK1/2, p21, E2I, Rb protein, PDE4D, Tyro3, p27KIP1, miR-340-5p, Livin, E2F1, PM17, MGF, TYRP1, Bcl-2, TBX2",
285,Regulation of relaxation of airway smooth muscle cells,45,2.860E-03,2.138E-02,2.444E-02,8.204E-02,14,"cAMP-GEFI, Protein kinase G, Adenylate cyclase type VI, PKA-reg (cAMP-dependent), PAK1, PGE2R3, IP3 receptor, Adenylate cyclase type II, G-protein alpha-s, VIP receptor 1, VIP receptor 2, Adenylate cyclase type IV, Guanylate Cyclase 1, soluble, MLCK",2.860E-03,2.138E-02,19,"cAMP-GEFI, 14-3-3, Adenylate cyclase type VI, PKA-reg (cAMP-dependent), Rac1, IP3 receptor, Adenylate cyclase type II, Prostacyclin receptor, VIP, Guanylate Cyclase 1, soluble, MLCK, Protein kinase G, PAK1, PGE2R3, G-protein alpha-s, VIP receptor 1, VIP receptor 2, Adenylate cyclase type IV, Cofilin",
286,EGF- and HGF-dependent stimulation of metastasis in gastric cancer,22,2.905E-03,2.037E-02,2.905E-03,2.037E-02,10,"MEK1(MAP2K1), E-cadherin, EGF, GRB2, H-Ras, ERK1/2, c-Raf-1, FAK1, VAV-3, SP1",4.425E-02,1.255E-01,9,"EGF, GRB2, H-Ras, ERK1/2, E-cadherin, Paxillin, FAK1, VAV-3, SP1",
287,Development_Beta-catenin destruction complex signaling,21,2.971E-03,2.210E-02,7.059E-02,1.708E-01,7,"beta-TrCP, Casein kinase I alpha, Ubiquitin, GSK3 alpha/beta, Skp2/TrCP/FBXW, Clathrin, Axin",2.971E-03,2.210E-02,11,"Casein kinase I delta, Lef-1, Casein kinase I alpha, Ubiquitin, GSK3 alpha/beta, CtBP, Skp2/TrCP/FBXW, Axin, Tcf(Lef), beta-TrCP, Clathrin",
288,Development_Schema: Methods of somatic cell reprogramming into induced pluripotent stem cells,6,2.985E-03,2.210E-02,1.185E-02,4.861E-02,4,"KLF4, NANOG, SOX2, LIN-28",2.985E-03,2.210E-02,5,"KLF4, c-Myc, NANOG, SOX2, LIN-28",
289,Development_FGF2-induced self-renewal of adult neural stem cells,40,3.002E-03,2.096E-02,3.002E-03,2.096E-02,15,"MEK1(MAP2K1), hASH1, GRB2, GAB1, H-Ras, ERK1/2, c-Raf-1, FRS2, FGFR1, IP3 receptor, Cystatin C, PKC, PI3K reg class IA, AKT(PKB), PDK (PDPK1)",2.547E-02,8.368E-02,15,"GRB2, GAB1, H-Ras, ERK1/2, FRS2, FGFR1, IP3 receptor, Cystatin C, PI3K reg class IA, AKT(PKB), PDK (PDPK1), MBD1, hASH1, PKC, SHP-2",
290,Chemoresistance pathways mediated by constitutive activation of PI3K pathway and BCL-2 in small cell lung cancer,42,3.006E-03,2.214E-02,1.318E-02,5.249E-02,14,"MGF, FGFR1, PI3K reg class IA (p85), FOXO4, p70 S6 kinase1, PI3K reg class IA, Bcl-2, FAK1, Bcl-XL, IGF-1 receptor, AKT(PKB), IGF-1, PDK (PDPK1), p70 S6 kinase2",3.006E-03,2.214E-02,18,"IRS-1, FGFR1, PI3K reg class IA (p85), PI3K reg class IA, Bcl-XL, IGF-1 receptor, AKT(PKB), PDK (PDPK1), PARP-1, MGF, 4E-BP1, Caspase-7, FOXO4, p70 S6 kinase1, Bcl-2, FAK1, IGF-1, p70 S6 kinase2",
291,Role of neurotrophins in activation of p53 in major depressive disorder,39,3.138E-03,2.289E-02,2.669E-01,4.228E-01,9,"AKT1, GRB2, GAB1, H-Ras, p21, NRAGE(MAGED1), PI3K reg class IA, Bcl-2, JNK(MAPK8-10)",3.138E-03,2.289E-02,17,"TrkA, AKT1, GRB2, GAB1, H-Ras, p21, Rac1, Plasminogen, PI3K reg class IA, NT-3, TrkC, Plasmin, NRAGE(MAGED1), MKK7 (MAP2K7), MEKK1(MAP3K1), Bcl-2, JNK(MAPK8-10)",
292,Activation of Notch signaling in breast cancer,39,3.138E-03,2.289E-02,3.880E-02,1.141E-01,12,"E-cadherin, Neuregulin 1, H-Ras, Presenilin 1, Presenilin, KLF4, STAT3, DLL1, ErbB2, MSI1, MEK6(MAP2K6), p38 MAPK",3.138E-03,2.289E-02,17,"microRNA 200c, H-Ras, Presenilin 1, KLF4, Rac1, miR-141-3p, miR-200c-3p, DLL1, ErbB2, MEK6(MAP2K6), HEY1, E-cadherin, microRNA 141, c-Jun, Presenilin, MSI1, p38 MAPK",
293,Immune response_CRTH2 signaling in Th2 cells,44,3.176E-03,2.154E-02,3.176E-03,2.154E-02,16,"Calcineurin A (catalytic), CRTH2, G-protein alpha-i family, Cytochrome c, ITGAM, IP3 receptor, Calmodulin, PKC, PLC-beta, Adenylate cyclase, Bcl-XL, CD40(TNFRSF5), IL-4, AKT(PKB), PDK (PDPK1), CD40L(TNFSF5)",5.464E-03,3.179E-02,18,"Calcineurin A (catalytic), 14-3-3, Cytochrome c, IP3 receptor, BAD, PLC-beta, Adenylate cyclase, IL-13, Bcl-XL, IL-4, AKT(PKB), PDK (PDPK1), G-protein alpha-i family, ITGAM, Calmodulin, PKC, CD40(TNFRSF5), PI3K reg class IB (p101)",
294,Huntingtin-depended transcription deregulation in Huntington's Disease,24,3.197E-03,2.301E-02,6.210E-03,3.221E-02,10,"NFYB, Huntingtin, NR1, ARLY, HSPA1A, TAF4 (TAFII130), TR-beta, CNR1, SP1, C/EBPalpha",3.197E-03,2.301E-02,12,"NFYB, Huntingtin, NR1, ARLY, TR-beta, CNR1, TBP, HSPA1A, TAF4 (TAFII130), SP1, CtBP1, C/EBPalpha",
295,Tinnitus-associated changes in auditory pathway ,82,3.214E-03,2.301E-02,5.715E-02,1.450E-01,21,"nAChR alpha-10, GluR5, NR1, GABA-A receptor delta subunit, mGluR4A, Gephyrin, GABA-A receptor alpha-5 subunit, GBR2, GluR2, GABA-A receptor beta-3 subunit, GRIK4, KCNQ3, GABA-A receptor, GRIK5, GluR3, GABA-A receptor alpha-6 subunit, GABA-A receptor alpha-3 subunit, GABRG1, GRID2, GABA-A receptor gamma-2 subunit, GLRA",3.214E-03,2.301E-02,30,"nAChR alpha-10, GluR5, NR1, GABA-A receptor delta subunit, mGluR4A, NMDA receptor, KCNQ3, GABA-A receptor, GRIK5, GABA-A receptor alpha-6 subunit, nAChR, GABA-A receptor alpha-2 subunit, GABA-A receptor gamma-3 subunit, GABA-A receptor gamma-2 subunit, GLRA, GABA-A receptor beta-2 subunit, GABA-A receptor alpha-4 subunit, GABA-A receptor beta-1 subunit, mGluR3, GABA-A receptor alpha-1 subunit, GABA-A receptor alpha-4/beta-2/delta, Gephyrin, GABA-A receptor alpha-5 subunit, GBR2, GluR2, GABA-A receptor beta-3 subunit, GRIK4, GluR1, NR2D, KCNQ2",
296,Higher ESR1 / ESR2 ratio in breast cancer,36,3.247E-03,2.301E-02,8.037E-03,3.788E-02,13,"PDGF-B, ESR1 (nuclear), ErbB3, BTG2, p21, ESR2 (nuclear), ErbB2, PTEN, p130, Cyclin D1, AKT(PKB), SP1, p27KIP1",3.247E-03,2.301E-02,16,"PDGF-B, ESR1 (nuclear), ErbB3, p21, ESR2 (nuclear), ErbB2, p130, AKT(PKB), p27KIP1, c-Myc, ARNT, c-Jun, BTG2, PTEN, Cyclin D1, SP1",
297,Neuroendocrine transdifferentiation in Prostate Cancer,48,3.295E-03,2.154E-02,3.295E-03,2.154E-02,17,"MEK1(MAP2K1), Tuberin, GRB2, H-Ras, PKA-reg (cAMP-dependent), c-Raf-1, p21, AMACR, STAT3, p70 S6 kinase1, Keratin 18, IGF-1 receptor, AKT(PKB), IGF-1, PDK (PDPK1), ERK1 (MAPK3), IL-6 receptor",1.520E-02,6.141E-02,18,"Tuberin, GRB2, H-Ras, PKA-reg (cAMP-dependent), p21, AMACR, PCDH11Y, Keratin 18, IGF-1 receptor, AKT(PKB), PDK (PDPK1), ERK1 (MAPK3), Chromogranin A, Tcf(Lef), PTP-1B, p70 S6 kinase1, IGF-1, IL-6 receptor",
298,Signal transduction_Adenosine A3 receptor signaling pathway,48,3.295E-03,2.154E-02,3.295E-03,2.154E-02,17,"G-protein alpha-i family, H-Ras, ERK1/2, G-protein alpha-q/11, NFKBIA, IP3 receptor, STAT3, PI3K reg class IA (p85), PKC, PLC-beta, Adenylate cyclase, Bcl-2, MEK1/2, Rho GTPase, AKT(PKB), PDK (PDPK1), p38 MAPK",1.520E-02,6.141E-02,18,"H-Ras, ERK1/2, G-protein alpha-q/11, IP3 receptor, BAD, PI3K reg class IA (p85), PLC-beta, Adenylate cyclase, AKT(PKB), PDK (PDPK1), PKC-delta, G-protein alpha-i family, NFKBIA, PKC, Bcl-2, Rho GTPase, PI3K reg class IB (p101), p38 MAPK",
299,Muscle contraction_Relaxin signaling pathway,48,3.295E-03,2.154E-02,3.295E-03,2.154E-02,17,"MEK1(MAP2K1), Relaxin 2, G-protein alpha-i family, ERK1/2, Adenylate cyclase type VI, PKA-reg (cAMP-dependent), PDE8B, INSL3, p90Rsk, NFKBIA, I-kB, Adenylate cyclase type V, G-protein alpha-s, PDE4D, eNOS, AKT(PKB), PDE4B",3.202E-02,9.850E-02,17,"ERK1/2, Adenylate cyclase type VI, PKC-zeta, PKA-reg (cAMP-dependent), I-kB, Adenylate cyclase type V, PDE4D, AKT(PKB), LGR8, Relaxin 2, G-protein alpha-i family, PDE8B, INSL3, NFKBIA, G-protein alpha-s, eNOS, PDE4B",
300,IL-17-induced mucin expression in CF airways,48,3.295E-03,2.154E-02,3.295E-03,2.154E-02,17,"CD80, MHC class II, ROR-alpha, ROR-gamma, ERK1/2, CIKS, CFTR, I-kB, AP-1, IL-17RC, Mucin 5AC, IKK-beta, Mucin 5B, MSK1, SP1, p38 MAPK, IL-6 receptor",3.202E-02,9.850E-02,17,"TLR5, MHC class II, ERK1/2, CIKS, IKK (cat), I-kB, IL-17RC, Mucin 5B, MSK1, ROR-gamma, AP-1, Mucin 5AC, IKK-beta, SP1, TCR alpha/beta, p38 MAPK, IL-6 receptor",
301,Development_Role of Thyroid hormone in regulation of oligodendrocyte differentiation,48,3.295E-03,2.154E-02,3.295E-03,2.154E-02,17,"TR-alpha, AKT1, OATP-A, E2F1, GLNA, PLP1, MCT8, OLIG1, p21, TR-beta, ID2, p70 S6 kinase1, Cyclin D1, 4E-BP2, AKT(PKB), PDK (PDPK1), p27KIP1",6.668E-03,3.679E-02,19,"TR-alpha, AKT1, PLP1, OLIG1, p21, TR-beta, ID2, 4E-BP2, AKT(PKB), PDK (PDPK1), p27KIP1, OATP-A, E2F1, GLNA, MCT8, 4E-BP1, p70 S6 kinase1, MAG, Cyclin D1",
302,Development_VEGF signaling via VEGFR2 - generic cascades,93,3.304E-03,2.154E-02,3.304E-03,2.154E-02,28,"MEK1(MAP2K1), Calcineurin A (catalytic), GRB2, H-Ras, PAK2, ERK1/2, c-Raf-1, PAK1, p90Rsk, IP3 receptor, I-kB, COX-1 (PTGS1), MAPKAPK2, Calmodulin, PKC, PI3K reg class IA, HSP27, IKK-beta, eNOS, FAK1, MSK1, AKT(PKB), HSP90, PDK (PDPK1), PLA2G5, p38 MAPK, ERK1 (MAPK3), MLCK",1.287E-02,5.499E-02,31,"Calcineurin A (catalytic), GRB2, H-Ras, PAK2, eIF4E, ERK1/2, c-Jun/c-Fos, IKK (cat), Rac1, IP3 receptor, I-kB, MAPKAPK2, PI3K reg class IA, MSK1, AKT(PKB), HSP90, PDK (PDPK1), ERK1 (MAPK3), MLCK, c-Jun, PAK1, Paxillin, Calmodulin, PKC, MEKK1(MAP3K1), HSP27, IKK-beta, eNOS, FAK1, PLA2G5, p38 MAPK",
303,Development_Generation of pancreatic beta-cells from induced pluripotent stem cells,27,3.316E-03,2.309E-02,4.290E-02,1.205E-01,9,"EGF, HB9, KLF4, NANOG, SOX2, Neurogenin 3, Insulin, HNF6, MafA",3.316E-03,2.309E-02,13,"EGF, WNT3A, KLF4, Neurogenin 3, Nkx2.2, c-Myc, HB9, NANOG, FGF7, SOX2, Insulin, HNF6, MafA",
304,DeltaF508-CFTR traffic / Sorting endosome formation in CF,27,3.316E-03,2.309E-02,1.586E-02,6.044E-02,10,"Rabaptin-5, SNAP-25, CFTR, CHMP4B, DAB2, Vps25, Ubiquitin, VPS45A, EEA1, TSG101",3.316E-03,2.309E-02,13,"NSF, Rabaptin-5, COMMD1 (MURR1), CHMP4B, DAB2, Vps25, Ubiquitin, RABGEF1, Rab-7, VPS45A, EEA1, TSG101, STAM2",
305,IL-2 as a growth factor for T cells in multiple sclerosis,33,3.323E-03,2.309E-02,1.007E-02,4.369E-02,12,"Tuberin, E2F1, PI3K reg class IA (p85), p70 S6 kinase1, Rb protein, Bcl-2, c-Myb, Bcl-XL, p130, AKT(PKB), PDK (PDPK1), p27KIP1",3.323E-03,2.309E-02,15,"Tuberin, Cyclin D3, PI3K reg class IA (p85), Rb protein, c-Myb, Bcl-XL, p130, AKT(PKB), PDK (PDPK1), p27KIP1, c-Myc, E2F1, p70 S6 kinase1, Bcl-2, FOXO3A",
306,HCV-mediated liver damage and predisposition to HCC progression via p53,19,3.335E-03,2.154E-02,3.335E-03,2.154E-02,9,"MEK1(MAP2K1), GRB2, H-Ras, ERK1/2, c-Raf-1, p21, CDK7, Rb protein, CAK complex",1.201E-01,2.474E-01,7,"GRB2, H-Ras, ERK1/2, p21, CDK7, Rb protein, CAK complex",
307,Cytoskeleton remodeling_Alpha-1A adrenergic receptor-dependent inhibition of PI3K,19,3.335E-03,2.154E-02,3.335E-03,2.154E-02,9,"CACNA1C, Myosin II, Calmodulin, Alpha-1A adrenergic receptor, MRLC, AKT(PKB), MELC, PDK (PDPK1), MLCK",4.399E-03,2.763E-02,10,"AKT(PKB), PDK (PDPK1), MLCK, CACNA1C, Myosin II, Calmodulin, Alpha-1A adrenergic receptor, MRLC, G-protein alpha-q, MELC",
308,Regulation of lipid metabolism_Regulation of fatty acid synthase activity in hepatocytes,19,3.335E-03,2.154E-02,3.335E-03,2.154E-02,9,"LXR-alpha/RXR-alpha, SREBP1 (nuclear), RXRA, FASN, SREBP1 (Golgi membrane), TR-beta, SREBP1 precursor, LXR-alpha, SP1",1.201E-01,2.474E-01,7,"SREBP1 (nuclear), FASN, TR-beta, SREBP1 precursor, RXRA, SREBP1 (Golgi membrane), SP1",
309,"Regulation of lipid metabolism_RXR-dependent regulation of lipid metabolism via PPAR, RAR and VDR",30,3.351E-03,2.309E-02,4.173E-03,2.471E-02,12,"VDR/RXR-alpha, SCD, RARgamma, RXRA, HMGCS2, RAR-alpha/RXR-alpha, CYP4F2, SHP, CPT-1A, RARalpha, CAR, SP1",3.351E-03,2.309E-02,14,"VDR/RXR-alpha, SCD, RARgamma, HMGCS2, CYP4F2, CPT-1A, RARalpha, CYP19, CAR, ACSL1, RXRA, RAR-alpha/RXR-alpha, APOC3, SP1",
310,Inhibition of Ephrin receptors in colorectal cancer,30,3.351E-03,2.309E-02,1.629E-01,2.972E-01,8,"E-cadherin, Ephrin-A receptor 1, Ephrin-A receptors, Ephrin-A receptor 7, WNT, VAV-2, FAK1, Ephrin-A",3.351E-03,2.309E-02,14,"Ephrin-A receptor 3, Rac1, Ephrin-A receptor 7, VAV-2, E-cadherin, Ephrin-A receptor 1, Ephrin-A receptors, Ephrin-B receptor 3, Paxillin, WNT, FAK1, Ephrin-A, Ephrin-B receptors, Frizzled",
311,Development_FGF-family signaling,52,3.367E-03,2.154E-02,3.368E-03,2.154E-02,18,"MEK1(MAP2K1), FGFR3, GRB2, GAB1, FGFR4, H-Ras, c-Raf-1, FRS2, FGFR1, IP3 receptor, FGF4, PI3K reg class IA, FGF10, MEK6(MAP2K6), AKT(PKB), PDK (PDPK1), p38 MAPK, ERK1 (MAPK3)",3.367E-03,2.309E-02,21,"GRB2, GAB1, FGFR4, H-Ras, FRS2, FGFR1, Rac1, IP3 receptor, FGF4, PI3K reg class IA, FGF10, MEK6(MAP2K6), AKT(PKB), PDK (PDPK1), ERK1 (MAPK3), FGFR3, PKC-delta, FGF7, SHP-2, FGF6, p38 MAPK",
312,G-protein signaling_Proinsulin C-peptide signaling,52,3.367E-03,2.154E-02,3.368E-03,2.154E-02,18,"MEK1(MAP2K1), TRAF2, G-protein alpha-i family, H-Ras, ERK1/2, c-Raf-1, IP3 receptor, I-kB, PI3K reg class IA (p85), PI3K reg class IA, PLC-beta, IKK-beta, Bcl-2, eNOS, Proinsulin C-peptide, Cyclin D1, AKT(PKB), PDK (PDPK1)",3.367E-03,2.309E-02,21,"H-Ras, ERK1/2, IKK (cat), IP3 receptor, I-kB, PI3K reg class IA (p85), PI3K reg class IA, PLC-beta, IKK-alpha, AKT(PKB), PDK (PDPK1), PKC-delta, TRAF2, G-protein alpha-i family, c-Jun, IKK-beta, Bcl-2, eNOS, Proinsulin C-peptide, Cyclin D1, PI3K reg class IB (p101)",
313,Development_Endothelin-1/EDNRA signaling,52,3.368E-03,2.154E-02,3.368E-03,2.154E-02,18,"MEK1(MAP2K1), p38alpha (MAPK14), GRB2, G-protein alpha-i family, H-Ras, ERK1/2, GATA-4, c-Raf-1, G-protein alpha-q/11, IP3 receptor, G-protein alpha-s, Calmodulin, PI3K reg class IA, Adenylate cyclase, MEK6(MAP2K6), Cyclin D1, JNK(MAPK8-10), AKT(PKB)",1.725E-02,6.513E-02,19,"GRB2, H-Ras, ERK1/2, GATA-4, G-protein alpha-q/11, Rac1, IP3 receptor, PI3K reg class IA, Adenylate cyclase, MEK6(MAP2K6), AKT(PKB), MEKK4(MAP3K4), PKC-delta, G-protein alpha-i family, G-protein alpha-s, Calmodulin, MEKK1(MAP3K1), Cyclin D1, JNK(MAPK8-10)",
314,Signal transduction_Activation of PKC via G-Protein coupled receptor,52,3.368E-03,2.154E-02,3.368E-03,2.154E-02,18,"MEK1(MAP2K1), PKC-eta, Calcineurin A (catalytic), ERK1/2, NF-AT3(NFATC4), c-Raf-1, MEF2, G-protein alpha-q/11, IP3 receptor, I-kB, PRKD1, Calmodulin, NUR77, PLC-beta, IKK-beta, PKC-gamma, MELC, MLCK",7.906E-03,4.020E-02,20,"PKC-eta, Calcineurin A (catalytic), NF-AT1(NFATC2), ERK1/2, PKC-zeta, NF-AT3(NFATC4), IKK (cat), G-protein alpha-q/11, IP3 receptor, I-kB, PLC-beta, PKC-gamma, MLCK, PKC-delta, MEF2, PRKD1, Calmodulin, NUR77, IKK-beta, MELC",
315,Glucagon-induced glucose upregulation in type 2 diabetes in liver ,52,3.368E-03,2.154E-02,3.368E-03,2.154E-02,18,"Calcineurin A (catalytic), PHK gamma (liver), G-protein alpha-i family, G6PT, PFKL, PKA-reg (cAMP-dependent), G-protein alpha-q/11, PHK alpha (liver), IP3 receptor, F261, G-protein alpha-s, Calmodulin, PLC-beta, TORC2, Adenylate cyclase, PPCKM, PYC, PHK beta",7.906E-03,4.020E-02,20,"Calcineurin A (catalytic), PHK gamma (liver), GYS2, PFKL, PKA-reg (cAMP-dependent), G-protein alpha-q/11, PHK alpha (liver), IP3 receptor, F261, PLC-beta, TORC2, Adenylate cyclase, PPCKM, GCGR, G-protein alpha-i family, 14-3-3 beta/alpha, G-protein alpha-s, Calmodulin, PYC, PHK beta",
316,Development_Thyroliberin signaling,60,3.401E-03,2.154E-02,3.401E-03,2.154E-02,20,"MEK1(MAP2K1), Thyroliberin, GRB2, c-Fos, JunB, H-Ras, ERK1/2, G-protein alpha-11, CACNA1C, PKA-reg (cAMP-dependent), c-Raf-1, G-protein alpha-q/11, IP3 receptor, G-protein alpha-s, Calmodulin, CG alpha, Adenylate cyclase, MKP-1, LHX3, SP1",2.116E-02,7.498E-02,21,"GRB2, c-Fos, H-Ras, ERK1/2, PKA-reg (cAMP-dependent), G-protein alpha-q/11, PLC-beta1, IP3 receptor, CG alpha, Adenylate cyclase, Thyroliberin, JunB, PKC-delta, G-protein alpha-11, CACNA1C, G-protein alpha-s, Calmodulin, MKP-1, LHX3, G-protein alpha-q, SP1",
317,Development_EGFR signaling via small GTPases,33,3.402E-03,2.154E-02,3.402E-03,2.154E-02,13,"EGF, GRB2, c-Fos, K-RAS, MLK2(MAP3K10), H-Ras, ERK1/2, c-Raf-1, ErbB2, PI3K reg class IA, VAV-2, MEK1/2, JNK(MAPK8-10)",9.421E-03,4.500E-02,14,"EGF, GRB2, c-Fos, H-Ras, ERK1/2, Rac1, ErbB2, PI3K reg class IA, VAV-2, c-Myc, K-RAS, MLK2(MAP3K10), MKK7 (MAP2K7), JNK(MAPK8-10)",
318,Neurophysiological process_HTR2A signaling in the nervous system,49,3.606E-03,2.450E-02,1.035E-02,4.369E-02,16,"cPKC (conventional), Calcineurin A (catalytic), ERK1/2, CACNA1C, KCC2, PAK1, G-protein alpha-q/11, IP3 receptor, Calmodulin, PKC, GABA-A receptor, PLC-beta, Kalirin, AKT(PKB), GABA-A receptor gamma-2 subunit, SFK",3.606E-03,2.450E-02,20,"Calcineurin A (catalytic), ERK1/2, EGR1, G-protein alpha-q/11, PLC-beta1, Rac1, IP3 receptor, NMDA receptor, GABA-A receptor, PLC-beta, Kalirin, AKT(PKB), GABA-A receptor gamma-2 subunit, SFK, cPKC (conventional), CACNA1C, KCC2, PAK1, Calmodulin, PKC",
319,Hedgehog signaling in prostate cancer,26,3.606E-03,2.245E-02,3.606E-03,2.245E-02,11,"E-cadherin, PKC-eta, BMI-1, STK36, SHH, p21, Bcl-2, Cyclin D1, HIP, HSP90, SUFU",7.218E-03,3.761E-02,12,"PKC-eta, p21, KIF27, HSP90, c-Myc, SUFU, E-cadherin, BMI-1, STK36, SHH, Bcl-2, Cyclin D1",
320,Cell adhesion_Endothelial cell contacts by junctional mechanisms,26,3.606E-03,2.245E-02,3.606E-03,2.245E-02,11,"Cingulin, AF-6, Alpha-actinin, Claudin-5, JAM1, Alpha-catenin, Plakophilin 4, Connexin 43, Occludin, Plakoglobin, Claudin-3",2.094E-02,7.467E-02,11,"JAM2, AF-6, Claudin-5, JAM1, Claudin-3, Cingulin, Alpha-catenin, Plakophilin 4, Occludin, Plakoglobin, p120-catenin",
321,Signal transduction_HTR2A-dependent arachidonic acid production,26,3.606E-03,2.245E-02,3.606E-03,2.245E-02,11,"G-protein alpha-12 family, DGL-alpha, G-protein alpha-i family, ERK1/2, G-protein alpha-q/11, DGL-beta, PLC-beta, cPLA2, FAAH, RhoA-related, p38 MAPK",2.094E-02,7.467E-02,11,"DGL-alpha, ERK1/2, G-protein alpha-q/11, DGL-beta, PLC-beta, cPLA2, FAAH, RhoA-related, G-protein alpha-12 family, G-protein alpha-i family, p38 MAPK",
322,Immune response_CD16 signaling in NK cells,69,3.705E-03,2.506E-02,6.368E-02,1.594E-01,18,"MEK1(MAP2K1), Calcineurin A (catalytic), GRB2, c-Fos, NKG2A, H-Ras, ERK1/2, c-Raf-1, IP3 receptor, PIP5K1A, AP-1, Calmodulin, PI3K reg class IA, ARF6, WASP, SHP-1, IL-4, PLA2",3.705E-03,2.506E-02,26,"Calcineurin A (catalytic), GRB2, c-Fos, NF-AT1(NFATC2), NKG2A, H-Ras, ERK1/2, c-Jun/c-Fos, FCGR3A, IL-3, Rac1, IP3 receptor, PIP5K1A, PI3K reg class IA, ZAP70, ARF6, WASP, SHP-1, FasL(TNFSF6), IL-4, SHIP, c-Jun, LAT, AP-1, Calmodulin, PLA2",
323,Cytoskeleton remodeling_Substance P mediated membrane blebbing,16,3.717E-03,2.304E-02,3.717E-03,2.304E-02,8,"Substance P extracellular region, G-protein alpha-12 family, Myosin II, PAK1, Tubulin alpha, MRLC, MLCK, Tubulin (in microtubules)",1.566E-02,6.151E-02,8,"Substance P extracellular region, MLCK, Tubulin (in microtubules), G-protein alpha-12 family, Myosin II, PAK1, Tubulin alpha, MRLC",
324,Neurophysiological process_Constitutive and activity-dependent synaptic AMPA receptor delivery,59,3.759E-03,2.532E-02,1.022E-01,2.190E-01,15,"Chapsyn-110, Rab-4, Complexin, SHANK, GluR2, Calmodulin, PKC, Rab-11A, SAP102, Kinesin heavy chain, PICK1, Guanylate Cyclase 1, soluble, Myosin Vb, SNAP-23, GRIPAP1",3.759E-03,2.532E-02,23,"Chapsyn-110, NSF, PKC-zeta, Complexin, SHANK, NMDA receptor, Hap-1, 4.1N, Guanylate Cyclase 1, soluble, Syntaxin 4, GRIPAP1, Rab-4, GRIP, GluR2, Calmodulin, PKC, Rab-11A, SAP102, Kinesin heavy chain, PICK1, GluR1, Myosin Vb, SNAP-23",
325,Cytoskeleton remodeling_Regulation of actin cytoskeleton nucleation and polymerization by Rho GTPases,46,3.847E-03,2.556E-02,5.264E-03,2.848E-02,16,"DAAM1, BAIAP2, WASF subunit, WASF3 (WAVE3), RhoB, PIP5KI, Rac3, RhoD, DRF, CYFIP2, Rac1-related, Cdc42 subfamily, RhoA-related, WASP, FHOD1, FNBP1L",3.847E-03,2.556E-02,19,"BAIAP2, RhoC, Rac1, RhoD, DRF, CYFIP2, Cdc42 subfamily, RhoA-related, WASP, FHOD1, DAAM1, WASF subunit, WASF3 (WAVE3), RhoB, PIP5KI, Rac3, Rac1-related, N-WASP, FNBP1L",
326,Apoptosis and survival_Endoplasmic reticulum stress response pathway,56,4.071E-03,2.667E-02,7.030E-02,1.708E-01,15,"p38alpha (MAPK14), eIF2AK3, TRAF2, XBP1, PP1-cat, Cytochrome c, I-kB, PP1-cat alpha, Bcl-2, IP3R1, JNK(MAPK8-10), eIF2S1, IRE1, Derlin1, HERP",4.071E-03,2.667E-02,22,"XBP1, PP1-cat, ATF-4, c-Jun/c-Fos, IKK (cat), Bak, Cytochrome c, I-kB, PP1-cat alpha, eIF2S1, IRE1, eIF2AK3, TRAF2, c-Jun, Caspase-7, Bcl-2, IP3R1, JNK(MAPK8-10), DNAJC3, Derlin1, HERP, JIK",
327,Immune response_IL-5 signaling via JAK/STAT,56,4.071E-03,2.667E-02,3.686E-02,1.097E-01,16,"DUSP5, c-Fos, JunB, CSF2RB, XBP1, AID, UCP2, GATA-1, NFKBIA, STAT3, Amphiregulin, CISH, Bcl-2, MKP-1, SOCS2, CysLT1 receptor",4.071E-03,2.667E-02,22,"Cyclin D3, c-Fos, NF-AT1(NFATC2), XBP1, UCP2, Amphiregulin, CISH, IL-13, LPPL, CysLT1 receptor, c-Myc, DUSP5, JunB, CSF2RB, c-Jun, AID, IL-5 receptor, NFKBIA, IL5RA, Bcl-2, MKP-1, SOCS2",
328,SCAP/SREBP Transcriptional Control of Cholesterol and FA Biosynthesis,45,4.113E-03,2.471E-02,4.113E-03,2.471E-02,16,"ACACA, GGPS1, SREBP1 (nuclear), Insulin processed, SCD, HMGCS2, FASN, SREBP1 (Golgi membrane), MVK, ACSA, SREBP1 precursor, ACLY, ERG1, ELOVL3, ACSS1, SCAP",7.201E-03,3.761E-02,18,"GGPS1, SREBP1 (nuclear), Insulin processed, SCD, HMGCS2, FASN, ACSA, SREBP1 precursor, INSIG2, HMGCS1, Resistin, ACSS1, SREBP1 (Golgi membrane), MVK, ACLY, ERG1, ELOVL3, SCAP",
329,Cell adhesion_Ephrin signaling,45,4.113E-03,2.471E-02,4.113E-03,2.471E-02,16,"GRB2, RHO6, RGS3, G-protein alpha-i family, H-Ras, GRB7, Ephrin-A receptor 8, Ephrin-A receptors, c-Raf-1, PAK1, Kalirin, VAV-2, FAK1, Ephrin-A, SLAP, GRB10",1.668E-02,6.424E-02,17,"GRB2, H-Ras, GRB7, Rac1, Kalirin, VAV-2, RHO6, RGS3, G-protein alpha-i family, Ephrin-A receptor 8, Ephrin-A receptors, PAK1, Paxillin, FAK1, Ephrin-A, Ephrin-B receptors, GRB10",
330,Signal transduction_Angiotensin II/ AGTR1 signaling via JAK/STAT,45,4.113E-03,2.471E-02,4.113E-03,2.471E-02,16,"c-Fos, ERK1/2, AGTR1, AMPK alpha subunit, GATA-4, c-Raf-1, p21, NFKBIA, STAT3, I-kB, PKC, ANP, IP3R1, MEK1/2, SHP-1, STAT6",7.201E-03,3.761E-02,18,"c-Fos, IRS-1, ERK1/2, GATA-4, p21, Rac1, I-kB, ANP, SHP-1, c-Jun, AGTR1, AMPK alpha subunit, PTP-1B, NFKBIA, PKC, SHP-2, IP3R1, STAT6",
331,Production of arachidonic acid derivatives by mast cells in asthma,30,4.173E-03,2.471E-02,4.173E-03,2.471E-02,12,"ERK1/2, PLA2G12, MGF, PG12B, COX-1 (PTGS1), PLA2(hGIIA), PLA2G3, cPLA2, PLA2G2F, PLA2G10, PLA2G2D, PLA2G5",6.056E-02,1.529E-01,11,"ERK1/2, PG12B, PLA2G3, PLA2G1B, cPLA2, PLA2G2F, PLA2G10, PLA2G12, MGF, PLA2(hGIIA), PLA2G5",
332,Neutrophil-derived granule proteins and cytokines in asthma,49,4.208E-03,2.471E-02,4.208E-03,2.471E-02,17,"Substance P extracellular region, CCL17, Fc epsilon RI gamma, ERK1/2, Lactoferrin, Tryptase, LTBR1, IL8RA, PERM, Hck, PKC, MEK1/2, IL-4, CysLT1 receptor, Alpha-defensin, IL9R, IL8RB",3.893E-02,1.152E-01,17,"Substance P extracellular region, CCL17, Fc epsilon RI gamma, ERK1/2, Lactoferrin, Hck, IL-13, IL-9, IL-4, CysLT1 receptor, IL8RB, Tryptase, LTBR1, IL8RA, PERM, PKC, IL9R",
333,Signal transduction_IP3 signaling,49,4.208E-03,2.471E-02,4.208E-03,2.471E-02,17,"MEK1(MAP2K1), GRB2, H-Ras, ERK1/2, c-Raf-1, MEF2, G-protein alpha-q/11, IP3 receptor, Galpha(q)-specific nucleotide-like GPCRs, Calmodulin, PI3K reg class IA, PLC-beta, CD3, CaMKK, PKC-gamma, AKT(PKB), PDK (PDPK1)",1.903E-02,6.971E-02,18,"GRB2, H-Ras, ERK1/2, G-protein alpha-q/11, IP3 receptor, PI3K reg class IA, PLC-beta, ZAP70, PKC-gamma, AKT(PKB), PDK (PDPK1), CD79 complex, MEF2, LAT, Galpha(q)-specific nucleotide-like GPCRs, Calmodulin, CaMKK, TCR alpha/beta",
334,Development_G-CSF signaling,49,4.208E-03,2.471E-02,4.208E-03,2.471E-02,17,"MEK1(MAP2K1), GRB2, H-Ras, ERK1/2, c-Raf-1, STAT3, PI3K reg class IA (p85), Hck, Bcl-2, Bcl-XL, G-CSF receptor, JNK(MAPK8-10), AKT(PKB), PDK (PDPK1), G-CSF, p38 MAPK, IL8RB",1.903E-02,6.971E-02,18,"Cyclin D3, GRB2, H-Ras, ERK1/2, PI3K reg class IA (p85), Hck, Bcl-XL, G-CSF receptor, SHIP, AKT(PKB), PDK (PDPK1), c-Myc, IL8RB, SHP-2, Bcl-2, JNK(MAPK8-10), G-CSF, p38 MAPK",
