Enrichment analysis report,,,,,,,,,,,,,
895,Development_Auditory hair cell differentiation in embryogenesis,29,1.405E-01,2.716E-01,1.405E-01,2.716E-01,8,"FGFR3, FGFR1, Lunatic fringe, DLL1, Myosin VIIA, Myosin VI, SOX2, p27KIP1",1.978E-01,3.474E-01,9,"FGFR1, DLL1, Myosin VIIA, BARHL1, p27KIP1, FGFR3, Lunatic fringe, Myosin VI, SOX2",
896,Apoptosis and survival_Anti-apoptotic TNFs/NF-kB/IAP pathway,27,1.414E-01,2.746E-01,3.633E-01,5.285E-01,6,"TRAF2, TRADD, TRAF5, I-kB, TL1A(TNFSF15), IKK-beta",1.414E-01,2.746E-01,9,"IKK (cat), TRADD, I-kB, IKK-alpha, TRAF2, TRAF5, CD30L (TNFSF8), TL1A(TNFSF15), IKK-beta",
897,Immune response_IL-10 signaling pathway,62,1.416E-01,2.728E-01,1.416E-01,2.728E-01,15,"CD80, HPGD, MHC class II, Bcl-3, STAT3, Fc gamma RI, p70 S6 kinase1, PI3K reg class IA, Bcl-2, Bcl-XL, Fc gamma RII beta, AKT(PKB), CD23, PDK (PDPK1), G-CSF",2.324E-01,3.851E-01,17,"HPGD, MHC class II, Bcl-3, PCBP-1, PI3K reg class IA, Bcl-XL, SHIP, AKT(PKB), CD23, PDK (PDPK1), miR-187-3p, Fc gamma RI, p70 S6 kinase1, Bcl-2, microRNA 187, Fc gamma RII beta, G-CSF",
898,Role of platelets in the initiation of in-stent restenosis,43,1.426E-01,2.728E-01,1.426E-01,2.728E-01,11,"PDGF-B, Glycoprotein VI, P2Y12, sCD40L, JAM3, GP-IB alpha, von Willebrand factor, CD40(TNFRSF5), PAR4, GP-V, CD40L(TNFSF5)",3.881E-01,5.574E-01,11,"PDGF-B, Glycoprotein VI, JAM3, Thrombin, von Willebrand factor, PAR4, P2Y12, GP-IX, GP-IB alpha, CD40(TNFRSF5), GP-V",
899,Apoptosis and survival_TNF-alpha-induced Caspase-8 signaling,43,1.426E-01,2.728E-01,1.426E-01,2.728E-01,11,"AKT1, HSP90 alpha, PP2A regulatory, TRADD, Cytochrome c, FADD, ErbB2, PP2A structural, AKT(PKB), HSP90, Cathepsin D",1.624E-01,3.019E-01,13,"AKT1, HSP90 alpha, PP2A regulatory, TRADD, Cytochrome c, FADD, ErbB2, PP2A structural, AKT(PKB), HSP90, Cathepsin D, Caspase-7, AKT2",
900,Immune response_Inhibitory action of Lipoxins on pro-inflammatory TNF-alpha signaling,46,1.448E-01,2.804E-01,3.171E-01,4.833E-01,10,"AKT1, TRAF2, TRADD, STAT3, I-kB, PI3K reg class IA (p85), IKK-beta, AKT(PKB), PDK (PDPK1), p27KIP1",1.448E-01,2.804E-01,14,"AKT1, 14-3-3, PKC-zeta, IKK (cat), TRADD, I-kB, PI3K reg class IA (p85), IKK-alpha, AKT(PKB), PDK (PDPK1), p27KIP1, TRAF2, SHP-2, IKK-beta",
901,Angiotensin II Signaling in Cardiac Hypertrophy,72,1.458E-01,2.779E-01,1.458E-01,2.779E-01,17,"Calcineurin A (catalytic), c-Fos, SLC9A1, ERK1/2, AGTR1, Kv4.3 channel, NF-AT3(NFATC4), GATA-4, Ca(II)channel L-type, G-protein alpha-q/11, IP3 receptor, PRKD1, Calmodulin, MEK6(MAP2K6), CAML, JNK(MAPK8-10), p38 MAPK",2.730E-01,4.346E-01,19,"Calcineurin A (catalytic), c-Fos, SLC9A1, ERK1/2, NF-AT3(NFATC4), GATA-4, G-protein alpha-q/11, IP3 receptor, SOD1, MEK6(MAP2K6), Thioredoxin, AGTR1, Kv4.3 channel, Ca(II)channel L-type, PRKD1, Calmodulin, CAML, JNK(MAPK8-10), p38 MAPK",
902,Oxidative stress_Role of IL-8 signaling pathway in respiratory burst,48,1.473E-01,2.796E-01,1.473E-01,2.796E-01,12,"G-protein alpha-i family, ERK1/2, PAK1, p67-phox, IL8RA, Btk, IP3 receptor, p40-phox, AKT(PKB), p38 MAPK, PREX1, IL8RB",1.870E-01,3.352E-01,14,"ERK1/2, PKC-zeta, IP3 receptor, AKT(PKB), IL8RB, PKC-delta, G-protein alpha-i family, PAK1, IL8RA, Btk, p40-phox, PI3K reg class IB (p101), p38 MAPK, PREX1",
903,Immune response_IL-12 signaling pathway,48,1.473E-01,2.796E-01,1.473E-01,2.796E-01,12,"p38alpha (MAPK14), AKT1, IL-12 alpha, STAT3, Ubiquitin, SPHK2, GADD45 gamma, PI3K reg class IA, MEK6(MAP2K6), JNK(MAPK8-10), AKT(PKB), PDK (PDPK1)",1.870E-01,3.352E-01,14,"AKT1, Cyclin D3, IL-12 alpha, Ubiquitin, PI3K reg class IA, MEK6(MAP2K6), AKT(PKB), PDK (PDPK1), c-Myc, MEKK4(MAP3K4), c-Jun, SPHK2, GADD45 gamma, JNK(MAPK8-10)",
904,TGF-beta 1-induced transactivation of membrane receptors signaling in HCC,50,1.477E-01,2.845E-01,4.219E-01,5.868E-01,10,"E-cadherin, TGF-beta, PAK1, DDX5, PI3K reg class IA, PTEN, FAK1, Cyclin D1, AKT(PKB), Axin",1.477E-01,2.845E-01,15,"Lef-1, Actin, Rac1, PI3K reg class IA, AKT(PKB), c-Myc, Axin, E-cadherin, TGF-beta, PAK1, DDX5, PTEN, FAK1, Cyclin D1, Cofilin",
905,Immune response_IL-13 signaling via PI3K-ERK pathway,50,1.477E-01,2.845E-01,2.896E-01,4.507E-01,11,"MEK1(MAP2K1), GRB2, H-Ras, ERK1/2, c-Raf-1, Adenylate cyclase type I, IP3 receptor, Calmodulin, Mucin 5AC, IGHE, AKT(PKB)",1.477E-01,2.845E-01,15,"GRB2, IRS-1, H-Ras, ERK1/2, PKC-zeta, IP3 receptor, IL-13, AKT(PKB), c-Myc, PKC-delta, Adenylate cyclase type I, Calmodulin, SHP-2, Mucin 5AC, IGHE",
906,Linoleic acid metabolism,31,1.487E-01,2.853E-01,1.868E-01,3.254E-01,8,"PLA2G12, CYP2J2, CYP1A2, PLA2(hGIIA), PLA2G10, ALOX15B, ALOX15, PLA2G5",1.487E-01,2.853E-01,10,"CYP1A2, PLA2G10, CYP2C19, CYP2E1, PLA2G12, CYP2J2, PLA2(hGIIA), ALOX15B, ALOX15, PLA2G5",
907,Development_HGF-dependent inhibition of TGF-beta-induced EMT,34,1.491E-01,2.806E-01,1.491E-01,2.806E-01,9,"MEK1(MAP2K1), GRB2, c-Fos, H-Ras, ERK1/2, c-Raf-1, p90Rsk, PGES2, SP1",6.854E-01,8.263E-01,7,"GRB2, c-Fos, H-Ras, ERK1/2, PGES2, c-Jun, SP1",
908,wtCFTR and deltaF508 traffic / Late endosome and lysosome (normal and CF),16,1.491E-01,2.806E-01,1.491E-01,2.806E-01,5,"VAMP8, Slp5, CFTR, VTI1B, MUNC13-4",2.921E-01,4.586E-01,5,"Slp5, VTI1B, MUNC13-4, Rab-7, VAMP8",
909,Blood coagulation_GPVI-dependent platelet activation,54,1.500E-01,2.867E-01,5.263E-01,6.814E-01,10,"Fc epsilon RI gamma, Glycoprotein VI, Btk, IP3 receptor, GP-IB alpha, von Willebrand factor, SHP-1, VAV-3, SNAP-23, GP-V",1.500E-01,2.867E-01,16,"Fc epsilon RI gamma, Glycoprotein VI, Rac1, IP3 receptor, von Willebrand factor, SHP-1, Syntaxin 4, CALDAG-GEFI, LAT, GP-IX, Btk, GP-IB alpha, SHP-2, VAV-3, SNAP-23, GP-V",
910,"Immune response_Antigen presentation by MHC class I, classical pathway",54,1.500E-01,2.867E-01,1.678E-01,3.031E-01,13,"PSMB1, PSMB5, HSP90 alpha, Impas 1, PSME1, Sec24, NPEPPS, Thimet oligopeptidase, ACE1, Sec23, CHIP, HSP70, IDE",1.500E-01,2.867E-01,16,"PSMB1, PSMB5, HSP90 alpha, Impas 1, PSME2, NPEPPS, Thimet oligopeptidase, ACE1, Sec23, HSP70, PA28 (11S regulator), PSME1, Sec24, CHIP, IDE, TCR alpha/beta",
911,Proinflammatory cytokine production by Th17 cells in asthma,53,1.510E-01,2.829E-01,1.510E-01,2.829E-01,13,"C5aR, GATA-3, CD80, MHC class II, ROR-alpha, CRTH2, ROR-gamma, CCR6, STAT3, IL-1RI, JNK(MAPK8-10), IL-4, IL-6 receptor",2.106E-01,3.607E-01,15,"MHC class II, c-Jun/c-Fos, IL-13, IL-1RI, IL-9, IL-4, C3aR, C5aR, GATA-3, ROR-gamma, c-Jun, CCR6, JNK(MAPK8-10), TCR alpha/beta, IL-6 receptor",
912,CTP/UTP metabolism,107,1.511E-01,2.829E-01,1.511E-01,2.829E-01,24,"RRP41, RPOM, NDPK C, CTP synthase II, PCY1A, NDPK complex, RPB8, RPB10, POLR3B, AID, UCK1, RPB7.0, NDPK 6, POLR3A, POLR1B, CSL4, NDPK A, RRP46, NDPK D (mitochondrial), ENP3, POLR2I, ENP1, POLR3K, NDPK B",2.330E-01,3.851E-01,28,"RPOM, PCY1A, NDPK complex, RPB8, PR44 (DIS3), POLR3B, NDPK 6, POLR1B, CSL4, RPB5, RRP46, ENP1, POLR3K, AK1, RRP41, NDPK C, CTP synthase II, RPB10, AID, UCK1, RPB7.0, POLR3A, RRP4, NDPK A, NDPK D (mitochondrial), ENP3, POLR2I, NDPK B",
913,Cytoskeleton remodeling_Neurofilaments,25,1.529E-01,2.852E-01,1.529E-01,2.852E-01,7,"Tubulin beta, DCTN2, NEFM, Tubulin alpha, Kinesin heavy chain, Peripherin, Tubulin (in microtubules)",1.917E-01,3.400E-01,8,"DCTN2, Peripherin, Tubulin (in microtubules), Tubulin beta, Tubulin gamma, MUNC18, Tubulin alpha, Kinesin heavy chain",
914,Development_Role of nicotinamide in G-CSF-induced granulopoiesis,13,1.540E-01,2.909E-01,1.976E-01,3.377E-01,4,"Sirtuin1, G-CSF receptor, G-CSF, C/EBPalpha",1.540E-01,2.909E-01,5,"Lef-1, G-CSF receptor, Sirtuin1, G-CSF, C/EBPalpha",
915,SHH signaling in oligodendrocyte precursor cells differentiation in multiple sclerosis,13,1.540E-01,2.909E-01,4.283E-01,5.941E-01,3,"PLP1, SHH, SUFU",1.540E-01,2.909E-01,5,"PLP1, Nkx2.2, SUFU, SHH, MAG",
916,Development_TGF-beta-dependent induction of EMT via SMADs ,35,1.543E-01,2.909E-01,1.703E-01,3.058E-01,9,"E-cadherin, E2A, MKL2, TGF-beta, ILK, ID2, TGF-beta 3, Occludin, SP1",1.543E-01,2.909E-01,11,"E2A, Lef-1, ID2, HEY1, E-cadherin, MKL2, TGF-beta, ILK, TGF-beta 3, Occludin, SP1",
917,G-protein signaling_S1P2 receptor signaling pathway,35,1.543E-01,2.909E-01,2.944E-01,4.507E-01,8,"G-protein alpha-i family, IP3 receptor, G-protein alpha-13, PTEN, Adenylate cyclase, FAK1, AKT(PKB), PDK (PDPK1)",1.543E-01,2.909E-01,11,"PLC-beta1, IP3 receptor, G-protein alpha-13, Adenylate cyclase, AKT(PKB), PDK (PDPK1), G-protein alpha-i family, PTEN, FAK1, G-protein alpha-q, PI3K reg class IB (p101)",
918,Immune response_Lipoxins and Resolvin E1 inhibitory action on neutrophil functions,35,1.543E-01,2.909E-01,6.292E-01,7.756E-01,6,"c-Fos, G-protein alpha-i family, ERK1/2, LTBR1, NFKBIA, I-kB",1.543E-01,2.909E-01,11,"c-Fos, ERK1/2, PKC-zeta, c-Jun/c-Fos, I-kB, SOD1, IKK-alpha, G-protein alpha-i family, LTBR1, NFKBIA, PI3K reg class IB (p101)",
919,Development_Growth hormone signaling via STATs and PLC/IP3,35,1.543E-01,2.909E-01,6.292E-01,7.756E-01,6,"c-Fos, GHR, STAT3, FAK1, SOCS2, IGF-1",1.543E-01,2.909E-01,11,"c-Fos, Fibrinogen beta, PKC-delta, c-Jun, PTP-1B, C3G, Paxillin, GHR, FAK1, SOCS2, IGF-1",
920,Glucose-excited neurons of arcuate nucleus in obesity (rodent model),35,1.543E-01,2.909E-01,1.703E-01,3.058E-01,9,"Tuberin, SUR1, CACNA1C, AMPK alpha subunit, UCP2, Kir6.2, AMPK alpha 2 subunit, GLUT1, p70 S6 kinase1",1.543E-01,2.909E-01,11,"Tuberin, SUR1, UCP2, GLUT4, Kir6.2, CACNA1C, AMPK alpha subunit, AMPK alpha 2 subunit, GLUT1, p70 S6 kinase1, N-type Ca(II) channel alpha1B",
921,Development_WNT and Notch signaling in early cardiac myogenesis,35,1.543E-01,2.909E-01,7.867E-01,8.965E-01,5,"GATA-4, Dsh, WNT, HEY2, SOX13",1.543E-01,2.909E-01,11,"TBX5, WNT3A, GATA-4, Dsh, LRP5, WNT1, WNT, CHIBBY, HEY2, Frizzled, SOX13",
922,Immune response_HMGB1 release from the cell,39,1.557E-01,2.885E-01,1.557E-01,2.885E-01,10,"HSPA1A, IP3 receptor, PI3K reg class IA (p85), Calmodulin, PI3K reg class IA, IL-1RI, MEK1/2, JNK(MAPK8-10), PKC-gamma, PDK (PDPK1)",2.624E-01,4.191E-01,11,"IP3 receptor, PI3K reg class IA (p85), PI3K reg class IA, MyD88, IL-1RI, PKC-gamma, PDK (PDPK1), PARP-1, HSPA1A, Calmodulin, JNK(MAPK8-10)",
923,Immune response_Distinct metabolic pathways in naive and effector CD8+ T cells,74,1.564E-01,2.944E-01,8.098E-01,9.121E-01,11,"Tuberin, CISY, DHE4, ERK1/2, GLUT1, PI3K reg class IA (p85), ACLY, DHE3, SLC38A1, AKT(PKB), PDK (PDPK1)",1.564E-01,2.944E-01,21,"Tuberin, CISY, ERK1/2, IL-3, PI3K reg class IA (p85), DHE3, ASCT2 (SLC1A5), GLSL, AKT(PKB), PDK (PDPK1), c-Myc, ARNT, Pim-2, DHE4, Hamartin, 4E-BP1, GLUT1, ACLY, AP-4, SLC38A1, TCR alpha/beta",
924,Apoptosis and survival_NO signaling in survival,24,1.607E-01,3.006E-01,2.599E-01,4.198E-01,6,"Protein kinase G1, H-Ras, eNOS, AKT(PKB), PDK (PDPK1), p38 MAPK",1.607E-01,3.006E-01,8,"Protein kinase G1, IRS-1, H-Ras, BAD, AKT(PKB), PDK (PDPK1), eNOS, p38 MAPK",
925,Immune response_IL-13 signaling via JAK-STAT,44,1.608E-01,2.961E-01,1.608E-01,2.961E-01,11,"CCL17, FOXJ1, STAT3, ARG1, IGHE, IL13RA2, SHP-1, IGHG4, STAT6, CD23, ALOX15",2.906E-01,4.582E-01,12,"CCL17, ARG1, IL-13, SHP-1, CD23, RSNB, PKC-delta, FOXJ1, IGHE, IGHG4, STAT6, ALOX15",
926,Transport_cAMP/ Ca(2+)-dependent Insulin secretion,44,1.608E-01,2.961E-01,1.608E-01,2.961E-01,11,"SUR1, cAMP-GEFI, Insulin processed, SNAP-25, CACNA1C, PKA-reg (cAMP-dependent), Kir6.2, MUNC13-1, IP3 receptor, CACNA1D, Calmodulin",5.631E-01,7.195E-01,10,"SUR1, cAMP-GEFI, Insulin processed, PKA-reg (cAMP-dependent), Kir6.2, Syntaxin 1A, IP3 receptor, CACNA1C, CACNA1D, Calmodulin",
927,Regulation of metabolism_Triiodothyronine and Thyroxine signaling,44,1.608E-01,2.961E-01,1.608E-01,2.961E-01,11,"TR-alpha, AKT1, S14 protein, MCT8, Bcl-3, FASN, TR-beta, GLUT1, p70 S6 kinase1, DIO1, p70 S6 kinase2",4.206E-01,5.885E-01,11,"TR-alpha, AKT1, S14 protein, Bcl-3, FASN, TR-beta, MCT8, GLUT1, p70 S6 kinase1, DIO1, p70 S6 kinase2",
928,Arachidonic acid metabolites production in eosinophils in asthma,44,1.608E-01,2.961E-01,1.608E-01,2.961E-01,11,"LTC4S, CCR3, CRTH2, G-protein alpha-i family, COX-1 (PTGS1), PKC, cPLA2, PLA2G10, JNK(MAPK8-10), PLA2G5, p38 MAPK",4.206E-01,5.885E-01,11,"IL-16 mature, IL-3, cPLA2, PLA2G10, CCR3, G-protein alpha-i family, IL-5 receptor, PKC, JNK(MAPK8-10), PLA2G5, p38 MAPK",
929,Immune response_BAFF-induced canonical NF-kB signaling,43,1.624E-01,3.019E-01,5.302E-01,6.828E-01,8,"TRAF2, E2N(UBC13), Btk, NFKBIA, IP3 receptor, Ubiquitin, IKK-beta, TAB2",1.624E-01,3.019E-01,13,"E2N(UBC13), IKK (cat), IP3 receptor, Ubiquitin, MyD88, IKK-alpha, TAB2, UEV1A, TRAF2, Btk, NFKBIA, UBE1, IKK-beta",
930,Development_Notch Signaling Pathway,43,1.624E-01,3.019E-01,3.757E-01,5.398E-01,9,"FBXW7, GCN5, TLE, NFKBIA, Ubiquitin, Lunatic fringe, DLL1, HEY2, MYOD",1.624E-01,3.019E-01,13,"FBXW7, GCN5, TLE, Ubiquitin, DLL1, Radical fringe, HEY1, MAML1, DLL4, NFKBIA, Lunatic fringe, HEY2, MYOD",
931,Cell adhesion_Gap junctions,30,1.629E-01,2.972E-01,1.629E-01,2.972E-01,8,"Tubulin beta, Cingulin, Tubulin alpha, PKC, Connexin 43, Occludin, ZO-3, Tubulin (in microtubules)",2.290E-01,3.851E-01,9,"Connexin 32, Actin, Tubulin (in microtubules), Tubulin beta, Cingulin, Tubulin alpha, PKC, Occludin, ZO-3",
932,Inhibition of mast cell functions by Fc gamma RII beta in asthma,30,1.629E-01,2.972E-01,1.629E-01,2.972E-01,8,"GRB2, K-RAS, MGF, Btk, IP3 receptor, PI3K reg class IA (p85), Fc gamma RII beta, AKT(PKB)",2.290E-01,3.851E-01,9,"GRB2, IP3 receptor, PI3K reg class IA (p85), SHIP, AKT(PKB), K-RAS, MGF, Btk, Fc gamma RII beta",
933,Transcription_Ligand-dependent activation of the ESR1/SP pathway,30,1.629E-01,2.972E-01,1.629E-01,2.972E-01,8,"c-Fos, ESR1 (nuclear), NCOA3 (pCIP/SRC3), E2F1, Prolactin receptor, RARalpha, Cyclin D1, SP1",3.731E-01,5.453E-01,8,"c-Fos, ESR1 (nuclear), Prolactin receptor, RARalpha, NCOA3 (pCIP/SRC3), E2F1, Cyclin D1, SP1",
934,Putative role of Tregs in COPD,30,1.629E-01,2.972E-01,1.629E-01,2.972E-01,8,"MEK1(MAP2K1), MCP, ROR-gamma, ERK1/2, STAT3, CD3, FOXP3, CD27(TNFRSF7)",2.290E-01,3.851E-01,9,"NF-AT1(NFATC2), ERK1/2, ZAP70, FOXP3, CD27(TNFRSF7), IL-2R alpha chain, MCP, ROR-gamma, LAT",
935,Role of adipose tissue hypoxia in obesity and type 2 diabetes,30,1.629E-01,2.972E-01,1.629E-01,2.972E-01,8,"PDK1, Adiponectin, ANGPTL4, RXRA, CD36, GLUT1, Leptin, C/EBPalpha",5.429E-01,7.034E-01,7,"Adiponectin, ANGPTL4, RXRA, CD36, GLUT1, Leptin, C/EBPalpha",
936,Glucocorticoids-mediated inhibition of pro-constrictory and pro-inflammatory signaling in airway smooth muscle cells,49,1.647E-01,2.997E-01,1.647E-01,2.997E-01,12,"c-Fos, ERK1/2, Myosin II, NFKBIA, G-protein alpha-s, PDE4D, MRLC, MKP-1, JNK(MAPK8-10), PLA2, p38 MAPK, GRK2",3.165E-01,4.848E-01,13,"c-Fos, ERK1/2, PDE4D, GRK2, c-Jun, Myosin II, NFKBIA, G-protein alpha-s, MRLC, MKP-1, JNK(MAPK8-10), PLA2, p38 MAPK",
937,Role and regulation of Prostaglandin E2 in gastric cancer,49,1.647E-01,2.997E-01,1.647E-01,2.997E-01,12,"MEK1(MAP2K1), HPGD, GRB2, H-Ras, ERK1/2, PKA-reg (cAMP-dependent), c-Raf-1, G-protein alpha-s, Adenylate cyclase, PGES2, SP1, CD40L(TNFSF5)",7.082E-01,8.477E-01,10,"HPGD, GRB2, H-Ras, ERK1/2, PKA-reg (cAMP-dependent), Adenylate cyclase, PGES2, CCKBR, G-protein alpha-s, SP1",
938,Inhibition of remyelination in multiple sclerosis: role of cell-cell and ECM-cell interactions,47,1.652E-01,3.060E-01,7.735E-01,8.882E-01,7,"CD81, PLP1, CD9, PKC, Connexin 43, FAK1, HYAL1",1.652E-01,3.060E-01,14,"TrkA, CD81, Connexin 32, Lingo1, PLP1, MyD88, HYAL1, CD82, Tenascin-R, CD9, Neurofascin, PKC, FAK1, MAG",
939,Role of prenatal nicotine exposure in inhibition of pancreatic beta cells differentiation and function,21,1.665E-01,3.020E-01,1.665E-01,3.020E-01,6,"Insulin processed, Kir6.2, Insulin receptor, IGF-1 receptor, Insulin, IGF-1",3.406E-01,5.087E-01,6,"Insulin processed, Kir6.2, Insulin receptor, IGF-1 receptor, Insulin, IGF-1",
940,Development_Role of HGF in hematopoietic stem cell mobilization,21,1.665E-01,3.020E-01,1.665E-01,3.020E-01,6,"Tuberin, PI3K reg class IA, G-CSF receptor, AKT(PKB), PDK (PDPK1), G-CSF",1.833E-01,3.306E-01,7,"Tuberin, PI3K reg class IA, G-CSF receptor, AKT(PKB), PDK (PDPK1), FOXO3A, G-CSF",
941,Development_Role of G-CSF in hematopoietic stem cell mobilization,21,1.665E-01,3.020E-01,1.665E-01,3.020E-01,6,"C5aR, STAT3, G-CSF receptor, G-CSF, Cathepsin K, SDF-1",5.403E-01,7.024E-01,5,"G-CSF receptor, SDF-1, C5aR, G-CSF, Cathepsin K",
942,Th17 cells in CF,54,1.678E-01,3.031E-01,1.678E-01,3.031E-01,13,"CD80, MHC class II, ROR-alpha, ROR-gamma, ERK1/2, CFTR, CCR6, STAT3, IL-17RC, IL-1RI, G-CSF, p38 MAPK, IL-6 receptor",4.638E-01,6.309E-01,13,"MHC class II, ERK1/2, IL-17RC, MyD88, IL-1RI, LBP, ROR-gamma, Beta-defensin 2, CCR6, G-CSF, TCR alpha/beta, p38 MAPK, IL-6 receptor",
943,Role of IL-23/ T17 pathogenic axis in psoriasis,54,1.678E-01,3.031E-01,1.678E-01,3.031E-01,13,"CD80, MHC class II, CARD14, ROR-gamma, ERK1/2, CCR6, STAT3, IL-1RI, IL-2R beta chain, CD40(TNFRSF5), AKT(PKB), IL-6 receptor, CD40L(TNFSF5)",2.339E-01,3.851E-01,15,"MHC class II, NF-AT1(NFATC2), ERK1/2, IL-1F6, IL-1RI, AKT(PKB), CARD14, Beta-defensin 3, ROR-gamma, Beta-defensin 2, CCR6, IL-2R beta chain, CD40(TNFRSF5), TCR alpha/beta, IL-6 receptor",
944,PGE2 pathways in cancer,55,1.691E-01,3.110E-01,1.854E-01,3.240E-01,13,"G-protein alpha-i family, PKA-reg (cAMP-dependent), COX-1 (PTGS1), Amphiregulin, G-protein alpha-s, Adenylate cyclase, Cyclin D1, NURR1, AKT(PKB), Beta-arrestin1, PDK (PDPK1), ERK1 (MAPK3), Axin",1.691E-01,3.110E-01,16,"Lef-1, EGR1, PKA-reg (cAMP-dependent), Amphiregulin, Adenylate cyclase, AKT(PKB), PDK (PDPK1), c-Myc, ERK1 (MAPK3), Axin, Tcf(Lef), G-protein alpha-i family, G-protein alpha-s, Cyclin D1, NURR1, Beta-arrestin1",
945,Immune response_Role of DAP12 receptors in NK cells,55,1.691E-01,3.110E-01,1.854E-01,3.240E-01,13,"MEK1(MAP2K1), GRB2, NKG2A, H-Ras, ERK1/2, c-Raf-1, PAK1, KIR2DL4, PI3K reg class IA, VAV-2, WASP, SHP-1, VAV-3",1.691E-01,3.110E-01,16,"GRB2, NKG2A, H-Ras, ERK1/2, Rac1, PI3K reg class IA, ZAP70, VAV-2, WASP, SHP-1, PAK1, LAT, KIR2DL4, KLRA1, SHP-2, VAV-3",
946,Anti-apoptotic action of Gastrin in gastric cancer,35,1.703E-01,3.058E-01,1.703E-01,3.058E-01,9,"MEK1(MAP2K1), ERK1/2, c-Raf-1, PAK1, Cytochrome c, IP3 receptor, Bcl-2, Bcl-XL, PKC-gamma",2.624E-01,4.191E-01,10,"ERK1/2, Cytochrome c, Rac1, IP3 receptor, BAD, Bcl-XL, PKC-gamma, CCKBR, PAK1, Bcl-2",
947,G-protein signaling_Rac3 regulation pathway,17,1.714E-01,3.144E-01,1.815E-01,3.197E-01,5,"ABLIM1, PAK1, Rac3, Calmyrin, Androgen receptor",1.714E-01,3.144E-01,6,"ABLIM1, HNF1-alpha, Calmyrin, Androgen receptor, PAK1, Rac3",
948,dGTP metabolism,64,1.720E-01,3.084E-01,1.720E-01,3.084E-01,15,"POLE1, NDPK C, NDPK complex, ENTPD2-alpha, KGUA, NDPK 6, 5'-NTC, NDPK A, POLG reg, POLD reg (p12), PPAL, NDPK D (mitochondrial), POLD reg (p50), DNA polymerase lambda, NDPK B",1.905E-01,3.398E-01,18,"NDPK complex, NDPK 6, 5'-NTC, POLG reg, PPAL, POLE3 (YBL1), DNA polymerase lambda, POLE1, NDPK C, ENTPD2-alpha, KGUA, POLE2, NDPK A, POLD reg (p12), NDPK D (mitochondrial), POLD reg (p50), POLG cat, NDPK B",
949,Calcium-dependent regulation of normal and asthmatic smooth muscle contraction,69,1.733E-01,3.105E-01,1.733E-01,3.105E-01,16,"Substance P extracellular region, TRPC4, Neurokinin A, G-protein alpha-i family, CACNA1C, Myosin II, BDKRB2, Ryanodine receptor 3, Tryptase, Nk3R, IP3 receptor, Calmodulin, PLC-beta, MRLC, Neurokinin B, MLCK",2.100E-01,3.607E-01,19,"Substance P extracellular region, Neurokinin A, BDKRB2, Nk3R, IP3 receptor, Thrombin, PLC-beta, HTR2C (HTR1C), Neurokinin B, MLCK, ACM2, G-protein alpha-i family, CACNA1C, Myosin II, Tryptase, Bradykinin, Calmodulin, MRLC, G-protein alpha-q",
950,"Development_Role of Ceramide 1-phosphate, Sphingosine 1-phosphate and Complement cascade in hematopoietic stem cell homing",32,1.744E-01,3.176E-01,3.582E-01,5.226E-01,7,"cAMP-GEFI, ERK1/2, PGE2R3, C1qRp, VAV-2, AKT(PKB), SDF-1",1.744E-01,3.176E-01,10,"cAMP-GEFI, ERK1/2, PKC-zeta, Rac1, VAV-2, AKT(PKB), SDF-1, C3aR, PGE2R3, C1qRp",
951,Upregulation of IL-8 expression in colorectal cancer,32,1.744E-01,3.176E-01,3.582E-01,5.226E-01,7,"WNT4, c-Fos, NFKBIA, WNT, IKK-beta, NTSR1, IL-1RI",1.744E-01,3.176E-01,10,"c-Fos, IKK (cat), NTSR1, IL-1RI, WNT4, NFKBIA, WNT1, WNT, IKK-beta, Frizzled",
952,DNA damage_Mismatch repair,32,1.744E-01,3.176E-01,5.358E-01,6.888E-01,6,"MutLalpha complex, PMS2, RAD9A, DNA ligase I, RPRD1B, MLH1",1.744E-01,3.176E-01,10,"MutLalpha complex, PKC-zeta, PMS2, RAD9A, DNA ligase I, MSH3, MTMR15, RPRD1B, MCM9, MLH1",
953,Cell adhesion_Role of CDK5 in cell adhesion,10,1.750E-01,3.183E-01,2.667E-01,4.228E-01,3,"E-cadherin, Alpha-catenin, ErbB2",1.750E-01,3.183E-01,4,"ErbB2, E-cadherin, Tcf(Lef), Alpha-catenin",
954,Neurophysiological process_Glucose-excited neurons of arcuate nucleus (rodent model),40,1.758E-01,3.127E-01,1.758E-01,3.127E-01,10,"Tuberin, SUR1, CACNA1C, AMPK alpha subunit, Kir6.2, AMPK alpha 2 subunit, GLUT1, p70 S6 kinase1, HIF-prolyl hydroxylase, CART",1.824E-01,3.301E-01,12,"Tuberin, SUR1, GLUT4, Kir6.2, CACNA1C, AMPK alpha subunit, AMPK alpha 2 subunit, GLUT1, p70 S6 kinase1, HIF-prolyl hydroxylase, N-type Ca(II) channel alpha1B, CART",
955,Immune response_Th1 and Th2 cell differentiation,40,1.758E-01,3.127E-01,1.758E-01,3.127E-01,10,"GATA-3, CD80, MHC class II, IL-12 alpha, AP-1, CD3, CD40(TNFRSF5), STAT6, IL-4, CD40L(TNFSF5)",4.297E-01,5.981E-01,10,"MHC class II, NF-AT1(NFATC2), IL-12 alpha, IL-13, IL-4, GATA-3, AP-1, CD40(TNFRSF5), STAT6, TCR alpha/beta",
956,Role of IGH translocations in multiple myeloma,40,1.758E-01,3.127E-01,1.758E-01,3.127E-01,10,"E-cadherin, FGFR3, E2F1, CAC, CCR1, Rb protein, MafB, ITGB7, p130, Cyclin D1",1.824E-01,3.301E-01,12,"Cyclin D3, CAC, CCR1, Rb protein, MafB, ITGB7, p130, c-Myc, E-cadherin, FGFR3, E2F1, Cyclin D1",
957,Development_Astrocyte differentiation from adult stem cells,40,1.758E-01,3.127E-01,1.758E-01,3.127E-01,10,"hASH1, GRB2, E2A, H-Ras, ERK1/2, OLIG1, c-Raf-1, STAT3, ID2, MEK1/2",4.297E-01,5.981E-01,10,"GRB2, E2A, H-Ras, ERK1/2, OLIG1, ID2, Nkx2.2, hASH1, SHP-2, SMAD1",
958,Role of fibroblasts and keratinocytes in the elicitation phase of allergic contact dermatitis,26,1.784E-01,3.162E-01,1.784E-01,3.162E-01,7,"H-Ras, CCR2, IL8RA, CCR6, CCR5, IL-4, IL8RB",2.250E-01,3.832E-01,8,"H-Ras, CCR2, CCR5, IL-4, IL8RB, IL8RA, CCR6, CXCR3",
959,Development_Activation of ERK by Alpha-1 adrenergic receptors,45,1.800E-01,3.182E-01,1.800E-01,3.182E-01,11,"MEK1(MAP2K1), c-Fos, H-Ras, ERK1/2, G-protein alpha-11, CACNA1C, c-Raf-1, IP3 receptor, Calmodulin, Alpha-1A adrenergic receptor, G-protein alpha-14",2.091E-01,3.607E-01,13,"c-Fos, H-Ras, ERK1/2, PLC-beta1, IP3 receptor, G-protein alpha-14, PKC-delta, c-Jun, G-protein alpha-11, CACNA1C, Calmodulin, Alpha-1A adrenergic receptor, G-protein alpha-q",
960,Immune response_PGE2 signaling in immune response,45,1.800E-01,3.182E-01,1.800E-01,3.182E-01,11,"MEK1(MAP2K1), H-Ras, PKA-reg (cAMP-dependent), c-Raf-1, COX-1 (PTGS1), G-protein alpha-s, Adenylate cyclase, CCR5, IL-4, G-CSF, ERK1 (MAPK3)",7.275E-01,8.605E-01,9,"NF-AT1(NFATC2), H-Ras, PKA-reg (cAMP-dependent), Adenylate cyclase, CCR5, IL-4, ERK1 (MAPK3), G-protein alpha-s, G-CSF",
961,"Mechanism of action of DGAT1 inhibitors in obesity and diabetes mellitus, type II (Variant 2)",1,1.813E-01,3.197E-01,1.813E-01,3.197E-01,1,DGAT1,2.280E-01,3.851E-01,1,DGAT1,
962,DNA damage_Role of SUMO in p53 regulation,17,1.815E-01,3.197E-01,1.815E-01,3.197E-01,5,"Chk2, E2I, Ubiquitin, MDM2, AKT(PKB)",3.423E-01,5.103E-01,5,"E2I, Ubiquitin, MDM2, AKT(PKB), SAE1",
963,Stem cells_Response to hypoxia in glioblastoma stem cells,40,1.824E-01,3.301E-01,6.059E-01,7.550E-01,7,"BMP7, p21, Ubiquitin, DLL1, HEY2, Cyclin D1, HIF-prolyl hydroxylase",1.824E-01,3.301E-01,12,"p21, Ubiquitin, DLL1, Nucleophosmin, ARNT, HEY1, BMP7, DLL4, HEY2, SMAD1, Cyclin D1, HIF-prolyl hydroxylase",
964,Immune response_Production and main functions of biologically active leukotrienes and Lipoxin A4,50,1.831E-01,3.214E-01,1.831E-01,3.214E-01,12,"ABCC11, LTC4S, ABCC6, LTBR1, GGT1, ALOX12, LTA4H, cPLA2, DPEP2, LTBR2, CysLT1 receptor, ABCC2",7.332E-01,8.651E-01,10,"ABCC6, GGT1, cPLA2, LTBR2, CysLT1 receptor, ABCC11, LTBR1, LTA4H, DPEP2, ABCC2",
965,VEGF signaling in multiple myeloma,50,1.831E-01,3.214E-01,1.831E-01,3.214E-01,12,"MEK1(MAP2K1), AKT1, GRB2, H-Ras, VEGFR-1, c-Raf-1, IP3 receptor, STAT3, VEGF-D, PI3K reg class IA, PDK (PDPK1), ERK1 (MAPK3)",7.332E-01,8.651E-01,10,"AKT1, GRB2, H-Ras, IP3 receptor, VEGF-D, PI3K reg class IA, PDK (PDPK1), c-Myc, ERK1 (MAPK3), VEGFR-1",
966,Development_Generation of pancreatic beta-cells from embryonic stem cells (early stages),21,1.833E-01,3.306E-01,3.291E-01,4.917E-01,5,"HB9, NANOG, SOX2, FGF10, HNF6",1.833E-01,3.306E-01,7,"WNT3A, FGF10, HB9, NANOG, FGF7, SOX2, HNF6",
967,Proteases and EGFR-induced mucin synthesis in normal and asthmatic epithelium,55,1.854E-01,3.240E-01,1.854E-01,3.240E-01,13,"EGF, ERK1/2, p90RSK1, p67-phox, G-protein alpha-q/11, NFKBIA, IP3 receptor, Amphiregulin, PLC-beta, Mucin 2, Mucin 5AC, Mucin 5B, SP1",3.686E-01,5.413E-01,14,"EGF, ERK1/2, IL-3, G-protein alpha-q/11, IP3 receptor, Amphiregulin, PLC-beta, Mucin 5B, PKC-delta, NFKBIA, Mucin 2, Mucin 5AC, SP1, Kallikrein 1",
968,"Immune response_T cell co-signaling receptors, schema",55,1.854E-01,3.240E-01,1.854E-01,3.240E-01,13,"CD80, MHC class II, ICOS-L, TIGIT, Nectin-2, TL1A(TNFSF15), CD2, CD27(TNFRSF7), Collagen II, CD40(TNFRSF5), BY55, LAG3, CD40L(TNFSF5)",3.686E-01,5.413E-01,14,"MHC class II, ICOS-L, TIM-4, CD27(TNFRSF7), Collagen II, BY55, ICOS, Nectin-2, TIM-1, CD30L (TNFSF8), TIM-3, TL1A(TNFSF15), CD40(TNFRSF5), LAG3",
