Enrichment analysis report,,,,,,,,,,,,,
562,HBV regulation of DNA repair and apoptosis leading to HCC,14,2.359E-02,7.960E-02,2.816E-02,8.970E-02,6,"MAZ, p21, DDB2, MDM2, AFP, SP1",2.359E-02,7.960E-02,7,"p21, MDM2, MAZ, DDB1, DDB2, SP1, XPD",
563,Transcription_Transcription factor Tubby signaling pathways,17,2.377E-02,7.967E-02,7.150E-02,1.715E-01,6,"Insulin processed, G-protein alpha-11, G-protein alpha-q/11, PKC, PLC-beta, Insulin receptor",2.377E-02,7.967E-02,8,"Insulin processed, G-protein alpha-q/11, PLC-beta, HTR2C (HTR1C), Insulin receptor, G-protein alpha-11, PKC, G-protein alpha-q",
564,Prolactin signaling in Prostate Cancer,33,2.392E-02,7.999E-02,3.904E-01,5.570E-01,7,"PIP, AATM, Prolactin receptor, Androgen receptor, AP-1, Bcl-XL, Cyclin D1",2.392E-02,7.999E-02,13,"PIP, c-Jun/c-Fos, Prolactin receptor, Androgen receptor, PDH, Bcl-XL, c-Jun, PDHA (somatic), AATM, AP-1, PDH alpha, ACON, Cyclin D1",
565,Aminoglycoside- and cisplatin-induced hair cell death,112,2.404E-02,8.021E-02,6.729E-02,1.651E-01,27,"SLC31A1, PRDX3, Calcineurin A (catalytic), Aif, c-Fos, SMPD3, H-Ras, ERK1/2, NF-AT3(NFATC4), p67-phox, Cytochrome c, TRPV1, Endonuclease G, AP-1, Sirtuin1, PKC, NOX3, Bcl-2, Bcl-XL, NOL3, JNK(MAPK8-10), STAT6, IL-4, NOX1, PUMA, p38 MAPK, Cathepsin D",2.404E-02,8.021E-02,35,"SLC31A1, PRDX3, Calcineurin A (catalytic), c-Fos, SMPD3, H-Ras, ERK1/2, NF-AT3(NFATC4), c-Jun/c-Fos, Cytochrome c, TRPV1, Endonuclease G, Rac1, NOX3, IL-13, Bcl-XL, FasL(TNFSF6), IL-4, NOX1, PUMA, Cathepsin D, PARP-1, Aif, c-Jun, KCNQ4, MKK7 (MAP2K7), AP-1, Sirtuin1, PKC, Bcl-2, ACON, NOL3, JNK(MAPK8-10), STAT6, p38 MAPK",
566,Differentiation of Th2 cells in asthma,45,2.444E-02,8.204E-02,2.444E-02,8.204E-02,14,"CCL22, CD80, MHC class II, CCL17, CCR2, CCR6, NFKBIA, PI3K reg class IA, CD3, CCR5, STAT6, IL-4, AKT(PKB), PDK (PDPK1)",6.973E-02,1.690E-01,15,"CCL22, MHC class II, CCL17, CCR2, PI3K reg class IA, IKK-alpha, CCR5, IL-4, AKT(PKB), PDK (PDPK1), CCR6, NFKBIA, CXCR3, STAT6, TCR alpha/beta",
567,HCV-dependent transcription regulation leading to HCC,21,2.511E-02,8.354E-02,2.511E-02,8.354E-02,8,"E2F1, p21, HSPA1A, STAT3, Rb protein, Bcl-XL, Cyclin D1, HSP70",1.833E-01,3.306E-01,7,"p21, Rb protein, Bcl-XL, HSP70, E2F1, HSPA1A, Cyclin D1",
568,Role of ZNF202 in regulation of expression of genes involved in atherosclerosis,21,2.511E-02,8.354E-02,2.511E-02,8.354E-02,8,"PU.1, SDP1, ABCG1, HDL proteins, CRABP2, TIF1-beta, IA-1, ZNF24 (ZNF191)",3.256E-02,9.954E-02,9,"SDP1, ABCG1, HDL proteins, CRABP2, TIF1-beta, PU.1, APOC3, IA-1, ZNF24 (ZNF191)",
569,Translation_(L)-selenoaminoacids incorporation in proteins during translation,41,2.532E-02,8.388E-02,2.532E-02,8.388E-02,13,"GPX2, Selenoprotein W, SLA/LP, Selenoprotein O, SEPX1 (Selenoprotein X1), SBP2, SELB, DIO1, RPL30, Selenoprotein P, GPX4, TXNRD2, SEPHS2",6.522E-02,1.617E-01,14,"GPX3, GPX2, Selenoprotein W, SEPHS2, SLA/LP, Selenoprotein O, SEPX1 (Selenoprotein X1), SBP2, SELB, DIO1, RPL30, Selenoprotein P, GPX4, TXNRD2",
570,Apoptosis and survival_Ceramides signaling pathway,40,2.547E-02,8.368E-02,4.659E-02,1.282E-01,12,"MEK1(MAP2K1), H-Ras, ERK1/2, c-Raf-1, TRADD, Cytochrome c, FADD, PI3K reg class IA (p85), Neutral sphingomyelinase, Bcl-2, AKT(PKB), Cathepsin D",2.547E-02,8.368E-02,15,"H-Ras, ERK1/2, PKC-zeta, TRADD, Cytochrome c, FADD, BAD, PI3K reg class IA (p85), Neutral sphingomyelinase, FasL(TNFSF6), AKT(PKB), Cathepsin D, c-Jun, MEKK1(MAP3K1), Bcl-2",
571,Transcription_Role of heterochromatin protein 1 (HP1) family in transcriptional silencing,40,2.547E-02,8.368E-02,9.521E-02,2.064E-01,11,"SETDB1, E2F1, DNMT3A, MEF2, HP1 beta, E2I, HP1, MYOG, TIF1-beta, Rb protein, MYOD",2.547E-02,8.368E-02,15,"E2I, HP1, MYOG, TIF1-beta, Rb protein, CtBP, Suv39H1, Mi-2, SETDB1, E2F1, DNMT3A, MEF2, HP1 beta, MBD3, MYOD",
572,Development_SLIT-ROBO1 signaling,40,2.547E-02,8.368E-02,4.659E-02,1.282E-01,12,"Calcineurin A (catalytic), PAK2, p190RhoGAP, Myosin II, PI3K reg class IA (p85), Calmodulin, FLII, SLIT1, ARF6, WASP, AKT(PKB), PREX1",2.547E-02,8.368E-02,15,"Calcineurin A (catalytic), PAK2, Rac1, PI3K reg class IA (p85), ARF6, WASP, AKT(PKB), Endophilin A2, p190RhoGAP, Myosin II, Calmodulin, FLII, SLIT1, Cofilin, PREX1",
573,Development_WNT/Beta-catenin and NOTCH in induction of osteogenesis,40,2.547E-02,8.368E-02,4.426E-01,6.061E-01,8,"A-FABP, Adiponectin, Dsh, DLL1, WNT, Bone sialoprotein, Axin, C/EBPalpha",2.547E-02,8.368E-02,15,"WNT3A, Dsh, DLL1, Bone sialoprotein, LRP5, Axin, HEY1, Adiponectin, MAML1, WNT1, WNT, WNT10B, SMAD1, Frizzled, C/EBPalpha",
574,CHDI_Correlations from Replication data_Causal network (negative correlations),40,2.547E-02,8.368E-02,4.426E-01,6.061E-01,8,"Huntingtin, Dsh, ILK, PKC, WNT, AKT(PKB), SP1, Axin",2.547E-02,8.368E-02,15,"Huntingtin, Dsh, PLC-beta1, Plasminogen, LRP5, CtBP, AKT(PKB), Axin, Plasmin, ILK, PKC, WNT, G-protein alpha-q, SP1, Frizzled",
575,NRF2 regulation of oxidative stress response,54,2.601E-02,8.416E-02,5.319E-02,1.407E-01,15,"MEK1(MAP2K1), GPX2, GSHB, eIF2AK3, c-Raf-1, GSTM3, Ubiquitin, PKC, PI3K reg class IA, RARalpha, AKT(PKB), GSTA3, PDK (PDPK1), NQO1, ERK1 (MAPK3)",2.601E-02,8.416E-02,19,"GPX2, GSHB, GSTM3, Ubiquitin, SOD1, PI3K reg class IA, RARalpha, MafK, AKT(PKB), GSTA3, PDK (PDPK1), ERK1 (MAPK3), Thioredoxin, eIF2AK3, DJ-1, PRDX1, PKC, GSTA1, NQO1",
576,Development_WNT/Beta-catenin signaling in organogenesis,30,2.603E-02,8.416E-02,2.947E-01,4.507E-01,7,"FoxN1, PLP1, MEPE, WNT, FGF10, Fam132a, MESP1",2.603E-02,8.416E-02,12,"FoxN1, Lef-1, PLP1, MEPE, FGF10, MESP1, PROP1, Tcf(Lef), FAM19A5, PIT1, WNT, Frizzled",
577,Colorectal cancer (general schema),30,2.603E-02,8.416E-02,3.368E-02,1.021E-01,10,"EGF, gp130, SHH, IL8RA, DLL1, WNT, IGF-1 receptor, IGF-1, Leptin, IL8RB",2.603E-02,8.416E-02,12,"EGF, gp130, DLL1, IGF-1 receptor, IL8RB, SHH, IL8RA, WNT, IGF-1, Leptin, Ephrin-B receptors, Frizzled",
578,G-protein signaling_RAC1 in cellular process,37,2.605E-02,8.495E-02,2.605E-02,8.495E-02,12,"BAIAP2, PAK2, PAK3, POR1, PAK1, p67-phox, PIP5KI, DMPK, CYFIP2, DBS, JNK(MAPK8-10), PARD6",6.013E-02,1.529E-01,13,"BAIAP2, PAK2, PAK3, PKC-zeta, Rac1, CYFIP2, DBS, PARD6, POR1, PAK1, PIP5KI, DMPK, JNK(MAPK8-10)",
579,Deregulation of PSD-95-dependent signaling in Huntington's disease,37,2.605E-02,8.495E-02,2.605E-02,8.495E-02,12,"p38alpha (MAPK14), Huntingtin, H-Ras, NR1, ERK1/2, c-Raf-1, SynGAP, p90Rsk, MEK6(MAP2K6), MEK1/2, p38 MAPK, ERK1 (MAPK3)",2.053E-01,3.573E-01,11,"Huntingtin, H-Ras, NR1, ERK1/2, NMDA receptor, NR2, MEK6(MAP2K6), ERK1 (MAPK3), SynGAP, NR2D, p38 MAPK",
580,Development_Delta-type opioid receptor mediated cardioprotection,37,2.605E-02,8.495E-02,2.605E-02,8.495E-02,12,"MEK1(MAP2K1), AKT1, G-protein alpha-i family, Kir6.1, c-Raf-1, Kir6.2, STAT3, PI3K reg class IA, SUR2, AKT(PKB), PDK (PDPK1), ERK1 (MAPK3)",2.053E-01,3.573E-01,11,"AKT1, Kir6.2, PI3K reg class IA, SUR2, AKT(PKB), PDK (PDPK1), ERK1 (MAPK3), Delta-type opioid receptor, PKC-delta, G-protein alpha-i family, Kir6.1",
581,Signal transduction_JNK pathway,47,2.606E-02,8.416E-02,1.309E-01,2.584E-01,12,"JunD/c-Fos, GRB2, TRAF2, LZK(MAP3K13), MLK2(MAP3K10), H-Ras, c-Raf-1, TRADD, AP-1, JunD, JNK(MAPK8-10), ZPK(MAP3K12)",2.606E-02,8.416E-02,17,"GRB2, LZK(MAP3K13), H-Ras, TRADD, Rac1, JunD, FasL(TNFSF6), ZPK(MAP3K12), MEKK4(MAP3K4), JunD/c-Fos, TRAF2, MLK2(MAP3K10), c-Jun, MKK7 (MAP2K7), AP-1, MEKK1(MAP3K1), JNK(MAPK8-10)",
582,HBV-dependent transcription regulation leading to HCC,25,2.627E-02,8.495E-02,2.627E-02,8.495E-02,9,"LXR-alpha/RXR-alpha, ESR1 (nuclear), SCD, FASN, EGR3, SREBP1 precursor, NUR77, LXR-alpha, Cyclin D1",9.469E-02,2.091E-01,9,"ESR1 (nuclear), SCD, EGR1, FASN, SREBP1 precursor, FasL(TNFSF6), EGR3, NUR77, Cyclin D1",
583,G-protein signaling_K-RAS regulation pathway,25,2.627E-02,8.495E-02,2.627E-02,8.495E-02,9,"EGF, GRB2, K-RAS, c-Raf-1, RalGDS, Epo receptor, CalDAG-GEFII, RGL2, Epo",4.063E-02,1.189E-01,10,"EGF, GRB2, A-Raf-1, CalDAG-GEFII, Epo, CALDAG-GEFI, K-RAS, RalGDS, Epo receptor, RGL2",
584,Putative pathways of hormone action in neurofibromatosis type 1,25,2.627E-02,8.495E-02,2.627E-02,8.495E-02,9,"ESR1 (nuclear), K-RAS, ESR1 (membrane), EGR3, GHR, PR (nuclear), PI3K reg class IA (p85), PI3K reg class IA, FosB",4.063E-02,1.189E-01,10,"ESR1 (nuclear), ESR1 (membrane), EGR1, PR (nuclear), PI3K reg class IA (p85), PI3K reg class IA, K-RAS, EGR3, GHR, FosB",
585,Resolution of inflammation in healing myocardial infarction,25,2.627E-02,8.495E-02,2.627E-02,8.495E-02,9,"MMP-1, ERK1/2, MGF, STAT3, G-CSF receptor, AKT(PKB), G-CSF, SDF-1, E-selectin",1.917E-01,3.400E-01,8,"ERK1/2, G-CSF receptor, AKT(PKB), SDF-1, E-selectin, MMP-1, MGF, G-CSF",
586,Deficient alpha-MSH signaling in melanoma,33,2.653E-02,8.548E-02,2.653E-02,8.548E-02,11,"p38alpha (MAPK14), ERK1/2, PKA-reg (cAMP-dependent), c-Raf-1, TYRP1, Rb protein, PI3K reg class IA, MEK1/2, AKT(PKB), PDK (PDPK1), p38 MAPK",3.312E-01,5.012E-01,9,"ERK1/2, PKA-reg (cAMP-dependent), Rac1, Rb protein, PI3K reg class IA, AKT(PKB), PDK (PDPK1), TYRP1, p38 MAPK",
587,Role of Neuregulin 1 and Thymosin beta-4 in myocardium regeneration after infarction,29,2.666E-02,8.548E-02,2.666E-02,8.548E-02,10,"GRB2, GAB1, Neuregulin 1, Thymosin beta-4, ILK, PI3K reg class IA (p85), ErbB2, ANP, PTEN, AKT(PKB)",1.035E-01,2.229E-01,10,"GRB2, GAB1, PI3K reg class IA (p85), ACTA1, ErbB2, ANP, AKT(PKB), Thymosin beta-4, ILK, PTEN",
588,Muscle contraction_Regulation of eNOS activity in endothelial cells,65,2.749E-02,8.819E-02,3.757E-02,1.109E-01,18,"NOSIP, G-protein alpha-i family, Esrra, KLF2, BDKRB2, ESR2 (nuclear), GATA-2, IP3 receptor, AP-1, Sirtuin1, Calmodulin, PI3K reg class IA, PLC-beta, eNOS, AKT(PKB), SP1, HSP90, FosB",2.749E-02,8.819E-02,22,"Esrra, KLF2, BDKRB2, ESR2 (nuclear), IP3 receptor, PI3K reg class IA, PLC-beta, AKT(PKB), HSP90, ARNT, NOSIP, G-protein alpha-i family, c-Jun, GATA-2, Bradykinin, AP-1, Sirtuin1, Calmodulin, eNOS, G-protein alpha-q, SP1, FosB",
589,Neurophysiological process_Constitutive and regulated NMDA receptor trafficking,65,2.749E-02,8.819E-02,3.757E-02,1.109E-01,18,"Chapsyn-110, Dopamine D1A receptor, cPKC (conventional), Calcineurin A (catalytic), SNAP-25, PP1-cat, G-protein alpha-i family, NR1, PKA-reg (cAMP-dependent), IP3 receptor, G-protein alpha-s, Calmodulin, PKC, SAP102, PLC-beta, Adenylate cyclase, MALS, MIB2",2.749E-02,8.819E-02,22,"Chapsyn-110, Calcineurin A (catalytic), PP1-cat, NR1, PKA-reg (cAMP-dependent), Syntaxin 1A, IP3 receptor, NMDA receptor, PLC-beta, NR2, Adenylate cyclase, MALS, MIB2, Dopamine D1A receptor, cPKC (conventional), G-protein alpha-i family, G-protein alpha-s, Calmodulin, PKC, SAP102, G-protein alpha-q, STEP",
590,Cell adhesion_Role of tetraspanins in the integrin-mediated cell adhesion,37,2.805E-02,8.938E-02,2.165E-01,3.626E-01,9,"CD81, PAK1, CD9, CD63, VIL2 (ezrin), FAK1, CD151, WASP, NAG-2",2.805E-02,8.938E-02,14,"CD81, Actin, Rac1, VIL2 (ezrin), CD151, WASP, NAG-2, CD82, PAK1, CD9, CD63, N-WASP, FAK1, Cofilin",
591,Immune response_Regulation of T cell function by CTLA-4,37,2.805E-02,8.938E-02,1.191E-01,2.445E-01,10,"CD80, GRB2, c-Fos, H-Ras, AP1G1, PI3K reg class IA (p85), CD3, SHP-1, AKT(PKB), PDK (PDPK1)",2.805E-02,8.938E-02,14,"GRB2, c-Fos, NF-AT1(NFATC2), H-Ras, AP1G1, PI3K reg class IA (p85), ZAP70, SHP-1, AKT(PKB), PDK (PDPK1), c-Jun, LAT, SHP-2, TCR alpha/beta",
592,Activation of osteoclast differentiation in bone lesions formation in multiple myeloma,27,2.822E-02,8.938E-02,4.290E-02,1.205E-01,9,"MEK1(MAP2K1), Syndecan-1, c-Fos, ERK1/2, CCR1, NFKBIA, IKK-beta, CCR5, p38 MAPK",2.822E-02,8.938E-02,11,"c-Fos, ERK1/2, CCR1, IKK (cat), IL-3, IKK-alpha, CCR5, Syndecan-1, NFKBIA, IKK-beta, p38 MAPK",
593,Translation_Regulation of translation initiation,27,2.822E-02,8.938E-02,4.290E-02,1.205E-01,9,"eIF6 (ITGB4BP), eIF1, eIF3S3, eIF1A, p70 S6 kinase1, eIF3S8, eIF4A, PDK (PDPK1), p70 S6 kinase2",2.822E-02,8.938E-02,11,"eIF6 (ITGB4BP), eIF4E, eIF3S3, eIF1A, PDK (PDPK1), eIF1, p70 S6 kinase1, eIF3S8, eIF4A, eIF5, p70 S6 kinase2",
594,Role of B cells in SLE,58,2.834E-02,8.938E-02,9.070E-02,2.014E-01,15,"CD80, MHC class II, ICOS-L, CD19, Btk, PI3K reg class IA, IFN-alpha, Bcl-2, Bcl-XL, Fc gamma RII beta, SHP-1, CD40(TNFRSF5), AKT(PKB), IL-6 receptor, CD40L(TNFSF5)",2.834E-02,8.938E-02,20,"MHC class II, ICOS-L, Bak, CD19, PI3K reg class IA, IFN-alpha, Bcl-XL, CD22, SHP-1, SHIP, AKT(PKB), ICOS, CD79 complex, Btk, Bcl-2, Fc gamma RII beta, CD40(TNFRSF5), miR-30a-5p, TCR alpha/beta, IL-6 receptor",
595,Immune response_IFN-gamma signaling via MAPK,51,2.885E-02,9.062E-02,6.594E-02,1.620E-01,14,"MEK1(MAP2K1), ZFP36(Tristetraprolin), ERK1/2, MED1, eIF4B, TIRAP (Mal), c-Raf-1, p90RSK1, MAPKAPK2, PHF8, MEK6(MAP2K6), MNK2(GPRK7), PGES2, p38 MAPK",2.885E-02,9.062E-02,18,"eIF4E, ERK1/2, MED1, TREX1, c-Jun/c-Fos, MAPKAPK2, MyD88, MEK6(MAP2K6), PGES2, MEKK4(MAP3K4), ZFP36(Tristetraprolin), c-Jun, eIF4B, TIRAP (Mal), PHF8, MEKK1(MAP3K1), MNK2(GPRK7), p38 MAPK",
596,Oxidative stress_Activation of NADPH oxidase,59,2.967E-02,9.410E-02,2.967E-02,9.410E-02,17,"cPKC (conventional), AKT1, ERK1/2, PAK1, p67-phox, IP3 receptor, PKC, PI3K reg class IA, PLC-beta, VAV-2, MEK1/2, VAV-3, p40-phox, AKT(PKB), PDK (PDPK1), p38 MAPK, PREX1",3.395E-02,1.036E-01,20,"AKT1, ERK1/2, PKC-zeta, Rac1, IP3 receptor, PI3K reg class IA, PLC-beta, VAV-2, AKT(PKB), PDK (PDPK1), BETA-PIX, cPKC (conventional), PKC-delta, PAK1, PKC, VAV-3, p40-phox, PI3K reg class IB (p101), p38 MAPK, PREX1",
597,Development_MicroRNA-dependent regulation of EMT,24,3.043E-02,9.511E-02,9.918E-01,1.000E+00,1,E-cadherin,3.043E-02,9.511E-02,10,"microRNA 200c, microRNA 200b, miR-141-3p, miR-200c-3p, miR-200b-5p, miR-200b-3p, E-cadherin, microRNA 141, microRNA 429, miR-429-3p",
598,Immune response_Sublytic effects of membrane attack complex,68,3.047E-02,9.615E-02,3.047E-02,9.615E-02,19,"AKT1, GRB2, eIF2AK3, G-protein alpha-i family, H-Ras, ERK1/2, c-Raf-1, IP3 receptor, MAPKAPK2, PKC, cPLA2, HSP27, MEK6(MAP2K6), GRP75, Bcl-XL, MEK1/2, eIF2S1, AKT(PKB), p38 MAPK",1.246E-01,2.542E-01,20,"AKT1, GRB2, H-Ras, ERK1/2, IP3 receptor, BAD, MAPKAPK2, cPLA2, MEK6(MAP2K6), GRP75, Bcl-XL, eIF2S1, AKT(PKB), eIF2AK3, G-protein alpha-i family, PKC, HSP27, C9, PI3K reg class IB (p101), p38 MAPK",
599,Development_WNT/Beta-catenin signaling in the nucleus,62,3.054E-02,9.511E-02,1.416E-01,2.728E-01,15,"LDB1, BAF53, GCN5, MED1, MED12, PYGO2, MEF2, TLE, DOT1, Dsh, WNT, SET8, JNK(MAPK8-10), EP400, p38 MAPK",3.054E-02,9.511E-02,21,"LDB1, Lef-1, GCN5, MED1, MED12, PYGO2, TLE, p15(PAF), DOT1, Dsh, EP400, Tcf(Lef), c-Jun, TBP, MEF2, WNT, SET8, JNK(MAPK8-10), p120-catenin, p38 MAPK, Frizzled",
600,Immune response _CCR3 signaling in eosinophils,77,3.069E-02,9.615E-02,3.069E-02,9.615E-02,21,"MEK1(MAP2K1), CCR3, G-protein alpha-i family, H-Ras, Myosin II, c-Raf-1, PAK1, p67-phox, MyHC, IP3 receptor, Hck, Calmodulin, cPLA2, MRLC, VAV-2, WASP, LIMK2, MELC, PDK (PDPK1), p38 MAPK, MLCK",5.618E-02,1.458E-01,24,"H-Ras, PKC-zeta, Rac1, IP3 receptor, Hck, CCL13, cPLA2, VAV-2, WASP, LIMK2, PDK (PDPK1), MLCK, CCR3, G-protein alpha-i family, Myosin II, PAK1, MyHC, Calmodulin, MEKK1(MAP3K1), MRLC, MELC, PI3K reg class IB (p101), p38 MAPK, Cofilin",
601,Development_VEGF signaling and activation,42,3.076E-02,9.615E-02,3.076E-02,9.615E-02,13,"MEK1(MAP2K1), c-Fos, ESR1 (nuclear), H-Ras, ERK1/2, c-Raf-1, I-kB, PKC, PI3K reg class IA, IKK-beta, AKT(PKB), SP1, E-selectin",7.807E-02,1.832E-01,14,"c-Fos, ESR1 (nuclear), H-Ras, ERK1/2, c-Jun/c-Fos, IKK (cat), I-kB, PI3K reg class IA, AKT(PKB), E-selectin, c-Jun, PKC, IKK-beta, SP1",
602,Transcription_FXR-regulated cholesterol and bile acids cellular transport,42,3.076E-02,9.615E-02,3.076E-02,9.615E-02,13,"SLC22A7, ABCG5, RAR-alpha/RXR-alpha, PXR, SHP, OSTalpha, MDR3, LRH1, ABCG5/ABCG8 heterodimer, PXR/RXR-alpha, ABCG8, SLC10A1, ABCC2",2.340E-01,3.851E-01,12,"ABCG5, LRH1, PXR/RXR-alpha, ABCG8, SLC10A1, SLC22A7, RAR-alpha/RXR-alpha, PXR, OSTalpha, MDR3, ABCG5/ABCG8 heterodimer, ABCC2",
603,Signal transduction_Angiotensin II/ AGTR1 signaling via TGF-beta 1 and SMADs,42,3.076E-02,9.615E-02,3.076E-02,9.615E-02,13,"E-cadherin, SREBP1 (nuclear), GRB2, ERK1/2, AGTR1, FASN, SREBP1 precursor, AP-1, ANP, JNK(MAPK8-10), AKT(PKB), SP1, p38 MAPK",1.412E-01,2.746E-01,13,"SREBP1 (nuclear), GRB2, ERK1/2, FASN, SREBP1 precursor, ANP, AKT(PKB), E-cadherin, AGTR1, AP-1, JNK(MAPK8-10), SP1, p38 MAPK",
604,Immune response_IL-11 signaling via JAK/STAT,34,3.085E-02,9.569E-02,7.432E-02,1.777E-01,10,"A-FABP, gp130, c-Fos, SP-B, STAT3, Bcl-2, RARalpha, Myeloblastin, Pim-3, MYOD",3.085E-02,9.569E-02,13,"gp130, c-Fos, MYF5, SP-B, IL11RA, RARalpha, CYP19, Pim-3, IL-11 receptor, sIL11-RA, Bcl-2, Myeloblastin, MYOD",
605,Development_BMP signaling in cardiac myogenesis,34,3.085E-02,9.569E-02,1.491E-01,2.806E-01,9,"GATA-4, BMP7, ID2, ANP, MEK6(MAP2K6), Bcl-XL, Cyclin D1, p38 MAPK, N-Myc",3.085E-02,9.569E-02,13,"GATA-4, ID2, ACTA1, ANP, MEK6(MAP2K6), Bcl-XL, BMP7, alpha-MHC, TAB1, SMAD1, Cyclin D1, p38 MAPK, N-Myc",
606,Immune response_Platelet activating factor/ PTAFR pathway signaling,55,3.145E-02,9.797E-02,3.145E-02,9.797E-02,16,"STAT2, Calcineurin A (catalytic), G-protein alpha-i family, PKA-reg (cAMP-dependent), NFKBIA, NF-AT, IP3 receptor, STAT3, MAPKAPK2, PI3K reg class IA, PLC-beta, Adenylate cyclase, Clathrin, AKT(PKB), Beta-arrestin1, p38 MAPK",5.910E-02,1.515E-01,18,"Calcineurin A (catalytic), NF-AT1(NFATC2), PKA-reg (cAMP-dependent), IP3 receptor, MAPKAPK2, PI3K reg class IA, PLC-beta, IKK-alpha, Adenylate cyclase, AKT(PKB), STAT2, G-protein alpha-i family, NFKBIA, NF-AT, G-protein alpha-q, Clathrin, Beta-arrestin1, p38 MAPK",
607,Main chemotherapy drugs and their action in SCLC cells,100,3.148E-02,9.797E-02,3.148E-02,9.797E-02,26,"SLC31A1, MEK1(MAP2K1), p38alpha (MAPK14), EGF, G-protein alpha-12 family, Aif, ERK1/2, Cyclin D, c-Raf-1, Glutaredoxin 1, p21, Cytochrome c, p70 S6 kinase1, ErbB2, Bcl-2, MDM2, FAK1, Bcl-XL, Cyclin D1, JNK(MAPK8-10), AKT(PKB), SP1, ABCG2, p70 S6 kinase2, p27KIP1, p38 MAPK",3.354E-01,5.065E-01,25,"SLC31A1, EGF, ERK1/2, p21, Cytochrome c, BAD, ErbB2, IKK-alpha, MDM2, Bcl-XL, AKT(PKB), p27KIP1, G-protein alpha-12 family, Aif, PKC-delta, Cyclin D, p70 S6 kinase1, Bcl-2, FAK1, Cyclin D1, JNK(MAPK8-10), SP1, ABCG2, p70 S6 kinase2, p38 MAPK",
608,Immune response_IL-16 signaling pathway,55,3.148E-02,9.744E-02,6.134E-02,1.551E-01,15,"cPKC (conventional), CCR3, CD9, RAG2, GABP beta1, IP3 receptor, PPP1R12B, PKC, FOXP3, IL-2R beta chain, Skp2/TrCP/FBXW, CCR5, AKT(PKB), p27KIP1, SDF-1",3.148E-02,9.744E-02,19,"IL-16 mature, IP3 receptor, N-terminal IL16, FOXP3, Skp2/TrCP/FBXW, CCR5, AKT(PKB), p27KIP1, IL-2R alpha chain, SDF-1, cPKC (conventional), HSC70, CCR3, CD9, GABP beta1, PPP1R12B, PKC, IL-2R beta chain, IL-16",
609,Regulation of lipid metabolism_Regulation of acetyl-CoA carboxylase 1 activity,18,3.164E-02,9.828E-02,3.164E-02,9.828E-02,7,"ACACA, SREBP1 (nuclear), AMPK beta subunit, AMPK alpha subunit, AMPK gamma subunit, CPT-1A, ACACB",2.104E-01,3.607E-01,6,"SREBP1 (nuclear), AMPK beta subunit, AMPK gamma subunit, CPT-1A, ACACB, AMPK alpha subunit",
610,TNF-alpha-induced inflammatory signaling in normal and asthmatic airway epithelium,38,3.197E-02,9.909E-02,3.197E-02,9.909E-02,12,"MEK1(MAP2K1), CCL17, c-Fos, H-Ras, ERK1/2, c-Raf-1, NFKBIA, I-kB, IKK-beta, STAT6, IL-4, p38 MAPK",7.301E-02,1.744E-01,13,"CCL17, c-Fos, H-Ras, ERK1/2, I-kB, IL-13, IL-4, c-Jun, NFKBIA, MEKK1(MAP3K1), IKK-beta, STAT6, p38 MAPK",
611,Neurophysiological process_ACM regulation of nerve impulse,48,3.202E-02,9.850E-02,4.162E-02,1.199E-01,14,"cPKC (conventional), Calcineurin A (catalytic), CACNA1H, G-protein alpha-i family, G-protein alpha-11, CACNA1C, PKA-reg (cAMP-dependent), G-protein alpha-q/11, ACM1, IP3 receptor, Calmodulin, PKC, PLC-beta, CACNA1I",3.202E-02,9.850E-02,17,"Calcineurin A (catalytic), CACNA1H, PKA-reg (cAMP-dependent), G-protein alpha-q/11, IP3 receptor, PLC-beta, cPKC (conventional), ACM2, G-protein alpha-i family, G-protein alpha-11, CACNA1C, ACM1, Calmodulin, PKC, G-protein alpha-q, CACNA1I, N-type Ca(II) channel alpha1B",
612,Development_Schema: Osteogenic and adipogenic differentiation of mesenchymal stem cells,21,3.256E-02,9.954E-02,3.291E-01,4.917E-01,5,"Insulin processed, BMP7, SHH, Rb protein, IGF-1",3.256E-02,9.954E-02,9,"WNT3A, Insulin processed, Rb protein, BMP7, SHH, WNT1, WNT10B, Parathyroid hormone, IGF-1",
613,Neurophysiological process_NMDA-dependent postsynaptic long-term potentiation in CA1 hippocampal neurons,82,3.269E-02,1.011E-01,3.269E-02,1.011E-01,22,"cAMP-GEFI, GRB2, c-Fos, H-Ras, NR1, ERK1/2, Protein kinase G, PKA-reg (cAMP-dependent), c-Raf-1, Adenylate cyclase type I, Ryanodine receptor 3, p90Rsk, IP3 receptor, GluR2, p70 S6 kinase1, Calmodulin, eNOS, MEK1/2, Guanylate Cyclase 1, soluble, AKT(PKB), PDK (PDPK1), ERK1 (MAPK3)",6.590E-02,1.625E-01,25,"cAMP-GEFI, GRB2, c-Fos, H-Ras, NR1, eIF4E, ERK1/2, PKA-reg (cAMP-dependent), PLC-beta1, IP3 receptor, NMDA receptor, NR2, Guanylate Cyclase 1, soluble, AKT(PKB), PDK (PDPK1), ERK1 (MAPK3), Protein kinase G, Adenylate cyclase type I, GluR2, 4E-BP1, p70 S6 kinase1, Calmodulin, GluR1, eNOS, G-protein alpha-q",
614,Nicotine / Beta-adrenergic signaling in lung cancer,34,3.298E-02,1.013E-01,3.298E-02,1.013E-01,11,"MEK1(MAP2K1), GRB2, G-protein alpha-i family, H-Ras, ERK1/2, PKA-reg (cAMP-dependent), c-Raf-1, G-protein alpha-s, Adenylate cyclase, AKT(PKB), PDK (PDPK1)",1.316E-01,2.614E-01,11,"GRB2, H-Ras, ERK1/2, PKA-reg (cAMP-dependent), BAD, Adenylate cyclase, AKT(PKB), PDK (PDPK1), G-protein alpha-i family, G-protein alpha-s, PI3K reg class IB (p101)",
615,Development_Oligodendrocyte differentiation from adult stem cells,51,3.329E-02,1.013E-01,3.329E-02,1.013E-01,15,"TR-alpha, FGFR3, PDGF-B, OATP-A, ERK1/2, PLP1, MCT8, SHH, p90Rsk, FGFR1, TR-beta, IGF-1 receptor, CNTN6, IGF-1, p38 MAPK",1.003E-01,2.177E-01,16,"TR-alpha, PDGF-B, ERK1/2, PLP1, FGFR1, TR-beta, IGF-1 receptor, FGFR3, OATP-A, MCT8, SHH, MAG, SMAD1, CNTN6, IGF-1, p38 MAPK",
616,Putative pathways of n-3 and n-6 fatty acids in obesity and type 2 diabetes,51,3.329E-02,1.013E-01,3.329E-02,1.013E-01,15,"ACACA, SREBP1 (nuclear), LXR-beta, c-Fos, Adiponectin, PKA-reg (cAMP-dependent), G-protein alpha-q/11, FASN, SREBP1 precursor, COX-1 (PTGS1), G-protein alpha-s, Adenylate cyclase, LXR-alpha, AKT(PKB), GPR120",1.674E-01,3.094E-01,15,"SREBP1 (nuclear), c-Fos, EGR1, PKA-reg (cAMP-dependent), GLUT4, G-protein alpha-q/11, FASN, SREBP1 precursor, Prostacyclin receptor, Adenylate cyclase, AKT(PKB), LXR-beta, Adiponectin, G-protein alpha-s, GPR120",
617,Differences between Langerhans cells and dermal dendritic cells in allergic contact dermatitis,22,3.334E-02,1.013E-01,3.334E-02,1.013E-01,8,"E-cadherin, CD80, MHC class II, ICOS-L, CCR7, CD40(TNFRSF5), SDF-1, CD40L(TNFSF5)",1.065E-01,2.269E-01,8,"MHC class II, ICOS-L, ICOS, SDF-1, E-cadherin, CCR7, CD40(TNFRSF5), TCR alpha/beta",
618,Regulation of Adenylate cyclase and IMPA1 by lithium in major depressive disorder,22,3.334E-02,1.013E-01,3.334E-02,1.013E-01,8,"P2X2, G-protein alpha-i family, PKA-reg (cAMP-dependent), Adenylate cyclase type I, Alpha-2A adrenergic receptor, Adenylate cyclase type II, Adenylate cyclase, GRK2",1.065E-01,2.269E-01,8,"PKA-reg (cAMP-dependent), Adenylate cyclase type II, Adenylate cyclase, GRK2, P2X2, G-protein alpha-i family, Adenylate cyclase type I, Alpha-2A adrenergic receptor",
619,Development_H3K9 demethylases in pluripotency maintenance of stem cells,22,3.334E-02,1.013E-01,3.334E-02,1.013E-01,8,"AKT1, SETDB1, TCL1A, GATA-4, HP1, NANOG, TIF1-beta, AKT(PKB)",4.425E-02,1.255E-01,9,"AKT1, TCL1A, GATA-4, HP1, TIF1-beta, AKT(PKB), SETDB1, T brachyury protein, NANOG",
620,Cell cycle_Initiation of mitosis,26,3.389E-02,1.021E-01,3.389E-02,1.021E-01,9,"p90RSK1, AP-2A, USF1, CDK7, Cyclin H, Wee1, CAK complex, AKT(PKB), MAT1",5.294E-02,1.415E-01,10,"USF1, CDK7, Wee1, CAK complex, AKT(PKB), c-Myc, AP-2A, Cyclin H, Kinase MYT1, MAT1",
621,Pioglitazone and Rosiglitazone in treatment of type 2 diabetes and metabolic syndrome X,26,3.389E-02,1.021E-01,3.389E-02,1.021E-01,9,"A-FABP, Adiponectin, Insulin processed, ABCG1, GPD1, RXRA, CD36, Insulin receptor, LXR-alpha",1.168E-01,2.422E-01,9,"Insulin processed, ABCG1, GLUT4, Resistin, Insulin receptor, Adiponectin, GPD1, RXRA, CD36",
622,CAR signaling via cross-talk / Human Version,26,3.389E-02,1.021E-01,3.389E-02,1.021E-01,9,"CYP2C8, SREBP1 (nuclear), CAR/RXR-alpha, ESR1 (nuclear), G6PT, RXRA, CAR, ACOX1, CYP3A4",3.795E-01,5.508E-01,7,"SREBP1 (nuclear), ESR1 (nuclear), CAR, ACOX1, CAR/RXR-alpha, RXRA, CYP2B6",
623,Chemotaxis_CXCR3-A signaling,69,3.513E-02,1.048E-01,3.513E-02,1.048E-01,19,"MIG, GRB2, ROR-gamma, Granzyme B, H-Ras, ERK1/2, c-Raf-1, p90RSK1, IP3 receptor, Calmodulin, CD3, FAK1, Occludin, MEK1/2, Clathrin, AKT(PKB), Beta-arrestin1, PDK (PDPK1), GRK2",8.786E-02,1.999E-01,21,"GRB2, Granzyme B, H-Ras, ERK1/2, Perforin, Rac1, IP3 receptor, ZAP70, AKT(PKB), PDK (PDPK1), GRK2, ROR-gamma, LAT, CXCR3, Calmodulin, FAK1, Occludin, Clathrin, Beta-arrestin1, PI3K reg class IB (p101), TCR alpha/beta",
624,Mitogenic action of ESR1 (membrane) in breast cancer,47,3.515E-02,1.048E-01,3.515E-02,1.048E-01,14,"c-Fos, ESR1 (nuclear), H-Ras, ERK1/2, ErbB3, ESR1 (membrane), c-Raf-1, ErbB2, IGF-1 receptor, MEK1/2, Cyclin D1, AKT(PKB), PDK (PDPK1), p27KIP1",2.608E-01,4.191E-01,13,"c-Fos, ESR1 (nuclear), H-Ras, ERK1/2, ErbB3, ESR1 (membrane), ErbB2, IGF-1 receptor, AKT(PKB), PDK (PDPK1), p27KIP1, c-Myc, Cyclin D1",
625,Development_Mu-type opioid receptor signaling,38,3.535E-02,1.061E-01,2.412E-01,3.913E-01,9,"Tuberin, G-protein alpha-i family, IP3 receptor, p70 S6 kinase1, VAV-2, 4E-BP2, JNK(MAPK8-10), AKT(PKB), PDK (PDPK1)",3.535E-02,1.061E-01,14,"Tuberin, Rac1, IP3 receptor, VAV-2, 4E-BP2, AKT(PKB), PDK (PDPK1), G-protein alpha-i family, MKK7 (MAP2K7), 4E-BP1, p70 S6 kinase1, MEKK1(MAP3K1), JNK(MAPK8-10), PI3K reg class IB (p101)",
